### ISSUE TITLE
can not access from other machines in the LAN

### ISSUE THREAD

**Issue by SABERYJS** [metallb/metallb#2630]
### MetalLB Version

0.14.8

### Deployment method

Charts

### Main CNI

flannel

### Kubernetes Version

1.27.0

### Describe the bug

according to official document,i installed metallb,i can not access nginx ingress controller from other machine from lan，but  if i curl from current  k8s node (only one node),it is ok
```
from  k8s node,ok
[root@masternode ~]# curl  192.168.0.30
<html>
<head><title>404 Not Found</title></head>
<body>
<center><h1>404 Not Found</h1></center>
<hr><center>nginx</center>
</body>
</html>

```
failed from lan
```
C:\Windows\System32>curl  192.168.0.30
curl: (28) Failed to connect to 192.168.0.30 port 80 after 21035 ms: Could not connect to server

```
nginx-ingress server 
```
[root@masternode ~]# kubectl get svc -A
NAMESPACE                         NAME                                 TYPE           CLUSTER-IP       EXTERNAL-IP    PORT(S)                      AGE
cattle-fleet-system               gitjob                               ClusterIP      10.110.50.14     <none>         80/TCP                       22h
cattle-fleet-system               monitoring-fleet-controller          ClusterIP      10.108.102.119   <none>         8080/TCP                     22h
cattle-fleet-system               monitoring-gitjob                    ClusterIP      10.102.243.117   <none>         8081/TCP                     22h
cattle-provisioning-capi-system   capi-webhook-service                 ClusterIP      10.101.43.168    <none>         443/TCP                      22h
cattle-system                     rancher-webhook                      ClusterIP      10.108.238.226   <none>         443/TCP                      22h
cert-manager                      cert-manager                         ClusterIP      10.109.82.141    <none>         9402/TCP                     23h
cert-manager                      cert-manager-cainjector              ClusterIP      10.101.68.50     <none>         9402/TCP                     23h
cert-manager                      cert-manager-webhook                 ClusterIP      10.100.77.22     <none>         443/TCP,9402/TCP             23h
default                           kubernetes                           ClusterIP      10.96.0.1        <none>         443/TCP                      23h
ingress-nginx                     ingress-nginx-controller             LoadBalancer   10.109.28.144    192.168.0.30   80:30178/TCP,443:32553/TCP   22h
ingress-nginx                     ingress-nginx-controller-admission   ClusterIP      10.108.167.32    <none>         443/TCP                      22h
kube-system                       kube-dns                             ClusterIP      10.96.0.10       <none>         53/UDP,53/TCP,9153/TCP       23h
metallb                           metallb-webhook-service              ClusterIP      10.101.5.34      <none>         443/TCP                      19h
rancher                           rancher                              ClusterIP      10.110.127.45    <none>         80/TCP,443/TCP               22h

```

most importantly, ARP is ok , but  no tcp packet from k8s node back, tcpdump command:
`tcpdump -i  eno1  host 192.168.0.30` 

log show:
```
tcpdump: verbose output suppressed, use -v or -vv for full protocol decode
listening on eno1, link-type EN10MB (Ethernet), capture size 262144 bytes
11:16:00.579706 IP 192.168.0.101.53183 > 192.168.0.30.http: Flags [S], seq 1333659885, win 65535, options [mss 1460,nop,wscale 8,nop,nop,sackOK], length 0
11:16:01.592313 IP 192.168.0.101.53183 > 192.168.0.30.http: Flags [S], seq 1333659885, win 65535, options [mss 1460,nop,wscale 8,nop,nop,sackOK], length 0
11:16:03.602919 IP 192.168.0.101.53183 > 192.168.0.30.http: Flags [S], seq 1333659885, win 65535, options [mss 1460,nop,wscale 8,nop,nop,sackOK], length 0
11:16:05.248710 ARP, Request who-has 192.168.0.30 (08:94:ef:05:cb:60 (oui Unknown)) tell 192.168.0.101, length 46
11:16:05.248868 ARP, Reply 192.168.0.30 is-at 08:94:ef:05:cb:60 (oui Unknown), length 46
11:16:07.611448 IP 192.168.0.101.53183 > 192.168.0.30.http: Flags [S], seq 1333659885, win 65535, options [mss 1460,nop,wscale 8,nop,nop,sackOK], length 0
11:16:15.620851 IP 192.168.0.101.53183 > 192.168.0.30.http: Flags [S], seq 1333659885, win 65535, options [mss 1460,nop,wscale 8,nop,nop,sackOK], length 0
11:16:30.780350 IP 192.168.0.101.53190 > 192.168.0.30.http: Flags [S], seq 3793204421, win 65535, options [mss 1460,nop,wscale 8,nop,nop,sackOK], length 0
11:16:31.795506 IP 192.168.0.101.53190 > 192.168.0.30.http: Flags [S], seq 3793204421, win 65535, options [mss 1460,nop,wscale 8,nop,nop,sackOK], length 0
11:16:33.802984 IP 192.168.0.101.53190 > 192.168.0.30.http: Flags [S], seq 3793204421, win 65535, options [mss 1460,nop,wscale 8,nop,nop,sackOK], length 0
11:16:37.817916 IP 192.168.0.101.53190 > 192.168.0.30.http: Flags [S], seq 3793204421, win 65535, options [mss 1460,nop,wscale 8,nop,nop,sackOK], length 0
11:16:38.745196 ARP, Request who-has 192.168.0.30 (08:94:ef:05:cb:60 (oui Unknown)) tell 192.168.0.101, length 46
11:16:38.745297 ARP, Reply 192.168.0.30 is-at 08:94:ef:05:cb:60 (oui Unknown), length 46
11:16:45.821177 IP 192.168.0.101.53190 > 192.168.0.30.http: Flags [S], seq 3793204421, win 65535, options [mss 1460,nop,wscale 8,nop,nop,sackOK], length 0
11:17:26.706312 IP 192.168.0.108 > 192.168.0.30: ICMP echo request, id 39952, seq 7680, length 44
11:17:31.429065 ARP, Request who-has 192.168.0.30 (08:94:ef:05:cb:60 (oui Unknown)) tell 192.168.0.108, length 46
11:17:31.429215 ARP, Reply 192.168.0.30 is-at 08:94:ef:05:cb:60 (oui Unknown), length 46
```

from windows shell,run `arp -a`, show:
```
C:\Windows\System32>arp -a

接口: 192.168.119.1 --- 0xa
  Internet 地址         物理地址              类型
  192.168.119.254       00-50-56-e2-3b-f3     动态
  224.0.0.2             01-00-5e-00-00-02     静态
  224.0.0.22            01-00-5e-00-00-16     静态
  224.0.0.251           01-00-5e-00-00-fb     静态
  224.0.0.252           01-00-5e-00-00-fc     静态

接口: 192.168.0.101 --- 0xc
  Internet 地址         物理地址              类型
  192.168.0.1           34-96-72-8a-d1-b1     动态
  192.168.0.30          08-94-ef-05-cb-60     动态
  192.168.0.118         08-94-ef-05-cb-60     动态
  224.0.0.2             01-00-5e-00-00-02     静态
  224.0.0.22            01-00-5e-00-00-16     静态
  224.0.0.251           01-00-5e-00-00-fb     静态
  224.0.0.252           01-00-5e-00-00-fc     静态
  239.255.255.250       01-00-5e-7f-ff-fa     静态

接口: 192.168.112.1 --- 0x11
  Internet 地址         物理地址              类型
  192.168.112.254       00-50-56-e1-2a-82     动态
  224.0.0.2             01-00-5e-00-00-02     静态
  224.0.0.22            01-00-5e-00-00-16     静态
  224.0.0.251           01-00-5e-00-00-fb     静态
  224.0.0.252           01-00-5e-00-00-fc     静态
```

ARP ok, ARP Replyed

K8s node received  SYN packet, but no packet resp to client

firewalld has been closed

### To Reproduce

install metallb  by  helm

```
metallb                           metallb-controller-7fd955f9dd-4v9bd                 1/1     Running     0             19h
metallb                           metallb-speaker-tgfg8                               4/4     Running     0             19h

```

config
```

apiVersion: metallb.io/v1beta1
kind: IPAddressPool
metadata:
  name: ippool
  namespace: metallb
spec:
  addresses:
  - 192.168.0.30-192.168.0.40

---

apiVersion: metallb.io/v1beta1
kind: L2Advertisement
metadata:
  name: l2adver
  namespace: metallb
spec:
  ipAddressPools:
  interfaces:
  - eno1
~    
```

### Expected Behavior

access from lan  failed

### Additional Context

OS is  centos7, Bare Metal not vm
```
Linux masternode 3.10.0-1160.119.1.el7.x86_64 #1 SMP Tue Jun 4 14:43:51 UTC 2024 x86_64 x86_64 x86_64 GNU/Linux
```

Cni plugin is Flannel

```
kube-flannel                      kube-flannel-ds-jfwzh                               1/1     Running     0             4h41m
```

### I've read and agree with the following

- [X] I've checked all open and closed issues and my request is not there.
- [X] I've checked all open and closed pull requests and my request is not there.

### I've read and agree with the following

- [X] I've checked all open and closed issues and my issue is not there.
- [X] This bug is reproducible when deploying MetalLB from the main branch
- [X] I have read the [troubleshooting guide](https://metallb.universe.tf/troubleshooting/) and I am still not able to make it work
- [X] I checked the logs and MetalLB is not discarding the configuration as not valid
- [X] I enabled the debug logs, collected the information required from the cluster using the [collect script](https://raw.githubusercontent.com/metallb/metallb/main/troubleshooting/collect.sh) and will attach them to the issue
- [X] I will provide the definition of my service and the related endpoint slices and attach them to this issue

**Comment by Abiorh001** [comment]
I encountered a similar issue where I could connect to the load balancer IP within the Kubernetes cluster, but not from outside it, even though both the cluster and my machine were on the same LAN. To resolve this, I installed the Bird router on my machine and used Calico CNI with BGP to broadcast the load balancer IP. I created a BGP peer using the Bird router ASN and configured it with the IPs and ASNs of all the nodes in the cluster. This setup allowed the load balancer IP range to be advertised through the Bird router’s routing table, enabling me to access the app from my host outside the cluster using the load balancer IP.

Currently, this works only from the machine running the Bird router, but I am working on a solution to ensure that all devices on my LAN can access the load balancer IP.

**Comment by diogoleal** [comment]
I had the same problem, and I resolved it by removing the label `node.kubernetes.io/exclude-from-external-load-balancers` from the nodes.

You can read more about this label [here](https://kubernetes.io/docs/reference/labels-annotations-taints/#node-kubernetes-io-exclude-from-external-load-balancers).

**Comment by sudomateo** [comment]
> I had the same problem, and I resolved it by removing the label `node.kubernetes.io/exclude-from-external-load-balancers` from the nodes.
> 
> You can read more about this label [here](https://kubernetes.io/docs/reference/labels-annotations-taints/#node-kubernetes-io-exclude-from-external-load-balancers).

I was hopeful that this would resolve my woes when I read about it in many different places but it did not. I documented my struggle in https://github.com/metallb/metallb/issues/2676#issuecomment-2638014348.

**Comment by fedepaol** [comment]
if arp works, the problem is likely in your network / cni. Closing as non metallb issue.
I'd suggest checking reverse path filtering as it _might_ be the issue.
