### ISSUE TITLE
TCP connection timeout after sometime when using externaltrafficpolicy:local and metalb controller.

### ISSUE THREAD

**Issue by akshaysharama** [metallb/metallb#2561]
### MetalLB Version

v0.14.5

### Deployment method

Charts

### Main CNI

flannel

### Kubernetes Version

v1.26.15+k3s1

### Cluster Distribution

k3s

### Describe the bug

_I have deployed a microservice(single instance) on a 3 node cluster, each node as a master/worker.
Application is up and running, have a svc with loadbalancer(External IP).

when deploying freshly, all traffic on the external loadbalancer IP is running fine, but after sometime I could see traffic is stopped, tcp connection timeout on the loadbalancer ip: port.

After debugging, I could see, when setup is fresh, all nodes have iptables related to health check and the node which has instance running has some iptables to support trafficpolicy I guess.

but later on, if i do rolling update or instance get deleted and move to other node, could see the drop iptables on the nodes where the instance is not scheduled.

How this drop iptables rules came?
externaltrafficpolicy: local, then traffic should reach to the node where instance is running, but packet is getting dropped hence it is reaching to the other node when iptable rules are dropped. so why the traffic is reaching to the node with no instance?_

_l
node-1:~ # iptables -L | grep 192.168.64.128
DROP tcp -- anywhere 192.168.64.128 /* services/controller-3:x has no local endpoints */ tcp dpt:gsmp-x

node-0:~ # iptables -L | grep 192.168.64.128
DROP tcp -- anywhere 192.168.64.128 /* services/controller-3:x has no local endpoints */ tcp dpt:gsmp-x

node-2:~ # iptables -L | grep 192.168.64.128
(no rule)_

**above rules, likewise for other Lbs as well

Error:
{"level":"error","timestamp":1728416020520.091,"caller":"ancp.git@v1.4.0-33309983/client.go:66","short_message":"connection failed: dial tcp 192.168.64.128:6068: connect: connection timed out","logging_lib_version":"2.0.0","time_zone":"UTC(+0s)","a4_pod_name":"4901708dc8f4","log_type":"APPLICATION"}
2024/10/08 19:33:40 failed to create client for 192.168.64.128: dial tcp 192.168.64.128:6068: connect:**

**svc:
node-1:~ # sudo kubectl get svc -A | grep my-controller
services      my-controller-1                                 LoadBalancer   192.168.252.204   192.168.64.129   6068:31299/TCP                                                                  10d
services      my-controller-2                                 LoadBalancer   192.168.255.64    192.168.64.131   6068:30083/TCP                                                                  10d
services      my-controller-3                                 LoadBalancer   192.168.255.74    192.168.64.128   6068:30655/TCP                                                                  10d
services      my-controller-4                                 LoadBalancer   192.168.252.255   192.168.64.130   6068:31468/TCP                                                                  10d
services      my-controller-headless                          ClusterIP      None              <none>           8081/TCP,80/TCP                                                                 10d**

### To Reproduce

deploy single instance of an application 
create a svc with externaltraffic policy as local and metallb

### Expected Behavior

traffic should reach to the node where the instance is schduled.

### Additional Context

we have observed this issue is not seeing intially but after some gap or some time, the tcp timeout is coming.

### I've read and agree with the following

- [X] I've checked all open and closed issues and my request is not there.
- [X] I've checked all open and closed pull requests and my request is not there.

### I've read and agree with the following

- [X] I've checked all open and closed issues and my issue is not there.
- [X] This bug is reproducible when deploying MetalLB from the main branch
- [X] I have read the [troubleshooting guide](https://metallb.universe.tf/troubleshooting/) and I am still not able to make it work
- [X] I checked the logs and MetalLB is not discarding the configuration as not valid
- [X] I enabled the debug logs, collected the information required from the cluster using the [collect script](https://raw.githubusercontent.com/metallb/metallb/main/troubleshooting/collect.sh) and will attach them to the issue
- [X] I will provide the definition of my service and the related endpoint slices and attach them to this issue

**Comment by akshaysharama** [comment]
@fedepaol @danderson @cyclinder @karampok , can you please help here?

**Comment by akshaysharama** [comment]
**If you see, below logs.. metallb speaker logs, reconsiling is happening. when the pod/instance is scheduled on node-0
but the traffic is reaching to node-3 (not sure why).

checked svc endpoints, pod health.. everything is up and running. ( no restarts of the pod) and traffic was working for a day then suddenly it stopped working and checked traffic is reaching to node-2 now.**

14:50:34.226141 52:54:00:9d:47:8a > e8:c5:7a:d6:0c:19, ethertype 802.1Q (0x8100), length 78: vlan 16, p 0, ethertype IPv4, 192.168.66.33.55408 > 192.168.64.128.6068: Flags [S], seq 3354532105, win 64240, options [mss 1460,sackOK,TS val 2032431007 ecr 0,nop,wscale 7], length 0
14:50:34.227481 e8:c5:7a:d6:0c:19 > 52:54:00:9d:47:8a, ethertype 802.1Q (0x8100), length 106: vlan 16, p 7, ethertype IPv4, 192.168.65.22 > 192.168.66.33: ICMP time exceeded in-transit, length 68

tcpdump of node-3

14:51:51.663781 eth5 In IP 192.168.66.33.45288 > 192.168.64.128.6068: Flags [S], seq 2466323344, win 64240, options [mss 1460,sackOK,TS val 2032524227 ecr 0,nop,wscale 7], length 0
14:51:51.663781 vlan4074.5 In IP 192.168.66.33.45288 > 192.168.64.128.6068: Flags [S], seq 2466323344, win 64240, options [mss 1460,sackOK,TS val 2032524227 ecr 0,nop,wscale 7], length 0
14:51:51.663847 vlan4074.5 Out IP 192.168.66.33.45288 > 192.168.64.128.6068: Flags [S], seq 2466323344, win 64240, options [mss 1460,sackOK,TS val 2032524227 ecr 0,nop,wscale 7], length 0
14:51:51.663855 eth5 Out IP 192.168.66.33.45288 > 192.168.64.128.6068: Flags [S], seq 2466323344, win 64240, options [mss 1460,sackOK,TS val 2032524227 ecr 0,nop,wscale 7], length 0

Speaker logs:

{"caller":"service_controller.go:134","controller":"ServiceReconciler","enqueueing":"services/controller-3","epslice":"{"metadata":{"name":"-controller-3-d2rtt","generateName":"-controller-3-","namespace":"services","uid":"e99d06c4-71ee-488a-8568-9cbdca1e66bb","resourceVersion":"45170081","generation":27,"creationTimestamp":"2024-10-08T12:48:14Z","labels":{"app.kubernetes.io/instance":"-controller","app.kubernetes.io/managed-by":"Helm","app.kubernetes.io/name":"-controller","app.kubernetes.io/version":"1.6.0-0.ftth79942.34855950","endpointslice.kubernetes.io/managed-by":"endpointslice-controller.k8s.io","helm.sh/chart":"-controller-1.6.0-0.ftth79942.34855950","kubernetes.io/service-name":"-controller-3"},"ownerReferences":[{"apiVersion":"v1","kind":"Service","name":"-controller-3","uid":"aaa46636-e198-4796-9d68-ddb6d2f6dfdd","controller":true,"blockOwnerDeletion":true}],"managedFields":[{"manager":"k3s","operation":"Update","apiVersion":"discovery.k8s.io/v1","time":"2024-10-08T13:39:45Z","fieldsType":"FieldsV1","fieldsV1":{"f:addressType":{},"f:endpoints":{},"f:metadata":{"f:generateName":{},"f:labels":{".":{},"f:app.kubernetes.io/instance":{},"f:app.kubernetes.io/managed-by":{},"f:app.kubernetes.io/name":{},"f:app.kubernetes.io/version":{},"f:endpointslice.kubernetes.io/managed-by":{},"f:helm.sh/chart":{},"f:kubernetes.io/service-name":{}},"f:ownerReferences":{".":{},"k:{\"uid\":\"aaa46636-e198-4796-9d68-ddb6d2f6dfdd\"}":{}}},"f:ports":{}}}]},"addressType":"IPv4","endpoints":[{"addresses":["192.168.248.135"],"conditions":{"ready":true,"serving":true,"terminating":false},"targetRef":{"kind":"Pod","namespace":"services","name":"-controller-66949c74c5-kdb65","uid":"eb3ec071-6ad7-48db-8adc-547f100294ac"},"nodeName":"node-0"}],"ports":[{"name":"ancp","protocol":"TCP","port":6068}]}","level":"debug","ts":"2024-10-09T14:33:33Z"}
{"caller":"service_controller.go:134","controller":"ServiceReconciler","enqueueing":"services/controller-1","epslice":"{"meta data":{"name":"-controller-1-wjcf6","generateName":"-controller-1-","namespace":"services","uid":" 963f2a40-b595-445e-a928-19033d1f6d32","resourceVersion":"45170083","generation":27,"creationTimestamp":"2024-10-08T12:48:14Z","label s":{"app.kubernetes.io/instance":"-controller","app.kubernetes.io/managed-by":"Helm","app.kubernetes.io/name":"pao-msan -ancp-controller","app.kubernetes.io/version":"1.6.0-0.ftth79942.34855950","endpointslice.kubernetes.io/managed-by":"endpointslice-contr oller.k8s.io","helm.sh/chart":"-controller-1.6.0-0.ftth79942.34855950","kubernetes.io/service-name":"-controll er-1"},"ownerReferences":[{"apiVersion":"v1","kind":"Service","name":"-controller-1","uid":"cc6b54ae-c97c-451a-a4 fd-f9ef591297bd","controller":true,"blockOwnerDeletion":true}],"managedFields":[{"manager":"k3s","operation":"Update","apiVersio n":"discovery.k8s.io/v1","time":"2024-10-08T13:39:45Z","fieldsType":"FieldsV1","fieldsV1":{"f:addressType":{},"f:endpoints":{}, "f:metadata":{"f:generateName":{},"f:labels":{".":{},"f:app.kubernetes.io/instance":{},"f:app.kubernetes.io/managed-by":{},"f:app.k ubernetes.io/name":{},"f:app.kubernetes.io/version":{},"f:endpointslice.kubernetes.io/managed-by":{},"f:helm.sh/chart":{},"f:kubernetes. io/service-name":{}},"f:ownerReferences":{".":{},"k:{\"uid\":\"cc6b54ae-c97c-451a-a4fd-f9ef591297bd\"}":{}}},"f:ports":{}}}]},\ "addressType":"IPv4","endpoints":[{"addresses":["192.168.248.135"],"conditions":{"ready":true,"serving":true,"terminating":fals e},"targetRef":{"kind":"Pod","namespace":"services","name":"-controller-66949c74c5-kdb65","uid":"eb3ec071-6ad7 -48db-8adc-547f100294ac"},"nodeName":"node-0"}],"ports":[{"name":"ancp","protocol":"TCP","port":6068}]}" ,"level":"debug","ts":"2024-10-09T14:33:34Z"}
{"caller":"service_controller_reload.go:98","controller":"ServiceReconciler - reprocessAll","level":"debug","reprocessing service":"{"kind":" Service","apiVersion":"v1","metadata":{"name":"-controller-1","namespace":"services","uid":"cc6b54ae-c97c-451 a-a4fd-f9ef591297bd","resourceVersion":"45169969","creationTimestamp":"2024-10-08T12:48:14Z","labels":{"app.kubernetes.io/instance" :"-controller","app.kubernetes.io/managed-by":"Helm","app.kubernetes.io/name":"-controller","app.kubernetes .io/version":"1.6.0-0.ftth79942.34855950","helm.sh/chart":"-controller-1.6.0-0.ftth79942.34855950"},"annotations":{"field .cattle.io/publicEndpoints":"[{\"addresses\":[\"192.168.64.129\"],\"port\":6068,\"protocol\":\"TCP\",\"serviceName\":\ \"services:-controller-1\",\"allNodes\":false}]","meta.helm.sh/release-name":"-controller","meta.helm .sh/release-namespace":"services","metallb.universe.tf/address-pool":"my-application","metallb.universe.tf/ip-allocated-from-pool":\ "my-application"},"managedFields":[{"manager":"agent","operation":"Update","apiVersion":"v1","time":"2024-10-08T12:48:14Z","f ieldsType":"FieldsV1","fieldsV1":{"f:metadata":{"f:annotations":{"f:field.cattle.io/publicEndpoints":{}}}}},{"manager":"controller ","operation":"Update","apiVersion":"v1","time":"2024-10-08T12:48:14Z","fieldsType":"FieldsV1","fieldsV1":{"f:metadata":{" f:annotations":{"f:metallb.universe.tf/ip-allocated-from-pool":{}}},"f:status":{"f:loadBalancer":{"f:ingress":{}}}},"subresource":"s tatus"},{"manager":"helm","operation":"Update","apiVersion":"v1","time":"2024-10-08T12:48:14Z","fieldsType":"FieldsV1","fi eldsV1":{"f:metadata":{"f:annotations":{".":{},"f:meta.helm.sh/release-name":{},"f:meta.helm.sh/release-namespace":{},"f:metallb.uni verse.tf/address-pool":{}},"f:labels":{".":{},"f:app.kubernetes.io/instance":{},"f:app.kubernetes.io/managed-by":{},"f:app.kubernetes. io/name":{},"f:app.kubernetes.io/version":{},"f:helm.sh/chart":{}}},"f:spec":{"f:allocateLoadBalancerNodePorts":{},"f:externalTrafficP olicy":{},"f:internalTrafficPolicy":{},"f:ports":{".":{},"k:{\"port\":6068,\"protocol\":\"TCP\"}":{".":{},"f:name":{},\ "f:port":{},"f:protocol":{},"f:targetPort":{}}},"f:selector":{},"f:sessionAffinity":{},"f:type":{}}}}]},"spec":{"ports":[{"name\ ":"ancp","protocol":"TCP","port":6068,"targetPort":6068,"nodePort":31520}],"selector":{"app.kubernetes.io/instance":"pao-msan-a ncp-controller","app.kubernetes.io/name":"-controller"},"clusterIP":"192.168.254.160","clusterIPs":["192.168.254.160"] ,"type":"LoadBalancer","sessionAffinity":"None","externalTrafficPolicy":"Local","healthCheckNodePort":32635,"ipFamilies":["IPv4 "],"ipFamilyPolicy":"SingleStack","allocateLoadBalancerNodePorts":true,"internalTrafficPolicy":"Cluster"},"status":{"loadBalancer\ ":{"ingress":[{"ip":"192.168.64.129"}]}}}","ts":"2024-10-09T14:33:34Z"}
{"caller":"bgp_controller.go:152","event":"skipping should announce bgp","ips":["192.168.64.129"],"level":"debug","pool":"my-application","protoc ol":"bgp","reason":"pool not matching my node","service":"services/controller-1","ts":"2024-10-09T14:33:35Z"}
{"caller":"layer2_controller.go:110","event":"shouldannounce","ips":["192.168.64.129"],"level":"debug","nodes":["node-0"] ,"pool":"my-application","protocol":"l2","service":"services/controller-1","ts":"2024-10-09T14:33:35Z"}
"IPAddressPool","apiVersion":"metallb.io/v1beta1","metadata":{"name":"dpu-driver-ancp-dpu-adt","namespace":"metal-lb","uid":"6 https://github.com/kubernetes/kubernetes/commit/a1f0e3519c8f9f802ce02ee1b14b64dcfc8b4944-94ef-4306-b139-6ca3fd5058a6","resourceVersion":"36994686","generation":1,"creationTimestamp":"2024-09-26T11:53:17Z","labels\ ":{"app.kubernetes.io/instance":"metal-lb","app.kubernetes.io/managed-by":"Helm","app.kubernetes.io/name":"metal-lb","app.kubernete s.io/version":"1.7.0-32464170","helm.sh/chart":"metal-lb-1.7.0-32464170"},"annotations":{"meta.helm.sh/release-name":"metal-lb","m eta.helm.sh/release-namespace":"metal-lb"},"managedFields":[{"manager":"helm","operation":"Update","apiVersion":"metallb.io/v1be ta1","time":"2024-09-26T11:53:17Z","fieldsType":"FieldsV1","fieldsV1":{"f:metadata":{"f:annotations":{".":{},"f:meta.helm.sh/r elease-name":{},"f:meta.helm.sh/release-namespace":{}},"f:labels":{".":{},"f:app.kubernetes.io/instance":{},"f:app.kubernetes.io/manag ed-by":{},"f:app.kubernetes.io/name":{},"f:app.kubernetes.io/version":{},"f:helm.sh/chart":{}}},"f:spec":{".":{},"f:addresses":{},\ "f:autoAssign":{},"f:avoidBuggyIPs":{}}}}]},"spec":{"addresses":["100.64.0.129/32"],"autoAssign":false},"status":{}},{"kind":"IP AddressPool","apiVersion":"metallb.io/v1beta1","metadata":{"name":"my-application","namespace":"metal-lb","uid":"f05d9af3-80a8- 4f9e-9eb1-7dce98940abd","resourceVersion":"36994680","generation":1,"creationTimestamp":"2024-09-26T11:53:17Z","labels":{"app.kube rnetes.io/instance":"metal-lb","app.kubernetes.io/managed-by":"Helm","app.kubernetes.io/name":"metal-lb","app.kubernetes.io/version\ ":"1.7.0-32464170","helm.sh/chart":"metal-lb-1.7.0-32464170"},"annotations":{"meta.helm.sh/release-name":"metal-lb","meta.helm.sh/r elease-namespace":"metal-lb"},"managedFields":[{"manager":"helm","operation":"Update","apiVersion":"metallb.io/v1beta1","time\ ":"2024-09-26T11:53:17Z","fieldsType":"FieldsV1","fieldsV1":{"f:metadata":{"f:annotations":{".":{},"f:meta.helm.sh/release-name" :{},"f:meta.helm.sh/release-namespace":{}},"f:labels":{".":{},"f:app.kubernetes.io/instance":{},"f:app.kubernetes.io/managed-by":{}," f:app.kubernetes.io/name":{},"f:app.kubernetes.io/version":{},"f:helm.sh/chart":{}}},"f:spec":{".":{},"f:addresses":{},"f:autoAssign ":{},"f:avoidBuggyIPs":{}}}}]},"spec":{"addresses":["192.168.64.128/30"],"autoAssign":false},"status":{}},{"kind":"IPAddressPool ","apiVersion":"metallb.io/v1beta1","metadata":{"name":"gelf-ibm","namespace":"metal-lb","uid":"86c97c89-e437-431f-abf1-e075eb bf4ab6","resourceVersion":"36994692","generation":1,"creationTimestamp":"2024-09-26T11:53:17Z","labels":{"app.kubernetes.io/instan ce":"metal-lb","app.kubernetes.io/managed-by":"Helm","app.kubernetes.io/name":"metal-lb","app.kubernetes.io/version":"1.7.0-324641 70","helm.sh/chart":"metal-lb-1.7.0-32464170"},"annotations":{"meta.helm.sh/release-name":"metal-lb","meta.helm.sh/release-namespace ":"metal-lb"},"managedFields":[{"manager":"helm","operation":"Update","apiVersion":"metallb.io/v1beta1","time":"2024-09-26T1 1:53:17Z","fieldsType":"FieldsV1","fieldsV1":{"f:metadata":{"f:annotations":{".":{},"f:meta.helm.sh/release-name":{},"f:meta.hel m.sh/release-namespace":{}},"f:labels":{".":{},"f:app.kubernetes.io/instance":{},"f:app.kubernetes.io/managed-by":{},"f:app.kubernetes .io/name":{},"f:app.kubernetes.io/version":{},"f:helm.sh/chart":{}}},"f:spec":{".":{},"f:addresses":{},"f:autoAssign":{},"f:avoidB uggyIPs":{}}}}]},"spec":{"addresses":["192.168.16.132/32"],"autoAssign":false},"status":{}},{"kind":"IPAddressPool","apiVersion\ ":"metallb.io/v1beta1","metadata":{"name":"rsyslog-olt-ibm","namespace":"metal-lb","uid":"ab1a4c80-5c45-4d6e-8ce1-7b23db646e1b", "resourceVersion":"36994698","generation":1,"creationTimestamp":"2024-09-26T11:53:17Z","labels":{"app.kubernetes.io/instance":"me tal-lb","app.kubernetes.io/managed-by":"Helm","app.kubernetes.io/name":"metal-lb","app.kubernetes.io/version":"1.7.0-32464170","he lm.sh/chart":"metal-lb-1.7.0-32464170"},"annotations":{"meta.helm.sh/release-name":"metal-lb","meta.helm.sh/release-namespace":"meta
{"caller":"service_controller_reload.go:98","controller":"ServiceReconciler - reprocessAll","level":"debug","reprocessing service":"{"kind":" Service","apiVersion":"v1","metadata":{"name":"-controller-4","namespace":"services","uid":"4dc877ee-5ecf-4aa 6-b981-8139b21e9f55","resourceVersion":"45169986","creationTimestamp":"2024-10-08T12:48:14Z","labels":{"app.kubernetes.io/instance" :"-controller","app.kubernetes.io/managed-by":"Helm","app.kubernetes.io/name":"-controller","app.kubernetes .io/version":"1.6.0-0.ftth79942.34855950","helm.sh/chart":"-controller-1.6.0-0.ftth79942.34855950"},"annotations":{"field .cattle.io/publicEndpoints":"[{\"addresses\":[\"192.168.64.131\"],\"port\":6068,\"protocol\":\"TCP\",\"serviceName\":\ \"services:-controller-4\",\"allNodes\":false}]","meta.helm.sh/release-name":"-controller","meta.helm .sh/release-namespace":"services","metallb.universe.tf/address-pool":"my-application","metallb.universe.tf/ip-allocated-from-pool":\ "my-application"},"managedFields":[{"manager":"agent","operation":"Update","apiVersion":"v1","time":"2024-10-08T12:48:14Z","f ieldsType":"FieldsV1","fieldsV1":{"f:metadata":{"f:annotations":{"f:field.cattle.io/publicEndpoints":{}}}}},{"manager":"controller ","operation":"Update","apiVersion":"v1","time":"2024-10-08T12:48:14Z","fieldsType":"FieldsV1","fieldsV1":{"f:metadata":{" f:annotations":{"f:metallb.universe.tf/ip-allocated-from-pool":{}}},"f:status":{"f:loadBalancer":{"f:ingress":{}}}},"subresource":"s tatus"},{"manager":"helm","operation":"Update","apiVersion":"v1","time":"2024-10-08T12:48:14Z","fieldsType":"FieldsV1","fi eldsV1":{"f:metadata":{"f:annotations":{".":{},"f:meta.helm.sh/release-name":{},"f:meta.helm.sh/release-namespace":{},"f:metallb.uni verse.tf/address-pool":{}},"f:labels":{".":{},"f:app.kubernetes.io/instance":{},"f:app.kubernetes.io/managed-by":{},"f:app.kubernetes. io/name":{},"f:app.kubernetes.io/version":{},"f:helm.sh/chart":{}}},"f:spec":{"f:allocateLoadBalancerNodePorts":{},"f:externalTrafficP olicy":{},"f:internalTrafficPolicy":{},"f:ports":{".":{},"k:{\"port\":6068,\"protocol\":\"TCP\"}":{".":{},"f:name":{},\ "f:port":{},"f:protocol":{},"f:targetPort":{}}},"f:selector":{},"f:sessionAffinity":{},"f:type":{}}}}]},"spec":{"ports":[{"name\ ":"ancp","protocol":"TCP","port":6068,"targetPort":6068,"nodePort":32655}],"selector":{"app.kubernetes.io/instance":"pao-msan-a ncp-controller","app.kubernetes.io/name":"-controller"},"clusterIP":"192.168.253.128","clusterIPs":["192.168.253.128"] ,"type":"LoadBalancer","sessionAffinity":"None","externalTrafficPolicy":"Local","healthCheckNodePort":30889,"ipFamilies":["IPv4 "],"ipFamilyPolicy":"SingleStack","allocateLoadBalancerNodePorts":true,"internalTrafficPolicy":"Cluster"},"status":{"loadBalancer\ ":{"ingress":[{"ip":"192.168.64.131"}]}}}","ts":"2024-10-09T14:33:35Z"}
{"caller":"bgp_controller.go:152","event":"skipping should announce bgp","ips":["192.168.64.131"],"level":"debug","pool":"my-application","protoc ol":"bgp","reason":"pool not matching my node","service":"services/controller-4","ts":"2024-10-09T14:33:35Z"}
{"caller":"layer2_controller.go:110","event":"shouldannounce","ips":["192.168.64.131"],"level":"debug","nodes":["node-0"] ,"pool":"my-application","protocol":"l2","service":"services/controller-4","ts":"2024-10-09T14:33:35Z"} 13,1 2%
{"caller":"config_controller.go:147","controller":"ConfigReconciler","level":"debug","rendered config":"(config.Config) {\n Peers: (map[string]* config.Peer) {\n },\n Pools: (*config.Pools)(0xc000fe84b0)({\n ByName: (map[string]*config.Pool) (len=19) {\n (string) (len=13) "podconfig-i bm": (*config.Pool)(0xc0002b1b90)({\n Name: (string) (len=13) "podconfig-ibm",\n CIDR: ([]*net.IPNet) (len=1 cap=1) {\n (*net.IPNet )(0xc000cfdec0)(192.168.16.130/32)\n },\n AvoidBuggyIPs: (bool) false,\n AutoAssign: (bool) false,\n BGPAdvertisements: ([]*config.B GPAdvertisement) ,\n L2Advertisements: ([]*config.L2Advertisement) (len=1 cap=1) {\n (*config.L2Advertisement)(0xc000fe8480)({\n Nodes: (map[string]bool) (len=3) {\n (string) (len=29) "node-1": (bool) true,\n (string) (len=29) "pod-s erver1-49-6121-1801-7kd0": (bool) true,\n (string) (len=29) "node-3": (bool) true\n },\n Interfaces: ( []string) ,\n AllInterfaces: (bool) true\n })\n },\n cidrsPerAddresses: (map[string][]*net.IPNet) (len=1) {\n (string) ( len=17) "192.168.16.130/32": ([]*net.IPNet) (len=1 cap=1) {\n (*net.IPNet)(0xc000cfdec0)(192.168.16.130/32)\n }\n },\n ServiceA llocations: (*config.ServiceAllocation)()\n }),\n (string) (len=8) "gelf-oob": (*config.Pool)(0xc0002b1c70)({\n Name: (string) (le n=8) "gelf-oob",\n CIDR: ([]*net.IPNet) (len=1 cap=1) {\n (*net.IPNet)(0xc000cfdf80)(192.168.0.201/32)\n },\n AvoidBuggyIPs: (boo l) false,\n AutoAssign: (bool) false,\n BGPAdvertisements: ([]*config.BGPAdvertisement) ,\n L2Advertisements: ([]*config.L2Adverti sement) (len=1 cap=1) {\n (*config.L2Advertisement)(0xc000fe8480)({\n Nodes: (map[string]bool) (len=3) {\n (string) (len=29) "po d-server2-49-6121-1801-7kd1": (bool) true,\n (string) (len=29) "node-0": (bool) true,\n (string) (len=29) "node-3": (bool) true\n },\n Interfaces: ([]string) ,\n AllInterfaces: (bool) true\n })\n }, \n cidrsPerAddresses: (map[string][]*net.IPNet) (len=1) {\n (string) (len=16) "192.168.0.201/32": ([]*net.IPNet) (len=1 cap=1) {\n (*net.IPNet)(0xc000cfdf80)(192.168.0.201/32)\n }\n },\n ServiceAllocations: (*config.ServiceAllocation)()\n }),\n (string) ( len=16) "switchupdate-oob": (*config.Pool)(0xc0002b1ce0)({\n Name: (string) (len=16) "switchupdate-oob",\n CIDR: ([]*net.IPNet) (len=1 cap=1) {\n (*net.IPNet)(0xc000fe8000)(192.168.0.205/32)\n },\n AvoidBuggyIPs: (bool) false,\n AutoAssign: (bool) false,\n BGPAd vertisements: ([]*config.BGPAdvertisement) ,\n L2Advertisements: ([]*config.L2Advertisement) (len=1 cap=1) {\n (*config.L2Advertisem ent)(0xc000fe8480)({\n Nodes: (map[string]bool) (len=3) {\n (string) (len=29) "node-1": (bool) true,\n (string) (len=29) "node-0": (bool) true,\n (string) (len=29) "node-3": (bool) true\n },\n Interfaces: ([]string) ,\n AllInterfaces: (bool) true\n })\n },\n cidrsPerAddresses: (map[string][]*net.IPNet) (len=1) {\n (string) (len=16) "192.168.0.205/32": ([]*net.IPNet) (len=1 cap=1) {\n (*net.IPNet)(0xc000fe8000)(192.168.0.205/32)\n }\n },\n ServiceAllocations: (*config.ServiceAllocation)()\n }),\n (string) (len=10) "tacacs-oob": (*config.Pool)(0xc0002b1f10 )({\n Name: (string) (len=10) "tacacs-oob",\n CIDR: ([]*net.IPNet) (len=1 cap=1) {\n (*net.IPNet)(0xc000fe81e0)(192.168.0.204/32)\n },\n AvoidBuggyIPs: (bool) false,\n AutoAssign: (bool) false,\n BGPAdvertisements: ([]*config.BGPAdvertisement) ,\n L2Advert isements: ([]*config.L2Advertisement) (len=1 cap=1) {\n (*config.L2Advertisement)(0xc000fe8480)({\n Nodes: (map[string]bool) (len=3) {\ n (string) (len=29) "node-1": (bool) true,\n (string) (len=29) "node-0": (bool) tr ue,\n (string) (len=29) "node-3": (bool) true\n },\n Interfaces: ([]string) ,\n AllInterfaces : (bool) true\n })\n },\n cidrsPerAddresses: (map[string][]*net.IPNet) (len=1) {\n (string) (len=16) "192.168.0.204/32": ([]*net .IPNet) (len=1 cap=1) {\n (*net.IPNet)(0xc000fe81e0)(192.168.0.204/32)\n }\n },\n ServiceAllocations: (config.ServiceAllocation)
{"caller":"config_controller.go:135","controller":"ConfigReconciler","level":"debug","metallb CRs and Secrets":"{"ipaddresspools":[{"kind":\ "IPAddressPool","apiVersion":"metallb.io/v1beta1","metadata":{"name":"tacacs-olt-ibm","namespace":"metal-lb","uid":"0abd63fc-9 4b9-444d-9560-bf01481826a5","resourceVersion":"36994701","generation":1,"creationTimestamp":"2024-09-26T11:53:17Z","labels":{"app. kubernetes.io/instance":"metal-lb","app.kubernetes.io/managed-by":"Helm","app.kubernetes.io/name":"metal-lb","app.kubernetes.io/vers ion":"1.7.0-32464170","helm.sh/chart":"metal-lb-1.7.0-32464170"},"annotations":{"meta.helm.sh/release-name":"metal-lb","meta.helm. sh/release-namespace":"metal-lb"},"managedFields":[{"manager":"helm","operation":"Update","apiVersion":"metallb.io/v1beta1","t ime":"2024-09-26T11:53:17Z","fieldsType":"FieldsV1","fieldsV1":{"f:metadata":{"f:annotations":{".":{},"f:meta.helm.sh/release-na me":{},"f:meta.helm.sh/release-namespace":{}},"f:labels":{".":{},"f:app.kubernetes.io/instance":{},"f:app.kubernetes.io/managed-by":{ },"f:app.kubernetes.io/name":{},"f:app.kubernetes.io/version":{},"f:helm.sh/chart":{}}},"f:spec":{".":{},"f:addresses":{},"f:autoAs sign":{},"f:avoidBuggyIPs":{}}}}]},"spec":{"addresses":["192.168.32.129/32"],"autoAssign":false},"status":{}},{"kind":"IPAddress Pool","apiVersion":"metallb.io/v1beta1","metadata":{"name":"-dpu","namespace":"metal-lb","uid":"d60aeee7-b876-45ad-928 8-59219e5c4b67","resourceVersion":"36994700","generation":1,"creationTimestamp":"2024-09-26T11:53:17Z","labels":{"app.kubernetes.i o/instance":"metal-lb","app.kubernetes.io/managed-by":"Helm","app.kubernetes.io/name":"metal-lb","app.kubernetes.io/version":"1.7. 0-32464170","helm.sh/chart":"metal-lb-1.7.0-32464170"},"annotations":{"meta.helm.sh/release-name":"metal-lb","meta.helm.sh/release-n amespace":"metal-lb"},"managedFields":[{"manager":"helm","operation":"Update","apiVersion":"metallb.io/v1beta1","time":"2024 -09-26T11:53:17Z","fieldsType":"FieldsV1","fieldsV1":{"f:metadata":{"f:annotations":{".":{},"f:meta.helm.sh/release-name":{},"f: meta.helm.sh/release-namespace":{}},"f:labels":{".":{},"f:app.kubernetes.io/instance":{},"f:app.kubernetes.io/managed-by":{},"f:app.ku bernetes.io/name":{},"f:app.kubernetes.io/version":{},"f:helm.sh/chart":{}}},"f:spec":{".":{},"f:addresses":{},"f:autoAssign":{}," f:avoidBuggyIPs":{}}}}]},"spec":{"addresses":["100.64.0.128/32"],"autoAssign":false},"status":{}},{"kind":"IPAddressPool","apiVe rsion":"metallb.io/v1beta1","metadata":{"name":"podconfig-oob","namespace":"metal-lb","uid":"30746614-336f-4464-8572-2088823355f 2","resourceVersion":"36994682","generation":1,"creationTimestamp":"2024-09-26T11:53:17Z","labels":{"app.kubernetes.io/instance": "metal-lb","app.kubernetes.io/managed-by":"Helm","app.kubernetes.io/name":"metal-lb","app.kubernetes.io/version":"1.7.0-32464170", "helm.sh/chart":"metal-lb-1.7.0-32464170"},"annotations":{"meta.helm.sh/release-name":"metal-lb","meta.helm.sh/release-namespace":" metal-lb"},"managedFields":[{"manager":"helm","operation":"Update","apiVersion":"metallb.io/v1beta1","time":"2024-09-26T11:53: 17Z","fieldsType":"FieldsV1","fieldsV1":{"f:metadata":{"f:annotations":{".":{},"f:meta.helm.sh/release-name":{},"f:meta.helm.sh/ release-namespace":{}},"f:labels":{".":{},"f:app.kubernetes.io/instance":{},"f:app.kubernetes.io/managed-by":{},"f:app.kubernetes.io/n ame":{},"f:app.kubernetes.io/version":{},"f:helm.sh/chart":{}}},"f:spec":{".":{},"f:addresses":{},"f:autoAssign":{},"f:avoidBuggyI Ps":{}}}}]},"spec":{"addresses":["192.168.0.200/32"],"autoAssign":false},"status":{}},{"kind":"IPAddressPool","apiVersion":"me tallb.io/v1beta1","metadata":{"name":"tacacs-oob","namespace":"metal-lb","uid":"e4a99bad-322a-4eb2-9c02-f3e8f340e7c9","resourceV ersion":"36994702","generation":1,"creationTimestamp":"2024-09-26T11:53:17Z","labels":{"app.kubernetes.io/instance":"metal-lb"," app.kubernetes.io/managed-by":"Helm","app.kubernetes.io/name":"metal-lb","app.kubernetes.io/version":"1.7.0-32464170","helm.sh/chart ":"metal-lb-1.7.0-32464170"},"annotations":{"meta.helm.sh/release-name":"metal-lb","meta.helm.sh/release-namespace":"metal-lb"},"m
{"caller":"config_controller.go:147","controller":"ConfigReconciler","level":"debug","rendered config":"(config.Config) {\n Peers: (map[string] config.Peer) {\n },\n Pools: (*config.Pools)(0xc001022f60)({\n ByName: (map[string]*config.Pool) (len=19) {\n (string) (len=16) "switchupdat e-oob": (*config.Pool)(0xc0002aabd0)({\n Name: (string) (len=16) "switchupdate-oob",\n CIDR: ([]*net.IPNet) (len=1 cap=1) {\n (*net .IPNet)(0xc001022c90)(192.168.0.205/32)\n },\n AvoidBuggyIPs: (bool) false,\n AutoAssign: (bool) false,\n BGPAdvertisements: ([]*con fig.BGPAdvertisement) ,\n L2Advertisements: ([]*config.L2Advertisement) (len=1 cap=1) {\n (*config.L2Advertisement)(0xc001022f30)({\ n Nodes: (map[string]bool) (len=3) {\n (string) (len=29) "node-0": (bool) true,\n (string) (len=29) " node-3": (bool) true,\n (string) (len=29) "node-1": (bool) true\n },\n Interfac es: ([]string) ,\n AllInterfaces: (bool) true\n })\n },\n cidrsPerAddresses: (map[string][]*net.IPNet) (len=1) {\n (stri ng) (len=16) "192.168.0.205/32": ([]*net.IPNet) (len=1 cap=1) {\n (*net.IPNet)(0xc001022c90)(192.168.0.205/32)\n }\n },\n Servi ceAllocations: (*config.ServiceAllocation)()\n }),\n (string) (len=14) "tacacs-olt-ibm": (*config.Pool)(0xc0002aad20)({\n Name: (s tring) (len=14) "tacacs-olt-ibm",\n CIDR: ([]*net.IPNet) (len=1 cap=1) {\n (*net.IPNet)(0xc001022db0)(192.168.32.129/32)\n },\n A voidBuggyIPs: (bool) false,\n AutoAssign: (bool) false,\n BGPAdvertisements: ([]*config.BGPAdvertisement) ,\n L2Advertisements: ([ ]*config.L2Advertisement) (len=1 cap=1) {\n (*config.L2Advertisement)(0xc001022f30)({\n Nodes: (map[string]bool) (len=3) {\n (str ing) (len=29) "node-0": (bool) true,\n (string) (len=29) "node-3": (bool) true,\n (string) (len=29) "node-1": (bool) true\n },\n Interfaces: ([]string) ,\n AllInterfaces: (bool) tru e\n })\n },\n cidrsPerAddresses: (map[string][]*net.IPNet) (len=1) {\n (string) (len=17) "192.168.32.129/32": ([]*net.IPNet) (le n=1 cap=1) {\n (*net.IPNet)(0xc001022db0)(192.168.32.129/32)\n }\n },\n ServiceAllocations: (*config.ServiceAllocation)()\n }),\n (string) (len=8) "gelf-ibm": (*config.Pool)(0xc0002aad90)({\n Name: (string) (len=8) "gelf-ibm",\n CIDR: ([]*net.IPNet) (len =1 cap=1) {\n (*net.IPNet)(0xc001022e10)(192.168.16.132/32)\n },\n AvoidBuggyIPs: (bool) false,\n AutoAssign: (bool) false,\n BG PAdvertisements: ([]*config.BGPAdvertisement) ,\n L2Advertisements: ([]*config.L2Advertisement) (len=1 cap=1) {\n (*config.L2Adverti sement)(0xc001022f30)({\n Nodes: (map[string]bool) (len=3) {\n (string) (len=29) "node-0": (bool) true,\n (string) (len=29) "node-3": (bool) true,\n (string) (len=29) "node-1": (bool) true\n },\n Interfaces: ([]string) ,\n AllInterfaces: (bool) true\n })\n },\n cidrsPerAddresses: (map[string][]*net.IPNe t) (len=1) {\n (string) (len=17) "192.168.16.132/32": ([]*net.IPNet) (len=1 cap=1) {\n (*net.IPNet)(0xc001022e10)(192.168.16.132/32)\ n }\n },\n ServiceAllocations: (*config.ServiceAllocation)()\n }),\n (string) (len=3) "ip2": (*config.Pool)(0xc0002aa700)({ \n Name: (string) (len=3) "ip2",\n CIDR: ([]*net.IPNet) (len=1 cap=1) {\n (*net.IPNet)(0xc001022930)(62.181.181.15/32)\n },\n AvoidBuggyIPs: (bool) false,\n AutoAssign: (bool) false,\n BGPAdvertisements: ([]*config.BGPAdvertisement) ,\n L2Advertisements: ( []*config.L2Advertisement) (len=1 cap=1) {\n (*config.L2Advertisement)(0xc001022f30)({\n Nodes: (map[string]bool) (len=3) {\n (st ring) (len=29) "node-0": (bool) true,\n (string) (len=29) "node-3": (bool) true,\n (string) (len=29) "node-1": (bool) true\n },\n Interfaces: ([]string) ,\n AllInterfaces: (bool) tr ue\n })\n },\n cidrsPerAddresses: (map[string][]*net.IPNet) (len=1) {\n (string) (len=16) "62.181.181.15/32": ([]*net.IPNet) (le n=1 cap=1) {\n (*net.IPNet)(0xc001022930)(62.181.181.15/32)\n }\n },\n ServiceAllocations: (*config.ServiceAllocation)()\n
{"caller":"bgp_controller.go:152","event":"skipping should announce bgp","ips":["192.168.64.130"],"level":"debug","pool":"my-application","protoc ol":"bgp","reason":"pool not matching my node","service":"services/controller-3","ts":"2024-10-09T14:33:36Z"}
{"caller":"layer2_controller.go:110","event":"shouldannounce","ips":["192.168.64.130"],"level":"debug","nodes":["node-0"] ,"pool":"my-application","protocol":"l2","service":"services/controller-3","ts":"2024-10-09T14:33:36Z"}
{"caller":"service_controller.go:115","controller":"ServiceReconciler","end reconcile":"services/controller-3","level":"info", "ts":"2024-10-09T14:33:36Z"}

then we did a hack, as the traffic was flowing on node-3, where pod is not scheduled and traffic was not working, so we edit the application and asked to schduled on node-3, and if you see reconsile is happing and annoucement as well.

{"caller":"config_controller.go:147","controller":"ConfigReconciler","level":"debug","rendered config":"(config.Config) {\n Peers: (map[string]* config.Peer) {\n },\n Pools: (*config.Pools)(0xc001022f60)({\n ByName: (map[string]*config.Pool) (len=19) {\n (string) (len=16) "switchupdat e-oob": (*config.Pool)(0xc0002aabd0)({\n Name: (string) (len=16) "switchupdate-oob",\n CIDR: ([]*net.IPNet) (len=1 cap=1) {\n (*net .IPNet)(0xc001022c90)(192.168.0.205/32)\n },\n AvoidBuggyIPs: (bool) false,\n AutoAssign: (bool) false,\n BGPAdvertisements: ([]*con fig.BGPAdvertisement) ,\n L2Advertisements: ([]*config.L2Advertisement) (len=1 cap=1) {\n (*config.L2Advertisement)(0xc001022f30)({\ n Nodes: (map[string]bool) (len=3) {\n (string) (len=29) "node-0": (bool) true,\n (string) (len=29) " node-3": (bool) true,\n (string) (len=29) "node-1": (bool) true\n },\n Interfac es: ([]string) ,\n AllInterfaces: (bool) true\n })\n },\n cidrsPerAddresses: (map[string][]*net.IPNet) (len=1) {\n (stri ng) (len=16) "192.168.0.205/32": ([]*net.IPNet) (len=1 cap=1) {\n (*net.IPNet)(0xc001022c90)(192.168.0.205/32)\n }\n },\n Servi ceAllocations: (*config.ServiceAllocation)()\n }),\n (string) (len=14) "tacacs-olt-ibm": (*config.Pool)(0xc0002aad20)({\n Name: (s tring) (len=14) "tacacs-olt-ibm",\n CIDR: ([]*net.IPNet) (len=1 cap=1) {\n (*net.IPNet)(0xc001022db0)(192.168.32.129/32)\n },\n A voidBuggyIPs: (bool) false,\n AutoAssign: (bool) false,\n BGPAdvertisements: ([]*config.BGPAdvertisement) ,\n L2Advertisements: ([ ]*config.L2Advertisement) (len=1 cap=1) {\n (*config.L2Advertisement)(0xc001022f30)({\n Nodes: (map[string]bool) (len=3) {\n (str ing) (len=29) "node-0": (bool) true,\n (string) (len=29) "node-3": (bool) true,\n (string) (len=29) "node-1": (bool) true\n },\n Interfaces: ([]string) ,\n AllInterfaces: (bool) tru e\n })\n },\n cidrsPerAddresses: (map[string][]*net.IPNet) (len=1) {\n (string) (len=17) "192.168.32.129/32": ([]*net.IPNet) (le n=1 cap=1) {\n (*net.IPNet)(0xc001022db0)(192.168.32.129/32)\n }\n },\n ServiceAllocations: (*config.ServiceAllocation)()\n }),\n (string) (len=8) "gelf-ibm": (*config.Pool)(0xc0002aad90)({\n Name: (string) (len=8) "gelf-ibm",\n CIDR: ([]*net.IPNet) (len =1 cap=1) {\n (*net.IPNet)(0xc001022e10)(192.168.16.132/32)\n },\n AvoidBuggyIPs: (bool) false,\n AutoAssign: (bool) false,\n BG PAdvertisements: ([]*config.BGPAdvertisement) ,\n L2Advertisements: ([]*config.L2Advertisement) (len=1 cap=1) {\n (*config.L2Adverti sement)(0xc001022f30)({\n Nodes: (map[string]bool) (len=3) {\n (string) (len=29) "node-0": (bool) true,\n (string) (len=29) "node-3": (bool) true,\n (string) (len=29) "node-1": (bool) true\n },\n Interfaces: ([]string) ,\n AllInterfaces: (bool) true\n })\n },\n cidrsPerAddresses: (map[string][]*net.IPNe t) (len=1) {\n (string) (len=17) "192.168.16.132/32": ([]*net.IPNet) (len=1 cap=1) {\n (*net.IPNet)(0xc001022e10)(192.168.16.132/32)\ n }\n },\n ServiceAllocations: (*config.ServiceAllocation)()\n }),\n (string) (len=3) "ip2": (*config.Pool)(0xc0002aa700)({ \n Name: (string) (len=3) "ip2",\n CIDR: ([]*net.IPNet) (len=1 cap=1) {\n (*net.IPNet)(0xc001022930)(62.181.181.15/32)\n },\n AvoidBuggyIPs: (bool) false,\n AutoAssign: (bool) false,\n BGPAdvertisements: ([]*config.BGPAdvertisement) ,\n L2Advertisements: ( []*config.L2Advertisement) (len=1 cap=1) {\n (*config.L2Advertisement)(0xc001022f30)({\n Nodes: (map[string]bool) (len=3) {\n (st ring) (len=29) "node-0": (bool) true,\n (string) (len=29) "node-3": (bool) true,\n (string) (len=29) "node-1": (bool) true\n },\n Interfaces: ([]string) ,\n AllInterfaces: (bool) tr ue\n })\n },\n cidrsPerAddresses: (map[string][]*net.IPNet) (len=1) {\n (string) (len=16) "62.181.181.15/32": ([]*net.IPNet) (le n=1 cap=1) {\n (*net.IPNet)(0xc001022930)(62.181.181.15/32)\n }\n },\n ServiceAllocations: (*config.ServiceAllocation)()\n
{"caller":"bgp_controller.go:152","event":"skipping should announce bgp","ips":["192.168.64.130"],"level":"debug","pool":"my-application","protoc ol":"bgp","reason":"pool not matching my node","service":"services/controller-3","ts":"2024-10-09T15:08:03Z"}
{"caller":"layer2_controller.go:110","event":"shouldannounce","ips":["192.168.64.130"],"level":"debug","nodes":["node-0", "node-3"],"pool":"my-application","protocol":"l2","service":"services/controller-3","ts":"2024-10-09T15: 08:03Z"}
{"caller":"main.go:409","event":"serviceAnnounced","ips":["192.168.64.130"],"level":"info","msg":"service has IP, announcing","pool":"-m san","protocol":"layer2","ts":"2024-10-09T15:08:03Z"}
{"level":"debug","ts":"2024-10-09T15:08:03Z","logger":"events","msg":"announcing from node "node-3" with protocol "lay@@@

if you see , traffic is working now.

15:15:00.763289 e8:c5:7a:d6:0c:19 > ff:ff:ff:ff:ff:ff, ethertype 802.1Q (0x8100), length 64: vlan 16, p 0, ethertype ARP, Request who-has 192.168.66.34 (e8:c5:7a:d6:0c:19) tell 192.168.66.34, length 46
15:15:01.349288 52:54:00:9d:47:8a > e8:c5:7a:d6:0c:19, ethertype 802.1Q (0x8100), length 78: vlan 16, p 0, ethertype IPv4, 192.168.66.33.35406 > 192.168.64.128.6068: Flags [S], seq 2082727465, win 64240, options [mss 1460,sackOK,TS val 2033898130 ecr 0,nop,wscale 7], length 0
15:15:01.349508 e8:c5:7a:d6:0c:19 > 52:54:00:9d:47:8a, ethertype 802.1Q (0x8100), length 78: vlan 16, p 7, ethertype IPv4, 192.168.64.128.6068 > 192.168.66.33.35406: Flags [S.], seq 1101682475, ack 2082727466, win 64308, options [mss 1410,sackOK,TS val 3933222906 ecr 2033898130,nop,wscale 7], length 0
15:15:01.349545 52:54:00:9d:47:8a > e8:c5:7a:d6:0c:19, ethertype 802.1Q (0x8100), length 70: vlan 16, p 0, ethertype IPv4, 192.168.66.33.35406 > 192.168.64.128.6068: Flags [.], ack 1, win 502, options [nop,nop,TS val 2033898131 ecr 3933222906], length 0
15:15:01.350954 52:54:00:9d:47:8a > e8:c5:7a:d6:0c:19, ethertype 802.1Q (0x8100), length 118: vlan 16, p 0, ethertype IPv4, 192.168.66.33.35406 > 192.168.64.128.6068: Flags [P.], seq 1:49, ack 1, win 502, options [nop,nop,TS val 2033898132 ecr 3933222906], length 48
15:15:01.351077 e8:c5:7a:d6:0c:19 > 52:54:00:9d:47:8a, ethertype 802.1Q (0x8100), length 70: vlan 16, p 7, ethertype IPv4, 192.168.64.128.6068 > 192.168.66.33.35406: Flags [.], ack 49, win 503, options [nop,nop,TS val 3933222908 ecr 2033898132], length 0
15:15:01.355612 e8:c5:7a:d6:0c:19 > 52:54:00:9d:47:8a, ethertype 802.1Q (0x8100), length 118: vlan 16, p 7, ethertype IPv4, 192.168.64.128.6068 > 192.168.66.33.35406: Flags [P.], seq 1:49, ack 49, win 503, options [nop,nop,TS val 3933222912 ecr 2033898132], length 48
15:15:01.355628 52:54:00:9d:47:8a > e8:c5:7a:d6:0c:19, ethertype 802.1Q (0x8100), length 70: vlan 16, p 0, ethertype IPv4, 192.168.66.33.35406 > 192.168.64.128.6068: Flags [.], ack 49, win 502, options [nop,nop,TS val 2033898137 ecr 3933222912], length 0
15:15:01.356038 52:54:00:9d:47:8a > e8:c5:7a:d6:0c:19, ethertype 802.1Q (0x8100), length 118: vlan 16, p 0, ethertype IPv4, 192.168.66.33.35406 > 192.168.64.128.6068: Flags [P.], seq 49:97, ack 49, win 502, options [nop,nop,TS val 2033898137 ecr 3933222912], length 48
15:15:01.356166 e8:c5:7a:d6:0c:19 > 52:54:00:9d:47:8a, ethertype 802.1Q (0x8100), length 70: vlan 16, p 7, ethertype IPv4, 192.168.64.128.6068 > 192.168.66.33.35406: Flags [.], ack 97, win 503, options [nop,nop,TS val 3933222913 ecr 2033898137], length 0
15:15:01.358253 e8:c5:7a:d6:0c:19 > 52:54:00:9d:47:8a, ethertype 802.1Q (0x8100), length 118: vlan 16, p 7, ethertype IPv4, 192.168.64.128.6068 > 192.168.66.33.35406: Flags [P.], seq 49:97, ack 97, win 503, options [nop,nop,TS val 3933222915 ecr 2033898137], length 48
15:15:01.358266 52:54:00:9d:47:8a > e8:c5:7a:d6:0c:19, ethertype 802.1Q (0x8100), length 70: vlan 16, p 0, ethertype IPv4, 192.168.66.33.35406 > 192.168.64.128.6068: Flags [.], ack 97, win 502, options [nop,nop,TS val 2033898139 ecr 3933222915], length 0
15:15:01.358668 52:54:00:9d:47:8a > e8:c5:7a:d6:0c:19, ethertype 802.1Q (0x8100), length 118: vlan 16, p 0, ethertype IPv4, 192.168.66.33.35406 > 192.168.64.128.6068: Flags [P.], seq 97:145, ack 97, win 502, options [nop,nop,TS val 2033898140 ecr 3933222915], length 48
15:15:01.358785 e8:c5:7a:d6:0c:19 > 52:54:00:9d:47:8a, ethertype 802.1Q (0x8100), length 70: vlan 16, p 7, ethertype IPv4, 192.168.64.128.6068 > 192.168.66.33.35406: Flags [.], ack 145, win 503, options [nop,nop,TS val 3933222915 ecr 2033898140], length 0
15:15:01.360645 e8:c5:7a:d6:0c:19 > 52:54:00:9d:47:8a, ethertype 802.1Q (0x8100), length 118: vlan 16, p 7, ethertype IPv4, 192.168.64.128.6068 > 192.168.66.33.35406: Flags [P.], seq 97:145, ack 145, win 503, options [nop,nop,TS val 3933222917 ecr 2033898140], length 48
15:15:01.360656 52:54:00:9d:47:8a > e8:c5:7a:d6:0c:19, ethertype 802.1Q (0x8100), length 70: vlan 16, p 0, ethertype IPv4, 192.168.66.33.35406 > 192.168.64.128.6068: Flags [.], ack 145, win 502, options [nop,nop,TS val 2033898142 ecr 3933222917], length 0

TCPDUMP OF ALL INTERFACE on node-3, after the workaround.

15:13:40.910348 eth5 In IP 192.168.66.33.42844 > 192.168.64.128.6068: Flags [S], seq 254594485, win 64240, options [mss 1460,sackOK,TS val 2033833515 ecr 0,nop,wscale 7], length 0
15:13:40.910348 vlan4074.5 In IP 192.168.66.33.42844 > 192.168.64.128.6068: Flags [S], seq 254594485, win 64240, options [mss 1460,sackOK,TS val 2033833515 ecr 0,nop,wscale 7], length 0
15:13:40.910421 cni0 Out IP 192.168.66.33.42844 > 192.168.250.192.6068: Flags [S], seq 254594485, win 64240, options [mss 1460,sackOK,TS val 2033833515 ecr 0,nop,wscale 7], length 0
15:13:40.910428 veth2a3e7dbe Out IP 192.168.66.33.42844 > 192.168.250.192.6068: Flags [S], seq 254594485, win 64240, options [mss 1460,sackOK,TS val 2033833515 ecr 0,nop,wscale 7], length 0
15:13:40.910457 veth2a3e7dbe P IP 192.168.250.192.6068 > 192.168.66.33.42844: Flags [S.], seq 418854327, ack 254594486, win 64308, options [mss 1410,sackOK,TS val 3933158293 ecr 2033833515,nop,wscale 7], length 0
15:13:40.910457 cni0 In IP 192.168.250.192.6068 > 192.168.66.33.42844: Flags [S.], seq 418854327, ack 254594486, win 64308, options [mss 1410,sackOK,TS val 3933158293 ecr 2033833515,nop,wscale 7], length 0
15:13:40.910481 vlan4074.5 Out IP 192.168.64.128.6068 > 192.168.66.33.42844: Flags [S.], seq 418854327, ack 254594486, win 64308, options [mss 1410,sackOK,TS val 3933158293 ecr 2033833515,nop,wscale 7], length 0
15:13:40.910485 eth5 Out IP 192.168.64.128.6068 > 192.168.66.33.42844: Flags [S.], seq 418854327, ack 254594486, win 64308, options [mss 1410,sackOK,TS val 3933158293 ecr 2033833515,nop,wscale 7], length 0
15:13:40.910569 eth5 In IP 192.168.66.33.42844 > 192.168.64.128.6068: Flags [.], ack 1, win 502, options [nop,nop,TS val 2033833515 ecr 3933158293], length 0
15:13:40.910569 vlan4074.5 In IP 192.168.66.33.42844 > 192.168.64.128.6068: Flags [.], ack 1, win 502, options [nop,nop,TS val 2033833515 ecr 3933158293], length 0

why it is happening when the metallb is continously reconsiling and checking? and no pod restarts.

**Comment by cyclinder** [comment]
Does TCP timeout occur when the pod restarts?

**Comment by danderson** [comment]
Please don't @ random maintainers when people don't respond within two hours.

**Comment by akshaysharama** [comment]
@cyclinder , thanks for the response. there was no restarts, it stopped suddenly.

Like when we brought up things where working and smooth, after a day it suddenly stopped working, like the traffic was reaching to the other node when there is no instance. (there is no restarts, there is no issue in any microservices, no node restarts no failover). 

I have some couple of question?
1) when the traffic from external source reaches to the external IP, it first land to the where? how it figures out where to send? 
I know speaker will send an Arp by announcing and it announced also. so it should land to the right node. 


does it can affect? while sending the packets  if the external entity send packets on the vlans configured on the particular node specifically? then metallb won't come in to the picture? I just want to understand how the entry flow is happening.

**Comment by cyclinder** [comment]
Your service with `ETP: Local`, The node on which the pod is running (i.e., the node where the LB IP is announced) will first respond to the request, and then forward it to the destination pod through the iptables rule created by kube-proxy which has pod running would be responded.

**Comment by cyclinder** [comment]
> "The node on which the pod is running (i.e., the node where the LB IP is announced) will first respond to the request." so the node should respond, right?

the lb traffic will arrive at the node announced

> as if pod schedules to the other node, LB IP will announce for that? 

yes, when your service is local, the LB IP only announces to which the pod is running.

**Comment by akshaysharama** [comment]
then what could be the potential reason? as the traffic is reaching to other node, although LB IP is announced to the right node.

with the right announcement traffic should never reach to other node right?

**Comment by akshaysharama** [comment]
```
labadmin@master2:~$ sudo kubectl describe svc my-nginx-service -n default
Name:                     my-nginx-service
Namespace:                default
Labels:                   <none>
Annotations:              meta.helm.sh/release-name: my-nginx-service
                          metallb.universe.tf/address-pool: default
                          metallb.universe.tf/ip-allocated-from-pool: default
Selector:                 app=my-nginx
Type:                     LoadBalancer
IP Family Policy:         SingleStack
IP Families:              IPv4
IP:                       10.233.40.169
IPs:                      10.233.40.169
LoadBalancer Ingress:     x.x.x.157
Port:                     <unset>  80/TCP
TargetPort:               80/TCP
NodePort:                 <unset>  30940/TCP
Endpoints:                10.233.105.141:80
Session Affinity:         None
External Traffic Policy:  Local
HealthCheck NodePort:     30735
Events:
  Type    Reason        Age   From                Message
  ----    ------        ----  ----                -------
  Normal  IPAllocated   26m   metallb-controller  Assigned IP ["x.x.x.157"]
  Normal  nodeAssigned  26m   metallb-speaker     announcing from node "worker1" with protocol "layer2"


labadmin@master2:~$ sudo kubectl get po -A -owide | grep nginx
default           my-nginx                                                          1/1     Running   0             25m   10.233.105.141   worker1   <none>           <none>
```

```
metallb_speaker_announced{container="speaker", endpoint="metrics", instance="worker-1-ip:7472", ip="x.x.x.157", job="ems-metallb-speaker-monitor-service", namespace="metal-lb", node="worker1", pod="ems-metallb-speaker-rmkqp", protocol="layer2", service="default/my-nginx-service"}
1 @1728802017.113
1 @1728802317.113
 ```


```
labadmin@worker3:~$ sudo tcpdump -nei any host x.x.x.157 -vvv
tcpdump: data link type LINUX_SLL2
tcpdump: listening on any, link-type LINUX_SLL2 (Linux cooked v2), snapshot length 262144 bytes

06:58:25.588006 enp1s0 In  ifindex 2 00:09:0f:09:00:13 ethertype IPv4 (0x0800), length 108: (tos 0xc0, ttl 255, id 17099, offset 0, flags [none], proto ICMP (1), length 88)
    x.x.x.254 > x.x.x.157: ICMP redirect x.x.69.2 to host x.x.x.253, length 68
        (tos 0x0, ttl 63, id 0, offset 0, flags [DF], proto TCP (6), length 60)
    x.x.x.157.80 > x.x.69.2.43736: Flags [S.], cksum 0xfbfb (correct), seq 1191846879, ack 3174710789, win 64308, options [mss 1410,sackOK,TS val 4201919121 ecr 1352392999,nop,wscale 7], length 0
06:58:30.605369 enp1s0 In  ifindex 2 00:09:0f:09:00:13 ethertype ARP (0x0806), length 66: Ethernet (len 6), IPv4 (len 4), Request who-has x.x.x.x.157 tell x.x.x.x.254, length 46
06:58:30.605396 enp1s0 Out ifindex 2 52:54:00:2a:b9:50 ethertype ARP (0x0806), length 48: Ethernet (len 6), IPv4 (len 4), Reply x.x.x.157 is-at 52:54:00:2a:b9:50, length 28
07:00:36.694844 enp1s0 In  ifindex 2 00:09:0f:09:00:13 ethertype IPv4 (0x0800), length 108: (tos 0xc0, ttl 255, id 17100, offset 0, flags [none], proto ICMP (1), length 88)
    x.x.x.254 > x.x.x.x.157: ICMP redirect 172.27.69.2 to host 172.27.67.253, length 68
        (tos 0x0, ttl 63, id 0, offset 0, flags [DF], proto TCP (6), length 60)
    x.x.x.x.80 > x.x.69.2.56434: Flags [S.], cksum 0xfd69 (correct), seq 604248909, ack 1047311637, win 64308, options [mss 1410,sackOK,TS val 4202050228 ecr 1352524110,nop,wscale 7], length 0
07:00:41.700104 enp1s0 In  ifindex 2 00:09:0f:09:00:13 ethertype ARP (0x0806), length 66: Ethernet (len 6), IPv4 (len 4), Request who-has x.x.x.157 tell x.x.x.254, length 46
07:00:41.700127 enp1s0 Out ifindex 2 52:54:00:2a:b9:50 ethertype ARP (0x0806), length 48: Ethernet (len 6), IPv4 (len 4), Reply x.x.x.157 is-at 52:54:00:2a:b9:50, length 28
```

```
labadmin@worker3:~$ sudo ifconfig | grep 52:54:00:2a:b9:50
        ether 52:54:00:2a:b9:50  txqueuelen 1000  (Ethernet)
```

@cyclinder, if you see above.. my nginx service is scheduled on worker1, and announced on worker1 as well. you can see the prometheus metrics.
While sending curl request to the nginx server from x.x.69.2(machine) then arp request is landing to the worker3(tcp dump above) and it is responding with mac address of the interface on worker3.

and then traffic is going to worker-1 where the pod is scheduled and response is coming.

Question-1: Why the arp request is landing on worker-3? when speaker is announced which is running on worker-1?
Question-2: why the arp request is responding with a mac address of it's own interface? the mac should be of the worker-1 right?

I'm confused with the working, or is it a bug? please shed some light

**Comment by cyclinder** [comment]
Hi @akshaysharama,  

- Where did the x.x.69.2(machine) come from?  
- Come from the cluster or outside of the cluster?  
- Are the Lb IP and your host address on the same network subnet?
- Can you test the VIP by using the arping command?

**Comment by akshaysharama** [comment]
1) outside the cluster(remote). 
2) LBIP (xxx.xx.) and hostaddress of the baremetal/vM(where service is runnning) is same.
but where i'm doing the request is if we consider /16 yes they are in same subnet and if we consider /24 then they are not.

**Comment by cyclinder** [comment]
Can you test the VIP by using the arping command(arping -I <iface_name> <lb_ip>)?

**Comment by fedepaol** [comment]
CLosing this as no feedback was provided
