### ISSUE TITLE
deploy metallb-native 0.14.5  on k8s 1.28.10 with calico, but  metallb not work

### ISSUE THREAD

**Issue by iceofsea** [metallb/metallb#2435]
### Is your feature request related to a problem?

Install metallb 0.14.5 on k8s 1.28.10 but not work, can‘t curl the service

### Describe the solution you'd like

The controller has assigned IP to the services，
the speakers aleady announcde the services via L2 

controller log: 
{"caller":"pool_controller.go:113","controller":"PoolReconciler","end reconcile":"metallb-system/first-pool","level":"info","ts":"2024-06-20T05:22:37Z"}
{"caller":"service_controller_reload.go:63","controller":"ServiceReconciler - reprocessAll","level":"info","start reconcile":"metallbreload/reload","ts":"2024-06-20T05:22:37Z"}
{"caller":"service.go:150","event":"ipAllocated","ip":["192.168.90.70"],"level":"info","msg":"IP address assigned by controller","ts":"2024-06-20T05:22:37Z"}
{"caller":"main.go:116","event":"serviceUpdated","level":"info","msg":"updated service object","ts":"2024-06-20T05:22:37Z"}

speaker log：
{"caller":"main.go:409","event":"serviceAnnounced","ips":["192.168.90.70"],"level":"info","msg":"service has IP, announcing","pool":"first-pool","protocol":"layer2","ts":"2024-06-20T05:25:06Z"}

tcpdump record:
 tcpdump -n -i ens192 arp 
dropped privs to tcpdump
tcpdump: verbose output suppressed, use -v[v]... for full protocol decode
listening on ens192, link-type EN10MB (Ethernet), snapshot length 262144 bytes
01:44:16.741147 ARP, Request who-has 192.168.90.70 tell 192.168.90.82, length 28
01:44:17.764469 ARP, Request who-has 192.168.90.70 tell 192.168.90.82, length 28
01:44:18.788436 ARP, Request who-has 192.168.90.70 tell 192.168.90.82, length 28
01:44:19.820963 ARP, Request who-has 192.168.90.70 tell 192.168.90.82, length 28

### Additional context

metallb config 

apiVersion: metallb.io/v1beta1
kind: IPAddressPool
metadata:
  name: first-pool
  namespace: metallb-system
spec:
  addresses:
  - 192.168.90.70-192.168.90.79
  - 
apiVersion: metallb.io/v1beta1
kind: L2Advertisement
metadata:
  name: l2
  namespace: metallb-system
spec:
  ipAddresPools:
  - first-pool

### I've read and agree with the following

- [X] I've checked all open and closed issues and my request is not there.
- [X] I've checked all open and closed pull requests and my request is not there.

**Comment by kazeyoba** [comment]
I have a similar configuration 

And I'm having this kind of problem with the latest release.
`Error from server (InternalError): error when creating "ippool.yaml": Internal error occurred: failed calling webhook "ipaddresspoolvalidationwebhook.metallb.io": failed to call webhook: Post "https://metallb-webhook-service.metallb-system.svc:443/validate-metallb-io-v1beta1-ipaddresspool?timeout=10s": context deadline exceeded
Error from server (InternalError): error when creating "ippool.yaml": Internal error occurred: failed calling webhook "l2advertisementvalidationwebhook.metallb.io": failed to call webhook: Post "https://metallb-webhook-service.metallb-system.svc:443/validate-metallb-io-v1beta1-l2advertisement?timeout=10s": context deadline exceeded`


```yml
apiVersion: metallb.io/v1beta1
kind: IPAddressPool
metadata:
  name: ippool
  namespace: metallb-system
spec:
  addresses:
  - 10.100.100.90-10.100.100.101
  - 10.200.200.0/24
---
apiVersion: metallb.io/v1beta1
kind: L2Advertisement
metadata:
  name: arpsetup
  namespace: metallb-system
```

Any idea ?

**Comment by CallisteH** [comment]
Same here

**Comment by fedepaol** [comment]
@iceofsea sorry for the delay this feel off our radar. Are you still having this issue?

**Comment by fedepaol** [comment]
Closing this as no followup was provided. Feel free to reopen if you still have the issue.
Also, please check https://github.com/metallb/metallb/issues/2285 and in general the troubleshooting guide https://metallb.io/troubleshooting/
