### ISSUE TITLE
L2 mode multiple replicas is not working with the bridge until promiscuous mode enabled.

### ISSUE THREAD

**Issue by kvaps** [metallb/metallb#535]
Hi, I'm using MetalLB in L2 mode with Kube-Router running in IPVS mode.
I faced with the problem when I run the service in multiple replicas most of the packets are ignored.
Eg if I have 3 replicas, then each 2 connection of 3 will stuck trying to establish connection:

![123](https://user-images.githubusercontent.com/7556217/75778639-7b93a400-5d58-11ea-9a60-fa364d906f20.png)

If I switch parent device swithced to promiscuous mode everything is starting working:

![123_000](https://user-images.githubusercontent.com/7556217/75778733-a7168e80-5d58-11ea-86d6-5cd831142443.png)

My environment:

* Kubernetes version: v1.17.0
* Kube-router version: v0.4.0
* MetalLB version: v0.8.3

--

### Debug information:

Kubernetes resources:

```bash
# kubectl get svc nginx-ingress-internal-controller
NAME                                TYPE           CLUSTER-IP       EXTERNAL-IP    PORT(S)                      AGE
nginx-ingress-internal-controller   LoadBalancer   10.99.104.136    10.28.36.101   80:32423/TCP,443:32630/TCP   92d

# kubectl get pod -o wide -lapp=nginx-ingress,component=controller,release=nginx-ingress-internal
NAME                                                 READY   STATUS    RESTARTS   AGE     IP             NODE   NOMINATED NODE   READINESS GATES
nginx-ingress-internal-controller-648f599654-92kds   1/1     Running   0          2d20h   10.112.6.143   m1c9   <none>           <none>
nginx-ingress-internal-controller-648f599654-m48ps   1/1     Running   0          2d20h   10.112.4.96    m1c5   <none>           <none>
nginx-ingress-internal-controller-648f599654-qzw5m   1/1     Running   0          2d20h   10.112.3.181   m1c4   <none>           <none>

# kubectl get node m1c5 m1c9 m1c4 -o wide
NAME	STATUS	AGE	VERSION	INTERNAL-IP   OS-IMAGE             KERNEL-VERSION   CONTAINER-RUNTIME
m1c5	Ready	439d	v1.17.0	10.28.36.165  Ubuntu 18.04.3 LTS   4.15.18-24-pve   docker://19.3.5
m1c9	Ready	328d	v1.17.1	10.28.36.169  Ubuntu 18.04.3 LTS   4.15.18-24-pve   docker://19.3.5
m1c4	Ready	439d	v1.17.1	10.28.36.164  Ubuntu 18.04.3 LTS   4.15.18-24-pve   docker://19.3.5

# arping 10.28.36.101 -i vmbr0
ARPING 10.28.36.101
60 bytes from 94:57:a5:d3:b9:aa (10.28.36.101): index=0 time=526.321 usec
60 bytes from 94:57:a5:d3:b9:aa (10.28.36.101): index=1 time=476.319 usec
60 bytes from 94:57:a5:d3:b9:aa (10.28.36.101): index=2 time=872.312 usec
^C
--- 10.28.36.101 statistics ---
3 packets transmitted, 3 packets received,   0% unanswered (0 extra)
rtt min/avg/max/std-dev = 0.476/0.625/0.872/0.176 ms
```

Speaker announcing ARP from `94:57:a5:d3:b9:aa` it is the node `m1c5`

Then I enabled trace on `m1c5`:

```
iptables -t raw -A PREROUTING -s 10.31.1.186/32 -p tcp -m tcp --dport 80 -j TRACE
iptables -t raw -A PREROUTING -d 10.31.1.186/32 -p tcp -m tcp --dport 80 -j TRACE
iptables -t raw -A OUTPUT -s 10.31.1.186/32 -p tcp -m tcp --dport 80 -j TRACE
iptables -t raw -A OUTPUT -d 10.31.1.186/32 -p tcp -m tcp --dport 80 -j TRACE
```

And run curl multiple times:
```
curl http://myapp.example.org/RPC2
```

Each third connection is working because incoming packet is coming into pod which running on the same node (m1c5), but the other two are stuck after they come to `nat:KUBE-POSTROUTING` chain.

I've tried to debug this case, when packet is going to pod on another node (in that case `10.112.3.181`), the weird thig is that after interface is swithed to promisc mode everything is starting working:

```diff
--- promisc off
+++ promisc on
-raw:PREROUTING:policy:3 IN=vmbr0 OUT= PHYSIN=bond0 MAC=94:57:a5:d3:b9:aa:00:22:4d:37:46:92:08:00 SRC=10.31.1.186 DST=10.28.36.101 LEN=60 TOS=0x00 PREC=0x00 TTL=63 ID=42109 DF PROTO=TCP SPT=56204 DPT=80 SEQ=3894021287 ACK=0 WINDOW=64240 RES=0x00 SYN URGP=0 OPT (020405B40402080A8EAFE0650000000001030307) 
-mangle:PREROUTING:policy:1 IN=vmbr0 OUT= PHYSIN=bond0 MAC=94:57:a5:d3:b9:aa:00:22:4d:37:46:92:08:00 SRC=10.31.1.186 DST=10.28.36.101 LEN=60 TOS=0x00 PREC=0x00 TTL=63 ID=42109 DF PROTO=TCP SPT=56204 DPT=80 SEQ=3894021287 ACK=0 WINDOW=64240 RES=0x00 SYN URGP=0 OPT (020405B40402080A8EAFE0650000000001030307) 
-nat:PREROUTING:rule:1 IN=vmbr0 OUT= PHYSIN=bond0 MAC=94:57:a5:d3:b9:aa:00:22:4d:37:46:92:08:00 SRC=10.31.1.186 DST=10.28.36.101 LEN=60 TOS=0x00 PREC=0x00 TTL=63 ID=42109 DF PROTO=TCP SPT=56204 DPT=80 SEQ=3894021287 ACK=0 WINDOW=64240 RES=0x00 SYN URGP=0 OPT (020405B40402080A8EAFE0650000000001030307) 
-nat:KUBE-SERVICES:rule:1 IN=vmbr0 OUT= PHYSIN=bond0 MAC=94:57:a5:d3:b9:aa:00:22:4d:37:46:92:08:00 SRC=10.31.1.186 DST=10.28.36.101 LEN=60 TOS=0x00 PREC=0x00 TTL=63 ID=42109 DF PROTO=TCP SPT=56204 DPT=80 SEQ=3894021287 ACK=0 WINDOW=64240 RES=0x00 SYN URGP=0 OPT (020405B40402080A8EAFE0650000000001030307) 
-nat:KUBE-LOAD-BALANCER:rule:1 IN=vmbr0 OUT= PHYSIN=bond0 MAC=94:57:a5:d3:b9:aa:00:22:4d:37:46:92:08:00 SRC=10.31.1.186 DST=10.28.36.101 LEN=60 TOS=0x00 PREC=0x00 TTL=63 ID=42109 DF PROTO=TCP SPT=56204 DPT=80 SEQ=3894021287 ACK=0 WINDOW=64240 RES=0x00 SYN URGP=0 OPT (020405B40402080A8EAFE0650000000001030307) 
-nat:KUBE-MARK-MASQ:rule:1 IN=vmbr0 OUT= PHYSIN=bond0 MAC=94:57:a5:d3:b9:aa:00:22:4d:37:46:92:08:00 SRC=10.31.1.186 DST=10.28.36.101 LEN=60 TOS=0x00 PREC=0x00 TTL=63 ID=42109 DF PROTO=TCP SPT=56204 DPT=80 SEQ=3894021287 ACK=0 WINDOW=64240 RES=0x00 SYN URGP=0 OPT (020405B40402080A8EAFE0650000000001030307) 
-nat:KUBE-MARK-MASQ:return:2 IN=vmbr0 OUT= PHYSIN=bond0 MAC=94:57:a5:d3:b9:aa:00:22:4d:37:46:92:08:00 SRC=10.31.1.186 DST=10.28.36.101 LEN=60 TOS=0x00 PREC=0x00 TTL=63 ID=42109 DF PROTO=TCP SPT=56204 DPT=80 SEQ=3894021287 ACK=0 WINDOW=64240 RES=0x00 SYN URGP=0 OPT (020405B40402080A8EAFE0650000000001030307) MARK=0x4000 
-nat:KUBE-LOAD-BALANCER:return:2 IN=vmbr0 OUT= PHYSIN=bond0 MAC=94:57:a5:d3:b9:aa:00:22:4d:37:46:92:08:00 SRC=10.31.1.186 DST=10.28.36.101 LEN=60 TOS=0x00 PREC=0x00 TTL=63 ID=42109 DF PROTO=TCP SPT=56204 DPT=80 SEQ=3894021287 ACK=0 WINDOW=64240 RES=0x00 SYN URGP=0 OPT (020405B40402080A8EAFE0650000000001030307) MARK=0x4000 
-nat:KUBE-SERVICES:rule:3 IN=vmbr0 OUT= PHYSIN=bond0 MAC=94:57:a5:d3:b9:aa:00:22:4d:37:46:92:08:00 SRC=10.31.1.186 DST=10.28.36.101 LEN=60 TOS=0x00 PREC=0x00 TTL=63 ID=42109 DF PROTO=TCP SPT=56204 DPT=80 SEQ=3894021287 ACK=0 WINDOW=64240 RES=0x00 SYN URGP=0 OPT (020405B40402080A8EAFE0650000000001030307) MARK=0x4000 
-nat:KUBE-NODE-PORT:return:3 IN=vmbr0 OUT= PHYSIN=bond0 MAC=94:57:a5:d3:b9:aa:00:22:4d:37:46:92:08:00 SRC=10.31.1.186 DST=10.28.36.101 LEN=60 TOS=0x00 PREC=0x00 TTL=63 ID=42109 DF PROTO=TCP SPT=56204 DPT=80 SEQ=3894021287 ACK=0 WINDOW=64240 RES=0x00 SYN URGP=0 OPT (020405B40402080A8EAFE0650000000001030307) MARK=0x4000 
-nat:KUBE-SERVICES:rule:5 IN=vmbr0 OUT= PHYSIN=bond0 MAC=94:57:a5:d3:b9:aa:00:22:4d:37:46:92:08:00 SRC=10.31.1.186 DST=10.28.36.101 LEN=60 TOS=0x00 PREC=0x00 TTL=63 ID=42109 DF PROTO=TCP SPT=56204 DPT=80 SEQ=3894021287 ACK=0 WINDOW=64240 RES=0x00 SYN URGP=0 OPT (020405B40402080A8EAFE0650000000001030307) MARK=0x4000 
-mangle:INPUT:policy:1 IN=vmbr0 OUT= PHYSIN=bond0 MAC=94:57:a5:d3:b9:aa:00:22:4d:37:46:92:08:00 SRC=10.31.1.186 DST=10.28.36.101 LEN=60 TOS=0x00 PREC=0x00 TTL=63 ID=42109 DF PROTO=TCP SPT=56204 DPT=80 SEQ=3894021287 ACK=0 WINDOW=64240 RES=0x00 SYN URGP=0 OPT (020405B40402080A8EAFE0650000000001030307) MARK=0x4000 
-filter:INPUT:rule:1 IN=vmbr0 OUT= PHYSIN=bond0 MAC=94:57:a5:d3:b9:aa:00:22:4d:37:46:92:08:00 SRC=10.31.1.186 DST=10.28.36.101 LEN=60 TOS=0x00 PREC=0x00 TTL=63 ID=42109 DF PROTO=TCP SPT=56204 DPT=80 SEQ=3894021287 ACK=0 WINDOW=64240 RES=0x00 SYN URGP=0 OPT (020405B40402080A8EAFE0650000000001030307) MARK=0x4000 
-filter:KUBE-ROUTER-SERVICES:rule:1 IN=vmbr0 OUT= PHYSIN=bond0 MAC=94:57:a5:d3:b9:aa:00:22:4d:37:46:92:08:00 SRC=10.31.1.186 DST=10.28.36.101 LEN=60 TOS=0x00 PREC=0x00 TTL=63 ID=42109 DF PROTO=TCP SPT=56204 DPT=80 SEQ=3894021287 ACK=0 WINDOW=64240 RES=0x00 SYN URGP=0 OPT (020405B40402080A8EAFE0650000000001030307) MARK=0x4000 
-raw:OUTPUT:rule:1 IN= OUT=vmbr0 PHYSIN=bond0 SRC=10.31.1.186 DST=10.112.3.181 LEN=60 TOS=0x00 PREC=0x00 TTL=62 ID=42109 DF PROTO=TCP SPT=56204 DPT=80 SEQ=3894021287 ACK=0 WINDOW=64240 RES=0x00 SYN URGP=0 OPT (020405B40402080A8EAFE0650000000001030307) MARK=0x4000 
-raw:OUTPUT:policy:3 IN= OUT=vmbr0 PHYSIN=bond0 SRC=10.31.1.186 DST=10.112.3.181 LEN=60 TOS=0x00 PREC=0x00 TTL=62 ID=42109 DF PROTO=TCP SPT=56204 DPT=80 SEQ=3894021287 ACK=0 WINDOW=64240 RES=0x00 SYN URGP=0 OPT (020405B40402080A8EAFE0650000000001030307) MARK=0x4000 
-mangle:OUTPUT:policy:1 IN= OUT=vmbr0 PHYSIN=bond0 SRC=10.31.1.186 DST=10.112.3.181 LEN=60 TOS=0x00 PREC=0x00 TTL=62 ID=42109 DF PROTO=TCP SPT=56204 DPT=80 SEQ=3894021287 ACK=0 WINDOW=64240 RES=0x00 SYN URGP=0 OPT (020405B40402080A8EAFE0650000000001030307) MARK=0x4000 
-filter:OUTPUT:rule:1 IN= OUT=vmbr0 PHYSIN=bond0 SRC=10.31.1.186 DST=10.112.3.181 LEN=60 TOS=0x00 PREC=0x00 TTL=62 ID=42109 DF PROTO=TCP SPT=56204 DPT=80 SEQ=3894021287 ACK=0 WINDOW=64240 RES=0x00 SYN URGP=0 OPT (020405B40402080A8EAFE0650000000001030307) MARK=0x4000 
-filter:KUBE-FIREWALL:return:2 IN= OUT=vmbr0 PHYSIN=bond0 SRC=10.31.1.186 DST=10.112.3.181 LEN=60 TOS=0x00 PREC=0x00 TTL=62 ID=42109 DF PROTO=TCP SPT=56204 DPT=80 SEQ=3894021287 ACK=0 WINDOW=64240 RES=0x00 SYN URGP=0 OPT (020405B40402080A8EAFE0650000000001030307) MARK=0x4000 
-filter:OUTPUT:rule:2 IN= OUT=vmbr0 PHYSIN=bond0 SRC=10.31.1.186 DST=10.112.3.181 LEN=60 TOS=0x00 PREC=0x00 TTL=62 ID=42109 DF PROTO=TCP SPT=56204 DPT=80 SEQ=3894021287 ACK=0 WINDOW=64240 RES=0x00 SYN URGP=0 OPT (020405B40402080A8EAFE0650000000001030307) MARK=0x4000 
-filter:LIBVIRT_OUT:return:1 IN= OUT=vmbr0 PHYSIN=bond0 SRC=10.31.1.186 DST=10.112.3.181 LEN=60 TOS=0x00 PREC=0x00 TTL=62 ID=42109 DF PROTO=TCP SPT=56204 DPT=80 SEQ=3894021287 ACK=0 WINDOW=64240 RES=0x00 SYN URGP=0 OPT (020405B40402080A8EAFE0650000000001030307) MARK=0x4000 
-filter:OUTPUT:policy:3 IN= OUT=vmbr0 PHYSIN=bond0 SRC=10.31.1.186 DST=10.112.3.181 LEN=60 TOS=0x00 PREC=0x00 TTL=62 ID=42109 DF PROTO=TCP SPT=56204 DPT=80 SEQ=3894021287 ACK=0 WINDOW=64240 RES=0x00 SYN URGP=0 OPT (020405B40402080A8EAFE0650000000001030307) MARK=0x4000 
-mangle:POSTROUTING:rule:1 IN= OUT=vmbr0 PHYSIN=bond0 SRC=10.31.1.186 DST=10.112.3.181 LEN=60 TOS=0x00 PREC=0x00 TTL=62 ID=42109 DF PROTO=TCP SPT=56204 DPT=80 SEQ=3894021287 ACK=0 WINDOW=64240 RES=0x00 SYN URGP=0 OPT (020405B40402080A8EAFE0650000000001030307) MARK=0x4000 
-mangle:LIBVIRT_PRT:return:1 IN= OUT=vmbr0 PHYSIN=bond0 SRC=10.31.1.186 DST=10.112.3.181 LEN=60 TOS=0x00 PREC=0x00 TTL=62 ID=42109 DF PROTO=TCP SPT=56204 DPT=80 SEQ=3894021287 ACK=0 WINDOW=64240 RES=0x00 SYN URGP=0 OPT (020405B40402080A8EAFE0650000000001030307) MARK=0x4000 
-mangle:POSTROUTING:policy:2 IN= OUT=vmbr0 PHYSIN=bond0 SRC=10.31.1.186 DST=10.112.3.181 LEN=60 TOS=0x00 PREC=0x00 TTL=62 ID=42109 DF PROTO=TCP SPT=56204 DPT=80 SEQ=3894021287 ACK=0 WINDOW=64240 RES=0x00 SYN URGP=0 OPT (020405B40402080A8EAFE0650000000001030307) MARK=0x4000 
-nat:POSTROUTING:rule:1 IN= OUT=vmbr0 PHYSIN=bond0 SRC=10.31.1.186 DST=10.112.3.181 LEN=60 TOS=0x00 PREC=0x00 TTL=62 ID=42109 DF PROTO=TCP SPT=56204 DPT=80 SEQ=3894021287 ACK=0 WINDOW=64240 RES=0x00 SYN URGP=0 OPT (020405B40402080A8EAFE0650000000001030307) MARK=0x4000 
-nat:KUBE-POSTROUTING:rule:1 IN= OUT=vmbr0 PHYSIN=bond0 SRC=10.31.1.186 DST=10.112.3.181 LEN=60 TOS=0x00 PREC=0x00 TTL=62 ID=42109 DF PROTO=TCP SPT=56204 DPT=80 SEQ=3894021287 ACK=0 WINDOW=64240 RES=0x00 SYN URGP=0 OPT (020405B40402080A8EAFE0650000000001030307) MARK=0x4000 
+raw:PREROUTING:policy:3 IN=vmbr0 OUT= PHYSIN=bond0 MAC=94:57:a5:d3:b9:aa:00:22:4d:37:46:92:08:00 SRC=10.31.1.186 DST=10.28.36.101 LEN=60 TOS=0x00 PREC=0x00 TTL=63 ID=52633 DF PROTO=TCP SPT=56218 DPT=80 SEQ=2710037056 ACK=0 WINDOW=64240 RES=0x00 SYN URGP=0 OPT (020405B40402080A8EB0EA4E0000000001030307) 
+mangle:PREROUTING:policy:1 IN=vmbr0 OUT= PHYSIN=bond0 MAC=94:57:a5:d3:b9:aa:00:22:4d:37:46:92:08:00 SRC=10.31.1.186 DST=10.28.36.101 LEN=60 TOS=0x00 PREC=0x00 TTL=63 ID=52633 DF PROTO=TCP SPT=56218 DPT=80 SEQ=2710037056 ACK=0 WINDOW=64240 RES=0x00 SYN URGP=0 OPT (020405B40402080A8EB0EA4E0000000001030307) 
+nat:PREROUTING:rule:1 IN=vmbr0 OUT= PHYSIN=bond0 MAC=94:57:a5:d3:b9:aa:00:22:4d:37:46:92:08:00 SRC=10.31.1.186 DST=10.28.36.101 LEN=60 TOS=0x00 PREC=0x00 TTL=63 ID=52633 DF PROTO=TCP SPT=56218 DPT=80 SEQ=2710037056 ACK=0 WINDOW=64240 RES=0x00 SYN URGP=0 OPT (020405B40402080A8EB0EA4E0000000001030307) 
+nat:KUBE-SERVICES:rule:1 IN=vmbr0 OUT= PHYSIN=bond0 MAC=94:57:a5:d3:b9:aa:00:22:4d:37:46:92:08:00 SRC=10.31.1.186 DST=10.28.36.101 LEN=60 TOS=0x00 PREC=0x00 TTL=63 ID=52633 DF PROTO=TCP SPT=56218 DPT=80 SEQ=2710037056 ACK=0 WINDOW=64240 RES=0x00 SYN URGP=0 OPT (020405B40402080A8EB0EA4E0000000001030307) 
+nat:KUBE-LOAD-BALANCER:rule:1 IN=vmbr0 OUT= PHYSIN=bond0 MAC=94:57:a5:d3:b9:aa:00:22:4d:37:46:92:08:00 SRC=10.31.1.186 DST=10.28.36.101 LEN=60 TOS=0x00 PREC=0x00 TTL=63 ID=52633 DF PROTO=TCP SPT=56218 DPT=80 SEQ=2710037056 ACK=0 WINDOW=64240 RES=0x00 SYN URGP=0 OPT (020405B40402080A8EB0EA4E0000000001030307) 
+nat:KUBE-MARK-MASQ:rule:1 IN=vmbr0 OUT= PHYSIN=bond0 MAC=94:57:a5:d3:b9:aa:00:22:4d:37:46:92:08:00 SRC=10.31.1.186 DST=10.28.36.101 LEN=60 TOS=0x00 PREC=0x00 TTL=63 ID=52633 DF PROTO=TCP SPT=56218 DPT=80 SEQ=2710037056 ACK=0 WINDOW=64240 RES=0x00 SYN URGP=0 OPT (020405B40402080A8EB0EA4E0000000001030307) 
+nat:KUBE-MARK-MASQ:return:2 IN=vmbr0 OUT= PHYSIN=bond0 MAC=94:57:a5:d3:b9:aa:00:22:4d:37:46:92:08:00 SRC=10.31.1.186 DST=10.28.36.101 LEN=60 TOS=0x00 PREC=0x00 TTL=63 ID=52633 DF PROTO=TCP SPT=56218 DPT=80 SEQ=2710037056 ACK=0 WINDOW=64240 RES=0x00 SYN URGP=0 OPT (020405B40402080A8EB0EA4E0000000001030307) MARK=0x4000 
+nat:KUBE-LOAD-BALANCER:return:2 IN=vmbr0 OUT= PHYSIN=bond0 MAC=94:57:a5:d3:b9:aa:00:22:4d:37:46:92:08:00 SRC=10.31.1.186 DST=10.28.36.101 LEN=60 TOS=0x00 PREC=0x00 TTL=63 ID=52633 DF PROTO=TCP SPT=56218 DPT=80 SEQ=2710037056 ACK=0 WINDOW=64240 RES=0x00 SYN URGP=0 OPT (020405B40402080A8EB0EA4E0000000001030307) MARK=0x4000 
+nat:KUBE-SERVICES:rule:3 IN=vmbr0 OUT= PHYSIN=bond0 MAC=94:57:a5:d3:b9:aa:00:22:4d:37:46:92:08:00 SRC=10.31.1.186 DST=10.28.36.101 LEN=60 TOS=0x00 PREC=0x00 TTL=63 ID=52633 DF PROTO=TCP SPT=56218 DPT=80 SEQ=2710037056 ACK=0 WINDOW=64240 RES=0x00 SYN URGP=0 OPT (020405B40402080A8EB0EA4E0000000001030307) MARK=0x4000 
+nat:KUBE-NODE-PORT:return:3 IN=vmbr0 OUT= PHYSIN=bond0 MAC=94:57:a5:d3:b9:aa:00:22:4d:37:46:92:08:00 SRC=10.31.1.186 DST=10.28.36.101 LEN=60 TOS=0x00 PREC=0x00 TTL=63 ID=52633 DF PROTO=TCP SPT=56218 DPT=80 SEQ=2710037056 ACK=0 WINDOW=64240 RES=0x00 SYN URGP=0 OPT (020405B40402080A8EB0EA4E0000000001030307) MARK=0x4000 
+nat:KUBE-SERVICES:rule:5 IN=vmbr0 OUT= PHYSIN=bond0 MAC=94:57:a5:d3:b9:aa:00:22:4d:37:46:92:08:00 SRC=10.31.1.186 DST=10.28.36.101 LEN=60 TOS=0x00 PREC=0x00 TTL=63 ID=52633 DF PROTO=TCP SPT=56218 DPT=80 SEQ=2710037056 ACK=0 WINDOW=64240 RES=0x00 SYN URGP=0 OPT (020405B40402080A8EB0EA4E0000000001030307) MARK=0x4000 
+mangle:INPUT:policy:1 IN=vmbr0 OUT= PHYSIN=bond0 MAC=94:57:a5:d3:b9:aa:00:22:4d:37:46:92:08:00 SRC=10.31.1.186 DST=10.28.36.101 LEN=60 TOS=0x00 PREC=0x00 TTL=63 ID=52633 DF PROTO=TCP SPT=56218 DPT=80 SEQ=2710037056 ACK=0 WINDOW=64240 RES=0x00 SYN URGP=0 OPT (020405B40402080A8EB0EA4E0000000001030307) MARK=0x4000 
+filter:INPUT:rule:1 IN=vmbr0 OUT= PHYSIN=bond0 MAC=94:57:a5:d3:b9:aa:00:22:4d:37:46:92:08:00 SRC=10.31.1.186 DST=10.28.36.101 LEN=60 TOS=0x00 PREC=0x00 TTL=63 ID=52633 DF PROTO=TCP SPT=56218 DPT=80 SEQ=2710037056 ACK=0 WINDOW=64240 RES=0x00 SYN URGP=0 OPT (020405B40402080A8EB0EA4E0000000001030307) MARK=0x4000 
+filter:KUBE-ROUTER-SERVICES:rule:1 IN=vmbr0 OUT= PHYSIN=bond0 MAC=94:57:a5:d3:b9:aa:00:22:4d:37:46:92:08:00 SRC=10.31.1.186 DST=10.28.36.101 LEN=60 TOS=0x00 PREC=0x00 TTL=63 ID=52633 DF PROTO=TCP SPT=56218 DPT=80 SEQ=2710037056 ACK=0 WINDOW=64240 RES=0x00 SYN URGP=0 OPT (020405B40402080A8EB0EA4E0000000001030307) MARK=0x4000 
+raw:OUTPUT:rule:1 IN= OUT=vmbr0 PHYSIN=bond0 SRC=10.31.1.186 DST=10.112.3.181 LEN=60 TOS=0x00 PREC=0x00 TTL=62 ID=52633 DF PROTO=TCP SPT=56218 DPT=80 SEQ=2710037056 ACK=0 WINDOW=64240 RES=0x00 SYN URGP=0 OPT (020405B40402080A8EB0EA4E0000000001030307) MARK=0x4000 
+raw:OUTPUT:policy:3 IN= OUT=vmbr0 PHYSIN=bond0 SRC=10.31.1.186 DST=10.112.3.181 LEN=60 TOS=0x00 PREC=0x00 TTL=62 ID=52633 DF PROTO=TCP SPT=56218 DPT=80 SEQ=2710037056 ACK=0 WINDOW=64240 RES=0x00 SYN URGP=0 OPT (020405B40402080A8EB0EA4E0000000001030307) MARK=0x4000 
+mangle:OUTPUT:policy:1 IN= OUT=vmbr0 PHYSIN=bond0 SRC=10.31.1.186 DST=10.112.3.181 LEN=60 TOS=0x00 PREC=0x00 TTL=62 ID=52633 DF PROTO=TCP SPT=56218 DPT=80 SEQ=2710037056 ACK=0 WINDOW=64240 RES=0x00 SYN URGP=0 OPT (020405B40402080A8EB0EA4E0000000001030307) MARK=0x4000 
+filter:OUTPUT:rule:1 IN= OUT=vmbr0 PHYSIN=bond0 SRC=10.31.1.186 DST=10.112.3.181 LEN=60 TOS=0x00 PREC=0x00 TTL=62 ID=52633 DF PROTO=TCP SPT=56218 DPT=80 SEQ=2710037056 ACK=0 WINDOW=64240 RES=0x00 SYN URGP=0 OPT (020405B40402080A8EB0EA4E0000000001030307) MARK=0x4000 
+filter:KUBE-FIREWALL:return:2 IN= OUT=vmbr0 PHYSIN=bond0 SRC=10.31.1.186 DST=10.112.3.181 LEN=60 TOS=0x00 PREC=0x00 TTL=62 ID=52633 DF PROTO=TCP SPT=56218 DPT=80 SEQ=2710037056 ACK=0 WINDOW=64240 RES=0x00 SYN URGP=0 OPT (020405B40402080A8EB0EA4E0000000001030307) MARK=0x4000 
+filter:OUTPUT:rule:2 IN= OUT=vmbr0 PHYSIN=bond0 SRC=10.31.1.186 DST=10.112.3.181 LEN=60 TOS=0x00 PREC=0x00 TTL=62 ID=52633 DF PROTO=TCP SPT=56218 DPT=80 SEQ=2710037056 ACK=0 WINDOW=64240 RES=0x00 SYN URGP=0 OPT (020405B40402080A8EB0EA4E0000000001030307) MARK=0x4000 
+filter:LIBVIRT_OUT:return:1 IN= OUT=vmbr0 PHYSIN=bond0 SRC=10.31.1.186 DST=10.112.3.181 LEN=60 TOS=0x00 PREC=0x00 TTL=62 ID=52633 DF PROTO=TCP SPT=56218 DPT=80 SEQ=2710037056 ACK=0 WINDOW=64240 RES=0x00 SYN URGP=0 OPT (020405B40402080A8EB0EA4E0000000001030307) MARK=0x4000 
+filter:OUTPUT:policy:3 IN= OUT=vmbr0 PHYSIN=bond0 SRC=10.31.1.186 DST=10.112.3.181 LEN=60 TOS=0x00 PREC=0x00 TTL=62 ID=52633 DF PROTO=TCP SPT=56218 DPT=80 SEQ=2710037056 ACK=0 WINDOW=64240 RES=0x00 SYN URGP=0 OPT (020405B40402080A8EB0EA4E0000000001030307) MARK=0x4000 
+mangle:POSTROUTING:rule:1 IN= OUT=vmbr0 PHYSIN=bond0 SRC=10.31.1.186 DST=10.112.3.181 LEN=60 TOS=0x00 PREC=0x00 TTL=62 ID=52633 DF PROTO=TCP SPT=56218 DPT=80 SEQ=2710037056 ACK=0 WINDOW=64240 RES=0x00 SYN URGP=0 OPT (020405B40402080A8EB0EA4E0000000001030307) MARK=0x4000 
+mangle:LIBVIRT_PRT:return:1 IN= OUT=vmbr0 PHYSIN=bond0 SRC=10.31.1.186 DST=10.112.3.181 LEN=60 TOS=0x00 PREC=0x00 TTL=62 ID=52633 DF PROTO=TCP SPT=56218 DPT=80 SEQ=2710037056 ACK=0 WINDOW=64240 RES=0x00 SYN URGP=0 OPT (020405B40402080A8EB0EA4E0000000001030307) MARK=0x4000 
+mangle:POSTROUTING:policy:2 IN= OUT=vmbr0 PHYSIN=bond0 SRC=10.31.1.186 DST=10.112.3.181 LEN=60 TOS=0x00 PREC=0x00 TTL=62 ID=52633 DF PROTO=TCP SPT=56218 DPT=80 SEQ=2710037056 ACK=0 WINDOW=64240 RES=0x00 SYN URGP=0 OPT (020405B40402080A8EB0EA4E0000000001030307) MARK=0x4000 
+nat:POSTROUTING:rule:1 IN= OUT=vmbr0 PHYSIN=bond0 SRC=10.31.1.186 DST=10.112.3.181 LEN=60 TOS=0x00 PREC=0x00 TTL=62 ID=52633 DF PROTO=TCP SPT=56218 DPT=80 SEQ=2710037056 ACK=0 WINDOW=64240 RES=0x00 SYN URGP=0 OPT (020405B40402080A8EB0EA4E0000000001030307) MARK=0x4000 
+nat:KUBE-POSTROUTING:rule:1 IN= OUT=vmbr0 PHYSIN=bond0 SRC=10.31.1.186 DST=10.112.3.181 LEN=60 TOS=0x00 PREC=0x00 TTL=62 ID=52633 DF PROTO=TCP SPT=56218 DPT=80 SEQ=2710037056 ACK=0 WINDOW=64240 RES=0x00 SYN URGP=0 OPT (020405B40402080A8EB0EA4E0000000001030307) MARK=0x4000 
+raw:PREROUTING:policy:3 IN=vmbr0 OUT= PHYSIN=bond0 MAC=94:57:a5:d3:b9:aa:00:22:4d:37:46:92:08:00 SRC=10.31.1.186 DST=10.28.36.101 LEN=52 TOS=0x00 PREC=0x00 TTL=63 ID=52634 DF PROTO=TCP SPT=56218 DPT=80 SEQ=2710037057 ACK=984698851 WINDOW=502 RES=0x00 ACK URGP=0 OPT (0101080A8EB0EA4F12B8F65D) 
+mangle:PREROUTING:policy:1 IN=vmbr0 OUT= PHYSIN=bond0 MAC=94:57:a5:d3:b9:aa:00:22:4d:37:46:92:08:00 SRC=10.31.1.186 DST=10.28.36.101 LEN=52 TOS=0x00 PREC=0x00 TTL=63 ID=52634 DF PROTO=TCP SPT=56218 DPT=80 SEQ=2710037057 ACK=984698851 WINDOW=502 RES=0x00 ACK URGP=0 OPT (0101080A8EB0EA4F12B8F65D) 
+mangle:INPUT:policy:1 IN=vmbr0 OUT= PHYSIN=bond0 MAC=94:57:a5:d3:b9:aa:00:22:4d:37:46:92:08:00 SRC=10.31.1.186 DST=10.28.36.101 LEN=52 TOS=0x00 PREC=0x00 TTL=63 ID=52634 DF PROTO=TCP SPT=56218 DPT=80 SEQ=2710037057 ACK=984698851 WINDOW=502 RES=0x00 ACK URGP=0 OPT (0101080A8EB0EA4F12B8F65D) 
+filter:INPUT:rule:1 IN=vmbr0 OUT= PHYSIN=bond0 MAC=94:57:a5:d3:b9:aa:00:22:4d:37:46:92:08:00 SRC=10.31.1.186 DST=10.28.36.101 LEN=52 TOS=0x00 PREC=0x00 TTL=63 ID=52634 DF PROTO=TCP SPT=56218 DPT=80 SEQ=2710037057 ACK=984698851 WINDOW=502 RES=0x00 ACK URGP=0 OPT (0101080A8EB0EA4F12B8F65D) 
+filter:KUBE-ROUTER-SERVICES:rule:1 IN=vmbr0 OUT= PHYSIN=bond0 MAC=94:57:a5:d3:b9:aa:00:22:4d:37:46:92:08:00 SRC=10.31.1.186 DST=10.28.36.101 LEN=52 TOS=0x00 PREC=0x00 TTL=63 ID=52634 DF PROTO=TCP SPT=56218 DPT=80 SEQ=2710037057 ACK=984698851 WINDOW=502 RES=0x00 ACK URGP=0 OPT (0101080A8EB0EA4F12B8F65D) 
+raw:OUTPUT:rule:1 IN= OUT=vmbr0 PHYSIN=bond0 SRC=10.31.1.186 DST=10.112.3.181 LEN=52 TOS=0x00 PREC=0x00 TTL=62 ID=52634 DF PROTO=TCP SPT=56218 DPT=80 SEQ=2710037057 ACK=984698851 WINDOW=502 RES=0x00 ACK URGP=0 OPT (0101080A8EB0EA4F12B8F65D) 
+raw:OUTPUT:policy:3 IN= OUT=vmbr0 PHYSIN=bond0 SRC=10.31.1.186 DST=10.112.3.181 LEN=52 TOS=0x00 PREC=0x00 TTL=62 ID=52634 DF PROTO=TCP SPT=56218 DPT=80 SEQ=2710037057 ACK=984698851 WINDOW=502 RES=0x00 ACK URGP=0 OPT (0101080A8EB0EA4F12B8F65D) 
+mangle:OUTPUT:policy:1 IN= OUT=vmbr0 PHYSIN=bond0 SRC=10.31.1.186 DST=10.112.3.181 LEN=52 TOS=0x00 PREC=0x00 TTL=62 ID=52634 DF PROTO=TCP SPT=56218 DPT=80 SEQ=2710037057 ACK=984698851 WINDOW=502 RES=0x00 ACK URGP=0 OPT (0101080A8EB0EA4F12B8F65D) 
+filter:OUTPUT:rule:1 IN= OUT=vmbr0 PHYSIN=bond0 SRC=10.31.1.186 DST=10.112.3.181 LEN=52 TOS=0x00 PREC=0x00 TTL=62 ID=52634 DF PROTO=TCP SPT=56218 DPT=80 SEQ=2710037057 ACK=984698851 WINDOW=502 RES=0x00 ACK URGP=0 OPT (0101080A8EB0EA4F12B8F65D) 
+filter:KUBE-FIREWALL:return:2 IN= OUT=vmbr0 PHYSIN=bond0 SRC=10.31.1.186 DST=10.112.3.181 LEN=52 TOS=0x00 PREC=0x00 TTL=62 ID=52634 DF PROTO=TCP SPT=56218 DPT=80 SEQ=2710037057 ACK=984698851 WINDOW=502 RES=0x00 ACK URGP=0 OPT (0101080A8EB0EA4F12B8F65D) 
+filter:OUTPUT:rule:2 IN= OUT=vmbr0 PHYSIN=bond0 SRC=10.31.1.186 DST=10.112.3.181 LEN=52 TOS=0x00 PREC=0x00 TTL=62 ID=52634 DF PROTO=TCP SPT=56218 DPT=80 SEQ=2710037057 ACK=984698851 WINDOW=502 RES=0x00 ACK URGP=0 OPT (0101080A8EB0EA4F12B8F65D) 
+filter:LIBVIRT_OUT:return:1 IN= OUT=vmbr0 PHYSIN=bond0 SRC=10.31.1.186 DST=10.112.3.181 LEN=52 TOS=0x00 PREC=0x00 TTL=62 ID=52634 DF PROTO=TCP SPT=56218 DPT=80 SEQ=2710037057 ACK=984698851 WINDOW=502 RES=0x00 ACK URGP=0 OPT (0101080A8EB0EA4F12B8F65D) 
+filter:OUTPUT:policy:3 IN= OUT=vmbr0 PHYSIN=bond0 SRC=10.31.1.186 DST=10.112.3.181 LEN=52 TOS=0x00 PREC=0x00 TTL=62 ID=52634 DF PROTO=TCP SPT=56218 DPT=80 SEQ=2710037057 ACK=984698851 WINDOW=502 RES=0x00 ACK URGP=0 OPT (0101080A8EB0EA4F12B8F65D) 
+mangle:POSTROUTING:rule:1 IN= OUT=vmbr0 PHYSIN=bond0 SRC=10.31.1.186 DST=10.112.3.181 LEN=52 TOS=0x00 PREC=0x00 TTL=62 ID=52634 DF PROTO=TCP SPT=56218 DPT=80 SEQ=2710037057 ACK=984698851 WINDOW=502 RES=0x00 ACK URGP=0 OPT (0101080A8EB0EA4F12B8F65D) 
+mangle:LIBVIRT_PRT:return:1 IN= OUT=vmbr0 PHYSIN=bond0 SRC=10.31.1.186 DST=10.112.3.181 LEN=52 TOS=0x00 PREC=0x00 TTL=62 ID=52634 DF PROTO=TCP SPT=56218 DPT=80 SEQ=2710037057 ACK=984698851 WINDOW=502 RES=0x00 ACK URGP=0 OPT (0101080A8EB0EA4F12B8F65D) 
+mangle:POSTROUTING:policy:2 IN= OUT=vmbr0 PHYSIN=bond0 SRC=10.31.1.186 DST=10.112.3.181 LEN=52 TOS=0x00 PREC=0x00 TTL=62 ID=52634 DF PROTO=TCP SPT=56218 DPT=80 SEQ=2710037057 ACK=984698851 WINDOW=502 RES=0x00 ACK URGP=0 OPT (0101080A8EB0EA4F12B8F65D) 
+raw:PREROUTING:policy:3 IN=vmbr0 OUT= PHYSIN=bond0 MAC=94:57:a5:d3:b9:aa:00:22:4d:37:46:92:08:00 SRC=10.31.1.186 DST=10.28.36.101 LEN=146 TOS=0x00 PREC=0x00 TTL=63 ID=52635 DF PROTO=TCP SPT=56218 DPT=80 SEQ=2710037057 ACK=984698851 WINDOW=502 RES=0x00 ACK PSH URGP=0 OPT (0101080A8EB0EA4F12B8F65D) 
+mangle:PREROUTING:policy:1 IN=vmbr0 OUT= PHYSIN=bond0 MAC=94:57:a5:d3:b9:aa:00:22:4d:37:46:92:08:00 SRC=10.31.1.186 DST=10.28.36.101 LEN=146 TOS=0x00 PREC=0x00 TTL=63 ID=52635 DF PROTO=TCP SPT=56218 DPT=80 SEQ=2710037057 ACK=984698851 WINDOW=502 RES=0x00 ACK PSH URGP=0 OPT (0101080A8EB0EA4F12B8F65D) 
+mangle:INPUT:policy:1 IN=vmbr0 OUT= PHYSIN=bond0 MAC=94:57:a5:d3:b9:aa:00:22:4d:37:46:92:08:00 SRC=10.31.1.186 DST=10.28.36.101 LEN=146 TOS=0x00 PREC=0x00 TTL=63 ID=52635 DF PROTO=TCP SPT=56218 DPT=80 SEQ=2710037057 ACK=984698851 WINDOW=502 RES=0x00 ACK PSH URGP=0 OPT (0101080A8EB0EA4F12B8F65D) 
+filter:INPUT:rule:1 IN=vmbr0 OUT= PHYSIN=bond0 MAC=94:57:a5:d3:b9:aa:00:22:4d:37:46:92:08:00 SRC=10.31.1.186 DST=10.28.36.101 LEN=146 TOS=0x00 PREC=0x00 TTL=63 ID=52635 DF PROTO=TCP SPT=56218 DPT=80 SEQ=2710037057 ACK=984698851 WINDOW=502 RES=0x00 ACK PSH URGP=0 OPT (0101080A8EB0EA4F12B8F65D) 
+filter:KUBE-ROUTER-SERVICES:rule:1 IN=vmbr0 OUT= PHYSIN=bond0 MAC=94:57:a5:d3:b9:aa:00:22:4d:37:46:92:08:00 SRC=10.31.1.186 DST=10.28.36.101 LEN=146 TOS=0x00 PREC=0x00 TTL=63 ID=52635 DF PROTO=TCP SPT=56218 DPT=80 SEQ=2710037057 ACK=984698851 WINDOW=502 RES=0x00 ACK PSH URGP=0 OPT (0101080A8EB0EA4F12B8F65D) 
+raw:OUTPUT:rule:1 IN= OUT=vmbr0 PHYSIN=bond0 SRC=10.31.1.186 DST=10.112.3.181 LEN=146 TOS=0x00 PREC=0x00 TTL=62 ID=52635 DF PROTO=TCP SPT=56218 DPT=80 SEQ=2710037057 ACK=984698851 WINDOW=502 RES=0x00 ACK PSH URGP=0 OPT (0101080A8EB0EA4F12B8F65D) 
+raw:OUTPUT:policy:3 IN= OUT=vmbr0 PHYSIN=bond0 SRC=10.31.1.186 DST=10.112.3.181 LEN=146 TOS=0x00 PREC=0x00 TTL=62 ID=52635 DF PROTO=TCP SPT=56218 DPT=80 SEQ=2710037057 ACK=984698851 WINDOW=502 RES=0x00 ACK PSH URGP=0 OPT (0101080A8EB0EA4F12B8F65D) 
+mangle:OUTPUT:policy:1 IN= OUT=vmbr0 PHYSIN=bond0 SRC=10.31.1.186 DST=10.112.3.181 LEN=146 TOS=0x00 PREC=0x00 TTL=62 ID=52635 DF PROTO=TCP SPT=56218 DPT=80 SEQ=2710037057 ACK=984698851 WINDOW=502 RES=0x00 ACK PSH URGP=0 OPT (0101080A8EB0EA4F12B8F65D) 
+filter:OUTPUT:rule:1 IN= OUT=vmbr0 PHYSIN=bond0 SRC=10.31.1.186 DST=10.112.3.181 LEN=146 TOS=0x00 PREC=0x00 TTL=62 ID=52635 DF PROTO=TCP SPT=56218 DPT=80 SEQ=2710037057 ACK=984698851 WINDOW=502 RES=0x00 ACK PSH URGP=0 OPT (0101080A8EB0EA4F12B8F65D) 
+filter:KUBE-FIREWALL:return:2 IN= OUT=vmbr0 PHYSIN=bond0 SRC=10.31.1.186 DST=10.112.3.181 LEN=146 TOS=0x00 PREC=0x00 TTL=62 ID=52635 DF PROTO=TCP SPT=56218 DPT=80 SEQ=2710037057 ACK=984698851 WINDOW=502 RES=0x00 ACK PSH URGP=0 OPT (0101080A8EB0EA4F12B8F65D) 
+filter:OUTPUT:rule:2 IN= OUT=vmbr0 PHYSIN=bond0 SRC=10.31.1.186 DST=10.112.3.181 LEN=146 TOS=0x00 PREC=0x00 TTL=62 ID=52635 DF PROTO=TCP SPT=56218 DPT=80 SEQ=2710037057 ACK=984698851 WINDOW=502 RES=0x00 ACK PSH URGP=0 OPT (0101080A8EB0EA4F12B8F65D) 
+filter:LIBVIRT_OUT:return:1 IN= OUT=vmbr0 PHYSIN=bond0 SRC=10.31.1.186 DST=10.112.3.181 LEN=146 TOS=0x00 PREC=0x00 TTL=62 ID=52635 DF PROTO=TCP SPT=56218 DPT=80 SEQ=2710037057 ACK=984698851 WINDOW=502 RES=0x00 ACK PSH URGP=0 OPT (0101080A8EB0EA4F12B8F65D) 
+filter:OUTPUT:policy:3 IN= OUT=vmbr0 PHYSIN=bond0 SRC=10.31.1.186 DST=10.112.3.181 LEN=146 TOS=0x00 PREC=0x00 TTL=62 ID=52635 DF PROTO=TCP SPT=56218 DPT=80 SEQ=2710037057 ACK=984698851 WINDOW=502 RES=0x00 ACK PSH URGP=0 OPT (0101080A8EB0EA4F12B8F65D) 
+mangle:POSTROUTING:rule:1 IN= OUT=vmbr0 PHYSIN=bond0 SRC=10.31.1.186 DST=10.112.3.181 LEN=146 TOS=0x00 PREC=0x00 TTL=62 ID=52635 DF PROTO=TCP SPT=56218 DPT=80 SEQ=2710037057 ACK=984698851 WINDOW=502 RES=0x00 ACK PSH URGP=0 OPT (0101080A8EB0EA4F12B8F65D) 
+mangle:LIBVIRT_PRT:return:1 IN= OUT=vmbr0 PHYSIN=bond0 SRC=10.31.1.186 DST=10.112.3.181 LEN=146 TOS=0x00 PREC=0x00 TTL=62 ID=52635 DF PROTO=TCP SPT=56218 DPT=80 SEQ=2710037057 ACK=984698851 WINDOW=502 RES=0x00 ACK PSH URGP=0 OPT (0101080A8EB0EA4F12B8F65D) 
+mangle:POSTROUTING:policy:2 IN= OUT=vmbr0 PHYSIN=bond0 SRC=10.31.1.186 DST=10.112.3.181 LEN=146 TOS=0x00 PREC=0x00 TTL=62 ID=52635 DF PROTO=TCP SPT=56218 DPT=80 SEQ=2710037057 ACK=984698851 WINDOW=502 RES=0x00 ACK PSH URGP=0 OPT (0101080A8EB0EA4F12B8F65D) 
+raw:PREROUTING:policy:3 IN=vmbr0 OUT= PHYSIN=bond0 MAC=94:57:a5:d3:b9:aa:00:22:4d:37:46:92:08:00 SRC=10.31.1.186 DST=10.28.36.101 LEN=52 TOS=0x00 PREC=0x00 TTL=63 ID=52636 DF PROTO=TCP SPT=56218 DPT=80 SEQ=2710037151 ACK=984699539 WINDOW=501 RES=0x00 ACK URGP=0 OPT (0101080A8EB0EA5212B8F660) 
+mangle:PREROUTING:policy:1 IN=vmbr0 OUT= PHYSIN=bond0 MAC=94:57:a5:d3:b9:aa:00:22:4d:37:46:92:08:00 SRC=10.31.1.186 DST=10.28.36.101 LEN=52 TOS=0x00 PREC=0x00 TTL=63 ID=52636 DF PROTO=TCP SPT=56218 DPT=80 SEQ=2710037151 ACK=984699539 WINDOW=501 RES=0x00 ACK URGP=0 OPT (0101080A8EB0EA5212B8F660) 
+mangle:INPUT:policy:1 IN=vmbr0 OUT= PHYSIN=bond0 MAC=94:57:a5:d3:b9:aa:00:22:4d:37:46:92:08:00 SRC=10.31.1.186 DST=10.28.36.101 LEN=52 TOS=0x00 PREC=0x00 TTL=63 ID=52636 DF PROTO=TCP SPT=56218 DPT=80 SEQ=2710037151 ACK=984699539 WINDOW=501 RES=0x00 ACK URGP=0 OPT (0101080A8EB0EA5212B8F660) 
+filter:INPUT:rule:1 IN=vmbr0 OUT= PHYSIN=bond0 MAC=94:57:a5:d3:b9:aa:00:22:4d:37:46:92:08:00 SRC=10.31.1.186 DST=10.28.36.101 LEN=52 TOS=0x00 PREC=0x00 TTL=63 ID=52636 DF PROTO=TCP SPT=56218 DPT=80 SEQ=2710037151 ACK=984699539 WINDOW=501 RES=0x00 ACK URGP=0 OPT (0101080A8EB0EA5212B8F660) 
+filter:KUBE-ROUTER-SERVICES:rule:1 IN=vmbr0 OUT= PHYSIN=bond0 MAC=94:57:a5:d3:b9:aa:00:22:4d:37:46:92:08:00 SRC=10.31.1.186 DST=10.28.36.101 LEN=52 TOS=0x00 PREC=0x00 TTL=63 ID=52636 DF PROTO=TCP SPT=56218 DPT=80 SEQ=2710037151 ACK=984699539 WINDOW=501 RES=0x00 ACK URGP=0 OPT (0101080A8EB0EA5212B8F660) 
+raw:OUTPUT:rule:1 IN= OUT=vmbr0 PHYSIN=bond0 SRC=10.31.1.186 DST=10.112.3.181 LEN=52 TOS=0x00 PREC=0x00 TTL=62 ID=52636 DF PROTO=TCP SPT=56218 DPT=80 SEQ=2710037151 ACK=984699539 WINDOW=501 RES=0x00 ACK URGP=0 OPT (0101080A8EB0EA5212B8F660) 
+raw:OUTPUT:policy:3 IN= OUT=vmbr0 PHYSIN=bond0 SRC=10.31.1.186 DST=10.112.3.181 LEN=52 TOS=0x00 PREC=0x00 TTL=62 ID=52636 DF PROTO=TCP SPT=56218 DPT=80 SEQ=2710037151 ACK=984699539 WINDOW=501 RES=0x00 ACK URGP=0 OPT (0101080A8EB0EA5212B8F660) 
+mangle:OUTPUT:policy:1 IN= OUT=vmbr0 PHYSIN=bond0 SRC=10.31.1.186 DST=10.112.3.181 LEN=52 TOS=0x00 PREC=0x00 TTL=62 ID=52636 DF PROTO=TCP SPT=56218 DPT=80 SEQ=2710037151 ACK=984699539 WINDOW=501 RES=0x00 ACK URGP=0 OPT (0101080A8EB0EA5212B8F660) 
+filter:OUTPUT:rule:1 IN= OUT=vmbr0 PHYSIN=bond0 SRC=10.31.1.186 DST=10.112.3.181 LEN=52 TOS=0x00 PREC=0x00 TTL=62 ID=52636 DF PROTO=TCP SPT=56218 DPT=80 SEQ=2710037151 ACK=984699539 WINDOW=501 RES=0x00 ACK URGP=0 OPT (0101080A8EB0EA5212B8F660) 
+filter:KUBE-FIREWALL:return:2 IN= OUT=vmbr0 PHYSIN=bond0 SRC=10.31.1.186 DST=10.112.3.181 LEN=52 TOS=0x00 PREC=0x00 TTL=62 ID=52636 DF PROTO=TCP SPT=56218 DPT=80 SEQ=2710037151 ACK=984699539 WINDOW=501 RES=0x00 ACK URGP=0 OPT (0101080A8EB0EA5212B8F660) 
+filter:OUTPUT:rule:2 IN= OUT=vmbr0 PHYSIN=bond0 SRC=10.31.1.186 DST=10.112.3.181 LEN=52 TOS=0x00 PREC=0x00 TTL=62 ID=52636 DF PROTO=TCP SPT=56218 DPT=80 SEQ=2710037151 ACK=984699539 WINDOW=501 RES=0x00 ACK URGP=0 OPT (0101080A8EB0EA5212B8F660) 
+filter:LIBVIRT_OUT:return:1 IN= OUT=vmbr0 PHYSIN=bond0 SRC=10.31.1.186 DST=10.112.3.181 LEN=52 TOS=0x00 PREC=0x00 TTL=62 ID=52636 DF PROTO=TCP SPT=56218 DPT=80 SEQ=2710037151 ACK=984699539 WINDOW=501 RES=0x00 ACK URGP=0 OPT (0101080A8EB0EA5212B8F660) 
+filter:OUTPUT:policy:3 IN= OUT=vmbr0 PHYSIN=bond0 SRC=10.31.1.186 DST=10.112.3.181 LEN=52 TOS=0x00 PREC=0x00 TTL=62 ID=52636 DF PROTO=TCP SPT=56218 DPT=80 SEQ=2710037151 ACK=984699539 WINDOW=501 RES=0x00 ACK URGP=0 OPT (0101080A8EB0EA5212B8F660) 
+mangle:POSTROUTING:rule:1 IN= OUT=vmbr0 PHYSIN=bond0 SRC=10.31.1.186 DST=10.112.3.181 LEN=52 TOS=0x00 PREC=0x00 TTL=62 ID=52636 DF PROTO=TCP SPT=56218 DPT=80 SEQ=2710037151 ACK=984699539 WINDOW=501 RES=0x00 ACK URGP=0 OPT (0101080A8EB0EA5212B8F660) 
+mangle:LIBVIRT_PRT:return:1 IN= OUT=vmbr0 PHYSIN=bond0 SRC=10.31.1.186 DST=10.112.3.181 LEN=52 TOS=0x00 PREC=0x00 TTL=62 ID=52636 DF PROTO=TCP SPT=56218 DPT=80 SEQ=2710037151 ACK=984699539 WINDOW=501 RES=0x00 ACK URGP=0 OPT (0101080A8EB0EA5212B8F660) 
+mangle:POSTROUTING:policy:2 IN= OUT=vmbr0 PHYSIN=bond0 SRC=10.31.1.186 DST=10.112.3.181 LEN=52 TOS=0x00 PREC=0x00 TTL=62 ID=52636 DF PROTO=TCP SPT=56218 DPT=80 SEQ=2710037151 ACK=984699539 WINDOW=501 RES=0x00 ACK URGP=0 OPT (0101080A8EB0EA5212B8F660) 
+raw:PREROUTING:policy:3 IN=vmbr0 OUT= PHYSIN=bond0 MAC=94:57:a5:d3:b9:aa:00:22:4d:37:46:92:08:00 SRC=10.31.1.186 DST=10.28.36.101 LEN=52 TOS=0x00 PREC=0x00 TTL=63 ID=52637 DF PROTO=TCP SPT=56218 DPT=80 SEQ=2710037151 ACK=984699539 WINDOW=501 RES=0x00 ACK FIN URGP=0 OPT (0101080A8EB0EA5212B8F660) 
+mangle:PREROUTING:policy:1 IN=vmbr0 OUT= PHYSIN=bond0 MAC=94:57:a5:d3:b9:aa:00:22:4d:37:46:92:08:00 SRC=10.31.1.186 DST=10.28.36.101 LEN=52 TOS=0x00 PREC=0x00 TTL=63 ID=52637 DF PROTO=TCP SPT=56218 DPT=80 SEQ=2710037151 ACK=984699539 WINDOW=501 RES=0x00 ACK FIN URGP=0 OPT (0101080A8EB0EA5212B8F660) 
+mangle:INPUT:policy:1 IN=vmbr0 OUT= PHYSIN=bond0 MAC=94:57:a5:d3:b9:aa:00:22:4d:37:46:92:08:00 SRC=10.31.1.186 DST=10.28.36.101 LEN=52 TOS=0x00 PREC=0x00 TTL=63 ID=52637 DF PROTO=TCP SPT=56218 DPT=80 SEQ=2710037151 ACK=984699539 WINDOW=501 RES=0x00 ACK FIN URGP=0 OPT (0101080A8EB0EA5212B8F660) 
+filter:INPUT:rule:1 IN=vmbr0 OUT= PHYSIN=bond0 MAC=94:57:a5:d3:b9:aa:00:22:4d:37:46:92:08:00 SRC=10.31.1.186 DST=10.28.36.101 LEN=52 TOS=0x00 PREC=0x00 TTL=63 ID=52637 DF PROTO=TCP SPT=56218 DPT=80 SEQ=2710037151 ACK=984699539 WINDOW=501 RES=0x00 ACK FIN URGP=0 OPT (0101080A8EB0EA5212B8F660) 
+filter:KUBE-ROUTER-SERVICES:rule:1 IN=vmbr0 OUT= PHYSIN=bond0 MAC=94:57:a5:d3:b9:aa:00:22:4d:37:46:92:08:00 SRC=10.31.1.186 DST=10.28.36.101 LEN=52 TOS=0x00 PREC=0x00 TTL=63 ID=52637 DF PROTO=TCP SPT=56218 DPT=80 SEQ=2710037151 ACK=984699539 WINDOW=501 RES=0x00 ACK FIN URGP=0 OPT (0101080A8EB0EA5212B8F660) 
+raw:OUTPUT:rule:1 IN= OUT=vmbr0 PHYSIN=bond0 SRC=10.31.1.186 DST=10.112.3.181 LEN=52 TOS=0x00 PREC=0x00 TTL=62 ID=52637 DF PROTO=TCP SPT=56218 DPT=80 SEQ=2710037151 ACK=984699539 WINDOW=501 RES=0x00 ACK FIN URGP=0 OPT (0101080A8EB0EA5212B8F660) 
+raw:OUTPUT:policy:3 IN= OUT=vmbr0 PHYSIN=bond0 SRC=10.31.1.186 DST=10.112.3.181 LEN=52 TOS=0x00 PREC=0x00 TTL=62 ID=52637 DF PROTO=TCP SPT=56218 DPT=80 SEQ=2710037151 ACK=984699539 WINDOW=501 RES=0x00 ACK FIN URGP=0 OPT (0101080A8EB0EA5212B8F660) 
+mangle:OUTPUT:policy:1 IN= OUT=vmbr0 PHYSIN=bond0 SRC=10.31.1.186 DST=10.112.3.181 LEN=52 TOS=0x00 PREC=0x00 TTL=62 ID=52637 DF PROTO=TCP SPT=56218 DPT=80 SEQ=2710037151 ACK=984699539 WINDOW=501 RES=0x00 ACK FIN URGP=0 OPT (0101080A8EB0EA5212B8F660) 
+filter:OUTPUT:rule:1 IN= OUT=vmbr0 PHYSIN=bond0 SRC=10.31.1.186 DST=10.112.3.181 LEN=52 TOS=0x00 PREC=0x00 TTL=62 ID=52637 DF PROTO=TCP SPT=56218 DPT=80 SEQ=2710037151 ACK=984699539 WINDOW=501 RES=0x00 ACK FIN URGP=0 OPT (0101080A8EB0EA5212B8F660) 
+filter:KUBE-FIREWALL:return:2 IN= OUT=vmbr0 PHYSIN=bond0 SRC=10.31.1.186 DST=10.112.3.181 LEN=52 TOS=0x00 PREC=0x00 TTL=62 ID=52637 DF PROTO=TCP SPT=56218 DPT=80 SEQ=2710037151 ACK=984699539 WINDOW=501 RES=0x00 ACK FIN URGP=0 OPT (0101080A8EB0EA5212B8F660) 
+filter:OUTPUT:rule:2 IN= OUT=vmbr0 PHYSIN=bond0 SRC=10.31.1.186 DST=10.112.3.181 LEN=52 TOS=0x00 PREC=0x00 TTL=62 ID=52637 DF PROTO=TCP SPT=56218 DPT=80 SEQ=2710037151 ACK=984699539 WINDOW=501 RES=0x00 ACK FIN URGP=0 OPT (0101080A8EB0EA5212B8F660) 
+filter:LIBVIRT_OUT:return:1 IN= OUT=vmbr0 PHYSIN=bond0 SRC=10.31.1.186 DST=10.112.3.181 LEN=52 TOS=0x00 PREC=0x00 TTL=62 ID=52637 DF PROTO=TCP SPT=56218 DPT=80 SEQ=2710037151 ACK=984699539 WINDOW=501 RES=0x00 ACK FIN URGP=0 OPT (0101080A8EB0EA5212B8F660) 
+filter:OUTPUT:policy:3 IN= OUT=vmbr0 PHYSIN=bond0 SRC=10.31.1.186 DST=10.112.3.181 LEN=52 TOS=0x00 PREC=0x00 TTL=62 ID=52637 DF PROTO=TCP SPT=56218 DPT=80 SEQ=2710037151 ACK=984699539 WINDOW=501 RES=0x00 ACK FIN URGP=0 OPT (0101080A8EB0EA5212B8F660) 
+mangle:POSTROUTING:rule:1 IN= OUT=vmbr0 PHYSIN=bond0 SRC=10.31.1.186 DST=10.112.3.181 LEN=52 TOS=0x00 PREC=0x00 TTL=62 ID=52637 DF PROTO=TCP SPT=56218 DPT=80 SEQ=2710037151 ACK=984699539 WINDOW=501 RES=0x00 ACK FIN URGP=0 OPT (0101080A8EB0EA5212B8F660) 
+mangle:LIBVIRT_PRT:return:1 IN= OUT=vmbr0 PHYSIN=bond0 SRC=10.31.1.186 DST=10.112.3.181 LEN=52 TOS=0x00 PREC=0x00 TTL=62 ID=52637 DF PROTO=TCP SPT=56218 DPT=80 SEQ=2710037151 ACK=984699539 WINDOW=501 RES=0x00 ACK FIN URGP=0 OPT (0101080A8EB0EA5212B8F660) 
+mangle:POSTROUTING:policy:2 IN= OUT=vmbr0 PHYSIN=bond0 SRC=10.31.1.186 DST=10.112.3.181 LEN=52 TOS=0x00 PREC=0x00 TTL=62 ID=52637 DF PROTO=TCP SPT=56218 DPT=80 SEQ=2710037151 ACK=984699539 WINDOW=501 RES=0x00 ACK FIN URGP=0 OPT (0101080A8EB0EA5212B8F660) 
+raw:PREROUTING:policy:3 IN=vmbr0 OUT= PHYSIN=bond0 MAC=94:57:a5:d3:b9:aa:00:22:4d:37:46:92:08:00 SRC=10.31.1.186 DST=10.28.36.101 LEN=52 TOS=0x00 PREC=0x00 TTL=63 ID=52638 DF PROTO=TCP SPT=56218 DPT=80 SEQ=2710037152 ACK=984699540 WINDOW=501 RES=0x00 ACK URGP=0 OPT (0101080A8EB0EA5412B8F661) 
+mangle:PREROUTING:policy:1 IN=vmbr0 OUT= PHYSIN=bond0 MAC=94:57:a5:d3:b9:aa:00:22:4d:37:46:92:08:00 SRC=10.31.1.186 DST=10.28.36.101 LEN=52 TOS=0x00 PREC=0x00 TTL=63 ID=52638 DF PROTO=TCP SPT=56218 DPT=80 SEQ=2710037152 ACK=984699540 WINDOW=501 RES=0x00 ACK URGP=0 OPT (0101080A8EB0EA5412B8F661) 
+mangle:INPUT:policy:1 IN=vmbr0 OUT= PHYSIN=bond0 MAC=94:57:a5:d3:b9:aa:00:22:4d:37:46:92:08:00 SRC=10.31.1.186 DST=10.28.36.101 LEN=52 TOS=0x00 PREC=0x00 TTL=63 ID=52638 DF PROTO=TCP SPT=56218 DPT=80 SEQ=2710037152 ACK=984699540 WINDOW=501 RES=0x00 ACK URGP=0 OPT (0101080A8EB0EA5412B8F661) 
+filter:INPUT:rule:1 IN=vmbr0 OUT= PHYSIN=bond0 MAC=94:57:a5:d3:b9:aa:00:22:4d:37:46:92:08:00 SRC=10.31.1.186 DST=10.28.36.101 LEN=52 TOS=0x00 PREC=0x00 TTL=63 ID=52638 DF PROTO=TCP SPT=56218 DPT=80 SEQ=2710037152 ACK=984699540 WINDOW=501 RES=0x00 ACK URGP=0 OPT (0101080A8EB0EA5412B8F661) 
+filter:KUBE-ROUTER-SERVICES:rule:1 IN=vmbr0 OUT= PHYSIN=bond0 MAC=94:57:a5:d3:b9:aa:00:22:4d:37:46:92:08:00 SRC=10.31.1.186 DST=10.28.36.101 LEN=52 TOS=0x00 PREC=0x00 TTL=63 ID=52638 DF PROTO=TCP SPT=56218 DPT=80 SEQ=2710037152 ACK=984699540 WINDOW=501 RES=0x00 ACK URGP=0 OPT (0101080A8EB0EA5412B8F661) 
+raw:OUTPUT:rule:1 IN= OUT=vmbr0 PHYSIN=bond0 SRC=10.31.1.186 DST=10.112.3.181 LEN=52 TOS=0x00 PREC=0x00 TTL=62 ID=52638 DF PROTO=TCP SPT=56218 DPT=80 SEQ=2710037152 ACK=984699540 WINDOW=501 RES=0x00 ACK URGP=0 OPT (0101080A8EB0EA5412B8F661) 
+raw:OUTPUT:policy:3 IN= OUT=vmbr0 PHYSIN=bond0 SRC=10.31.1.186 DST=10.112.3.181 LEN=52 TOS=0x00 PREC=0x00 TTL=62 ID=52638 DF PROTO=TCP SPT=56218 DPT=80 SEQ=2710037152 ACK=984699540 WINDOW=501 RES=0x00 ACK URGP=0 OPT (0101080A8EB0EA5412B8F661) 
+mangle:OUTPUT:policy:1 IN= OUT=vmbr0 PHYSIN=bond0 SRC=10.31.1.186 DST=10.112.3.181 LEN=52 TOS=0x00 PREC=0x00 TTL=62 ID=52638 DF PROTO=TCP SPT=56218 DPT=80 SEQ=2710037152 ACK=984699540 WINDOW=501 RES=0x00 ACK URGP=0 OPT (0101080A8EB0EA5412B8F661) 
+filter:OUTPUT:rule:1 IN= OUT=vmbr0 PHYSIN=bond0 SRC=10.31.1.186 DST=10.112.3.181 LEN=52 TOS=0x00 PREC=0x00 TTL=62 ID=52638 DF PROTO=TCP SPT=56218 DPT=80 SEQ=2710037152 ACK=984699540 WINDOW=501 RES=0x00 ACK URGP=0 OPT (0101080A8EB0EA5412B8F661) 
+filter:KUBE-FIREWALL:return:2 IN= OUT=vmbr0 PHYSIN=bond0 SRC=10.31.1.186 DST=10.112.3.181 LEN=52 TOS=0x00 PREC=0x00 TTL=62 ID=52638 DF PROTO=TCP SPT=56218 DPT=80 SEQ=2710037152 ACK=984699540 WINDOW=501 RES=0x00 ACK URGP=0 OPT (0101080A8EB0EA5412B8F661) 
+filter:OUTPUT:rule:2 IN= OUT=vmbr0 PHYSIN=bond0 SRC=10.31.1.186 DST=10.112.3.181 LEN=52 TOS=0x00 PREC=0x00 TTL=62 ID=52638 DF PROTO=TCP SPT=56218 DPT=80 SEQ=2710037152 ACK=984699540 WINDOW=501 RES=0x00 ACK URGP=0 OPT (0101080A8EB0EA5412B8F661) 
+filter:LIBVIRT_OUT:return:1 IN= OUT=vmbr0 PHYSIN=bond0 SRC=10.31.1.186 DST=10.112.3.181 LEN=52 TOS=0x00 PREC=0x00 TTL=62 ID=52638 DF PROTO=TCP SPT=56218 DPT=80 SEQ=2710037152 ACK=984699540 WINDOW=501 RES=0x00 ACK URGP=0 OPT (0101080A8EB0EA5412B8F661) 
+filter:OUTPUT:policy:3 IN= OUT=vmbr0 PHYSIN=bond0 SRC=10.31.1.186 DST=10.112.3.181 LEN=52 TOS=0x00 PREC=0x00 TTL=62 ID=52638 DF PROTO=TCP SPT=56218 DPT=80 SEQ=2710037152 ACK=984699540 WINDOW=501 RES=0x00 ACK URGP=0 OPT (0101080A8EB0EA5412B8F661) 
+mangle:POSTROUTING:rule:1 IN= OUT=vmbr0 PHYSIN=bond0 SRC=10.31.1.186 DST=10.112.3.181 LEN=52 TOS=0x00 PREC=0x00 TTL=62 ID=52638 DF PROTO=TCP SPT=56218 DPT=80 SEQ=2710037152 ACK=984699540 WINDOW=501 RES=0x00 ACK URGP=0 OPT (0101080A8EB0EA5412B8F661) 
+mangle:LIBVIRT_PRT:return:1 IN= OUT=vmbr0 PHYSIN=bond0 SRC=10.31.1.186 DST=10.112.3.181 LEN=52 TOS=0x00 PREC=0x00 TTL=62 ID=52638 DF PROTO=TCP SPT=56218 DPT=80 SEQ=2710037152 ACK=984699540 WINDOW=501 RES=0x00 ACK URGP=0 OPT (0101080A8EB0EA5412B8F661) 
+mangle:POSTROUTING:policy:2 IN= OUT=vmbr0 PHYSIN=bond0 SRC=10.31.1.186 DST=10.112.3.181 LEN=52 TOS=0x00 PREC=0x00 TTL=62 ID=52638 DF PROTO=TCP SPT=56218 DPT=80 SEQ=2710037152 ACK=984699540 WINDOW=501 RES=0x00 ACK URGP=0 OPT (0101080A8EB0EA5412B8F661) 
```

**Comment by kvaps** [comment]
ref https://github.com/metallb/metallb/issues/253 https://github.com/metallb/metallb/issues/253

**Comment by kvaps** [comment]
So looks like the problem connected with the bridge (found similar issue https://github.com/metallb/metallb/issues/253)
Without the bridge, the routing seems working fine.

**Comment by kvaps** [comment]
Sorry for spaming, but I trying to figure out.

Just found that `sysctl net.bridge.bridge-nf-call-iptables=0` also fixes this issue, example traffic from one of the pod:

```bash
# tcpdump on bond0
16:33:23.122906 IP 10.31.1.186.34302 > 10.28.36.101.80: Flags [S], seq 3241917171, win 64240, options [mss 1460,sackOK,TS val 2406370145 ecr 0,nop,wscale 7], length 0
16:33:23.123028 IP 10.28.36.169.34302 > 10.112.3.181.80: Flags [S], seq 3241917171, win 64240, options [mss 1460,sackOK,TS val 2406370145 ecr 0,nop,wscale 7], length 0
16:33:23.123281 IP 10.112.3.181.80 > 10.28.36.169.34302: Flags [S.], seq 767831858, ack 3241917172, win 65160, options [mss 1460,sackOK,TS val 1757441263 ecr 2406370145,nop,wscale 7], length 0

# tcpdump on vmbr0
16:33:01.705173 IP 10.31.1.186.34292 > 10.28.36.101.80: Flags [S], seq 2697435639, win 64240, options [mss 1460,sackOK,TS val 2406348728 ecr 0,nop,wscale 7], length 0
16:33:01.705266 IP 10.28.36.169.34292 > 10.112.3.181.80: Flags [S], seq 2697435639, win 64240, options [mss 1460,sackOK,TS val 2406348728 ecr 0,nop,wscale 7], length 0
```

as can I see that last packet filetered, and If I enable debug with and without `bridge-nf-call-iptables` enabled, I can see:

```diff
--- sysctl net.bridge.bridge-nf-call-iptables=1
+++ sysctl net.bridge.bridge-nf-call-iptables=0
 raw:OUTPUT:policy:3 IN= OUT=vmbr0 PHYSIN=bond0 SRC=10.31.1.186 DST=10.112.3.181 LEN=60 TOS=0x00 PREC=0x00 TTL=62 ID=27961 DF PROTO=TCP SPT=34652 DPT=80 SEQ=3563758829 ACK=0 WINDOW=64240 RES=0x00 SYN URGP=0 OPT (020405B40402080A8F7C0C170000000001030307) 
 mangle:OUTPUT:policy:1 IN= OUT=vmbr0 PHYSIN=bond0 SRC=10.31.1.186 DST=10.112.3.181 LEN=60 TOS=0x00 PREC=0x00 TTL=62 ID=27961 DF PROTO=TCP SPT=34652 DPT=80 SEQ=3563758829 ACK=0 WINDOW=64240 RES=0x00 SYN URGP=0 OPT (020405B40402080A8F7C0C170000000001030307) 
 filter:OUTPUT:rule:1 IN= OUT=vmbr0 PHYSIN=bond0 SRC=10.31.1.186 DST=10.112.3.181 LEN=60 TOS=0x00 PREC=0x00 TTL=62 ID=27961 DF PROTO=TCP SPT=34652 DPT=80 SEQ=3563758829 ACK=0 WINDOW=64240 RES=0x00 SYN URGP=0 OPT (020405B40402080A8F7C0C170000000001030307) 
 filter:KUBE-FIREWALL:return:2 IN= OUT=vmbr0 PHYSIN=bond0 SRC=10.31.1.186 DST=10.112.3.181 LEN=60 TOS=0x00 PREC=0x00 TTL=62 ID=27961 DF PROTO=TCP SPT=34652 DPT=80 SEQ=3563758829 ACK=0 WINDOW=64240 RES=0x00 SYN URGP=0 OPT (020405B40402080A8F7C0C170000000001030307) 
 filter:OUTPUT:policy:2 IN= OUT=vmbr0 PHYSIN=bond0 SRC=10.31.1.186 DST=10.112.3.181 LEN=60 TOS=0x00 PREC=0x00 TTL=62 ID=27961 DF PROTO=TCP SPT=34652 DPT=80 SEQ=3563758829 ACK=0 WINDOW=64240 RES=0x00 SYN URGP=0 OPT (020405B40402080A8F7C0C170000000001030307) 
 mangle:POSTROUTING:policy:1 IN= OUT=vmbr0 PHYSIN=bond0 SRC=10.31.1.186 DST=10.112.3.181 LEN=60 TOS=0x00 PREC=0x00 TTL=62 ID=27961 DF PROTO=TCP SPT=34652 DPT=80 SEQ=3563758829 ACK=0 WINDOW=64240 RES=0x00 SYN URGP=0 OPT (020405B40402080A8F7C0C170000000001030307) 
 nat:POSTROUTING:rule:1 IN= OUT=vmbr0 PHYSIN=bond0 SRC=10.31.1.186 DST=10.112.3.181 LEN=60 TOS=0x00 PREC=0x00 TTL=62 ID=27961 DF PROTO=TCP SPT=34652 DPT=80 SEQ=3563758829 ACK=0 WINDOW=64240 RES=0x00 SYN URGP=0 OPT (020405B40402080A8F7C0C170000000001030307) 
 nat:KUBE-POSTROUTING:return:2 IN= OUT=vmbr0 PHYSIN=bond0 SRC=10.31.1.186 DST=10.112.3.181 LEN=60 TOS=0x00 PREC=0x00 TTL=62 ID=27961 DF PROTO=TCP SPT=34652 DPT=80 SEQ=3563758829 ACK=0 WINDOW=64240 RES=0x00 SYN URGP=0 OPT (020405B40402080A8F7C0C170000000001030307) 
 nat:POSTROUTING:rule:2 IN= OUT=vmbr0 PHYSIN=bond0 SRC=10.31.1.186 DST=10.112.3.181 LEN=60 TOS=0x00 PREC=0x00 TTL=62 ID=27961 DF PROTO=TCP SPT=34652 DPT=80 SEQ=3563758829 ACK=0 WINDOW=64240 RES=0x00 SYN URGP=0 OPT (020405B40402080A8F7C0C170000000001030307) 
+raw:OUTPUT:policy:3 IN= OUT=vmbr0 SRC=10.31.1.186 DST=10.112.3.181 LEN=52 TOS=0x00 PREC=0x00 TTL=62 ID=16236 DF PROTO=TCP SPT=34658 DPT=80 SEQ=3328822087 ACK=4231995537 WINDOW=502 RES=0x00 ACK URGP=0 OPT (0101080A8F7C9AA868CEBC34) 
+mangle:OUTPUT:policy:1 IN= OUT=vmbr0 SRC=10.31.1.186 DST=10.112.3.181 LEN=52 TOS=0x00 PREC=0x00 TTL=62 ID=16236 DF PROTO=TCP SPT=34658 DPT=80 SEQ=3328822087 ACK=4231995537 WINDOW=502 RES=0x00 ACK URGP=0 OPT (0101080A8F7C9AA868CEBC34) 
+filter:OUTPUT:rule:1 IN= OUT=vmbr0 SRC=10.31.1.186 DST=10.112.3.181 LEN=52 TOS=0x00 PREC=0x00 TTL=62 ID=16236 DF PROTO=TCP SPT=34658 DPT=80 SEQ=3328822087 ACK=4231995537 WINDOW=502 RES=0x00 ACK URGP=0 OPT (0101080A8F7C9AA868CEBC34) 
+filter:KUBE-FIREWALL:return:2 IN= OUT=vmbr0 SRC=10.31.1.186 DST=10.112.3.181 LEN=52 TOS=0x00 PREC=0x00 TTL=62 ID=16236 DF PROTO=TCP SPT=34658 DPT=80 SEQ=3328822087 ACK=4231995537 WINDOW=502 RES=0x00 ACK URGP=0 OPT (0101080A8F7C9AA868CEBC34) 
+filter:OUTPUT:policy:2 IN= OUT=vmbr0 SRC=10.31.1.186 DST=10.112.3.181 LEN=52 TOS=0x00 PREC=0x00 TTL=62 ID=16236 DF PROTO=TCP SPT=34658 DPT=80 SEQ=3328822087 ACK=4231995537 WINDOW=502 RES=0x00 ACK URGP=0 OPT (0101080A8F7C9AA868CEBC34) 
+mangle:POSTROUTING:policy:1 IN= OUT=vmbr0 SRC=10.31.1.186 DST=10.112.3.181 LEN=52 TOS=0x00 PREC=0x00 TTL=62 ID=16236 DF PROTO=TCP SPT=34658 DPT=80 SEQ=3328822087 ACK=4231995537 WINDOW=502 RES=0x00 ACK URGP=0 OPT (0101080A8F7C9AA868CEBC34) 
+raw:OUTPUT:policy:3 IN= OUT=vmbr0 SRC=10.31.1.186 DST=10.112.3.181 LEN=146 TOS=0x00 PREC=0x00 TTL=62 ID=16237 DF PROTO=TCP SPT=34658 DPT=80 SEQ=3328822087 ACK=4231995537 WINDOW=502 RES=0x00 ACK PSH URGP=0 OPT (0101080A8F7C9AA868CEBC34) 
+mangle:OUTPUT:policy:1 IN= OUT=vmbr0 SRC=10.31.1.186 DST=10.112.3.181 LEN=146 TOS=0x00 PREC=0x00 TTL=62 ID=16237 DF PROTO=TCP SPT=34658 DPT=80 SEQ=3328822087 ACK=4231995537 WINDOW=502 RES=0x00 ACK PSH URGP=0 OPT (0101080A8F7C9AA868CEBC34) 
+filter:OUTPUT:rule:1 IN= OUT=vmbr0 SRC=10.31.1.186 DST=10.112.3.181 LEN=146 TOS=0x00 PREC=0x00 TTL=62 ID=16237 DF PROTO=TCP SPT=34658 DPT=80 SEQ=3328822087 ACK=4231995537 WINDOW=502 RES=0x00 ACK PSH URGP=0 OPT (0101080A8F7C9AA868CEBC34) 
+filter:KUBE-FIREWALL:return:2 IN= OUT=vmbr0 SRC=10.31.1.186 DST=10.112.3.181 LEN=146 TOS=0x00 PREC=0x00 TTL=62 ID=16237 DF PROTO=TCP SPT=34658 DPT=80 SEQ=3328822087 ACK=4231995537 WINDOW=502 RES=0x00 ACK PSH URGP=0 OPT (0101080A8F7C9AA868CEBC34) 
+filter:OUTPUT:policy:2 IN= OUT=vmbr0 SRC=10.31.1.186 DST=10.112.3.181 LEN=146 TOS=0x00 PREC=0x00 TTL=62 ID=16237 DF PROTO=TCP SPT=34658 DPT=80 SEQ=3328822087 ACK=4231995537 WINDOW=502 RES=0x00 ACK PSH URGP=0 OPT (0101080A8F7C9AA868CEBC34) 
+mangle:POSTROUTING:policy:1 IN= OUT=vmbr0 SRC=10.31.1.186 DST=10.112.3.181 LEN=146 TOS=0x00 PREC=0x00 TTL=62 ID=16237 DF PROTO=TCP SPT=34658 DPT=80 SEQ=3328822087 ACK=4231995537 WINDOW=502 RES=0x00 ACK PSH URGP=0 OPT (0101080A8F7C9AA868CEBC34) 
+raw:OUTPUT:policy:3 IN= OUT=vmbr0 SRC=10.31.1.186 DST=10.112.3.181 LEN=52 TOS=0x00 PREC=0x00 TTL=62 ID=16238 DF PROTO=TCP SPT=34658 DPT=80 SEQ=3328822181 ACK=4231996225 WINDOW=501 RES=0x00 ACK URGP=0 OPT (0101080A8F7C9AAF68CEBC3B) 
+mangle:OUTPUT:policy:1 IN= OUT=vmbr0 SRC=10.31.1.186 DST=10.112.3.181 LEN=52 TOS=0x00 PREC=0x00 TTL=62 ID=16238 DF PROTO=TCP SPT=34658 DPT=80 SEQ=3328822181 ACK=4231996225 WINDOW=501 RES=0x00 ACK URGP=0 OPT (0101080A8F7C9AAF68CEBC3B) 
+filter:OUTPUT:rule:1 IN= OUT=vmbr0 SRC=10.31.1.186 DST=10.112.3.181 LEN=52 TOS=0x00 PREC=0x00 TTL=62 ID=16238 DF PROTO=TCP SPT=34658 DPT=80 SEQ=3328822181 ACK=4231996225 WINDOW=501 RES=0x00 ACK URGP=0 OPT (0101080A8F7C9AAF68CEBC3B) 
+filter:KUBE-FIREWALL:return:2 IN= OUT=vmbr0 SRC=10.31.1.186 DST=10.112.3.181 LEN=52 TOS=0x00 PREC=0x00 TTL=62 ID=16238 DF PROTO=TCP SPT=34658 DPT=80 SEQ=3328822181 ACK=4231996225 WINDOW=501 RES=0x00 ACK URGP=0 OPT (0101080A8F7C9AAF68CEBC3B) 
+filter:OUTPUT:policy:2 IN= OUT=vmbr0 SRC=10.31.1.186 DST=10.112.3.181 LEN=52 TOS=0x00 PREC=0x00 TTL=62 ID=16238 DF PROTO=TCP SPT=34658 DPT=80 SEQ=3328822181 ACK=4231996225 WINDOW=501 RES=0x00 ACK URGP=0 OPT (0101080A8F7C9AAF68CEBC3B) 
+mangle:POSTROUTING:policy:1 IN= OUT=vmbr0 SRC=10.31.1.186 DST=10.112.3.181 LEN=52 TOS=0x00 PREC=0x00 TTL=62 ID=16238 DF PROTO=TCP SPT=34658 DPT=80 SEQ=3328822181 ACK=4231996225 WINDOW=501 RES=0x00 ACK URGP=0 OPT (0101080A8F7C9AAF68CEBC3B) 
+raw:OUTPUT:policy:3 IN= OUT=vmbr0 SRC=10.31.1.186 DST=10.112.3.181 LEN=52 TOS=0x00 PREC=0x00 TTL=62 ID=16239 DF PROTO=TCP SPT=34658 DPT=80 SEQ=3328822181 ACK=4231996225 WINDOW=501 RES=0x00 ACK FIN URGP=0 OPT (0101080A8F7C9AAF68CEBC3B) 
+mangle:OUTPUT:policy:1 IN= OUT=vmbr0 SRC=10.31.1.186 DST=10.112.3.181 LEN=52 TOS=0x00 PREC=0x00 TTL=62 ID=16239 DF PROTO=TCP SPT=34658 DPT=80 SEQ=3328822181 ACK=4231996225 WINDOW=501 RES=0x00 ACK FIN URGP=0 OPT (0101080A8F7C9AAF68CEBC3B) 
+filter:OUTPUT:rule:1 IN= OUT=vmbr0 SRC=10.31.1.186 DST=10.112.3.181 LEN=52 TOS=0x00 PREC=0x00 TTL=62 ID=16239 DF PROTO=TCP SPT=34658 DPT=80 SEQ=3328822181 ACK=4231996225 WINDOW=501 RES=0x00 ACK FIN URGP=0 OPT (0101080A8F7C9AAF68CEBC3B) 
+filter:KUBE-FIREWALL:return:2 IN= OUT=vmbr0 SRC=10.31.1.186 DST=10.112.3.181 LEN=52 TOS=0x00 PREC=0x00 TTL=62 ID=16239 DF PROTO=TCP SPT=34658 DPT=80 SEQ=3328822181 ACK=4231996225 WINDOW=501 RES=0x00 ACK FIN URGP=0 OPT (0101080A8F7C9AAF68CEBC3B) 
+filter:OUTPUT:policy:2 IN= OUT=vmbr0 SRC=10.31.1.186 DST=10.112.3.181 LEN=52 TOS=0x00 PREC=0x00 TTL=62 ID=16239 DF PROTO=TCP SPT=34658 DPT=80 SEQ=3328822181 ACK=4231996225 WINDOW=501 RES=0x00 ACK FIN URGP=0 OPT (0101080A8F7C9AAF68CEBC3B) 
+mangle:POSTROUTING:policy:1 IN= OUT=vmbr0 SRC=10.31.1.186 DST=10.112.3.181 LEN=52 TOS=0x00 PREC=0x00 TTL=62 ID=16239 DF PROTO=TCP SPT=34658 DPT=80 SEQ=3328822181 ACK=4231996225 WINDOW=501 RES=0x00 ACK FIN URGP=0 OPT (0101080A8F7C9AAF68CEBC3B) 
+raw:OUTPUT:policy:3 IN= OUT=vmbr0 SRC=10.31.1.186 DST=10.112.3.181 LEN=52 TOS=0x00 PREC=0x00 TTL=62 ID=16240 DF PROTO=TCP SPT=34658 DPT=80 SEQ=3328822182 ACK=4231996226 WINDOW=501 RES=0x00 ACK URGP=0 OPT (0101080A8F7C9AB068CEBC3C) 
+mangle:OUTPUT:policy:1 IN= OUT=vmbr0 SRC=10.31.1.186 DST=10.112.3.181 LEN=52 TOS=0x00 PREC=0x00 TTL=62 ID=16240 DF PROTO=TCP SPT=34658 DPT=80 SEQ=3328822182 ACK=4231996226 WINDOW=501 RES=0x00 ACK URGP=0 OPT (0101080A8F7C9AB068CEBC3C) 
+filter:OUTPUT:rule:1 IN= OUT=vmbr0 SRC=10.31.1.186 DST=10.112.3.181 LEN=52 TOS=0x00 PREC=0x00 TTL=62 ID=16240 DF PROTO=TCP SPT=34658 DPT=80 SEQ=3328822182 ACK=4231996226 WINDOW=501 RES=0x00 ACK URGP=0 OPT (0101080A8F7C9AB068CEBC3C) 
+filter:KUBE-FIREWALL:return:2 IN= OUT=vmbr0 SRC=10.31.1.186 DST=10.112.3.181 LEN=52 TOS=0x00 PREC=0x00 TTL=62 ID=16240 DF PROTO=TCP SPT=34658 DPT=80 SEQ=3328822182 ACK=4231996226 WINDOW=501 RES=0x00 ACK URGP=0 OPT (0101080A8F7C9AB068CEBC3C) 
+filter:OUTPUT:policy:2 IN= OUT=vmbr0 SRC=10.31.1.186 DST=10.112.3.181 LEN=52 TOS=0x00 PREC=0x00 TTL=62 ID=16240 DF PROTO=TCP SPT=34658 DPT=80 SEQ=3328822182 ACK=4231996226 WINDOW=501 RES=0x00 ACK URGP=0 OPT (0101080A8F7C9AB068CEBC3C) 
+mangle:POSTROUTING:policy:1 IN= OUT=vmbr0 SRC=10.31.1.186 DST=10.112.3.181 LEN=52 TOS=0x00 PREC=0x00 TTL=62 ID=16240 DF PROTO=TCP SPT=34658 DPT=80 SEQ=3328822182 ACK=4231996226 WINDOW=501 RES=0x00 ACK URGP=0 OPT (0101080A8F7C9AB068CEBC3C) 
```

**Comment by russellb** [comment]
It sounds like you sorted out this issue.  Configuration of the network at this layer is outside of the scope of MetalLB, as well.  For further discussion if necessary, I would try the mailing list or slack.  https://metallb.universe.tf/community/
