### ISSUE TITLE
speaker stops responding after a few responses

### ISSUE THREAD

**Issue by cameronbraid** [metallb/metallb#652]
Version of MetalLB
v0.9.3

Version of Kubernetes
v1.18.2

Name and version of network addon (e.g. Calico, Weave...)
Calico

Whether you've configured kube-proxy for iptables or ipvs mode
ipvs mode with strict arp

I see arp responses in the speaker logs for a few repsonses then it stops redponding. Deleteing the speaker pod makes this happen again

speaker logs (extract)
```
speaker-gxwrl speaker {"branch":"HEAD","caller":"main.go:82","commit":"v0.9.3","msg":"MetalLB speaker starting version 0.9.3 (commit v0.9.3, branch HEAD)","ts":"2020-06-29T16:32:21.601343382Z","version":"0.9.3"}
speaker-gxwrl speaker {"caller":"main.go:186","msg":"Node event","node addr":"172.17.0.1","node event":"NodeJoin","node name":"node01","ts":"2020-06-29T16:32:21.804506429Z"}
speaker-gxwrl speaker {"caller":"main.go:187","msg":"Call Force Sync","ts":"2020-06-29T16:32:21.804594175Z"}
...
speaker-gxwrl speaker {"caller":"main.go:202","component":"MemberList","msg":"net.go:785: [DEBUG] memberlist: Initiating push/pull sync with: 27.50.81.41:7946","ts":"2020-06-29T16:32:21.82026153Z"}
speaker-gxwrl speaker {"caller":"main.go:202","component":"MemberList","msg":"net.go:210: [DEBUG] memberlist: Stream connection from=27.50.81.41:37574","ts":"2020-06-29T16:32:21.820351496Z"}
speaker-gxwrl speaker {"caller":"main.go:163","error ?":null,"msg":"Memberlist join","nb joigned":1,"op":"startup","ts":"2020-06-29T16:32:21.820654053Z"}
...
speaker-gxwrl speaker {"caller":"announcer.go:103","event":"createARPResponder","interface":"ztwdjmdyyc","msg":"created ARP responder for interface","ts":"2020-06-29T16:32:21.856104476Z"}
speaker-gxwrl speaker {"caller":"announcer.go:112","event":"createNDPResponder","interface":"ztwdjmdyyc","msg":"created NDP responder for interface","ts":"2020-06-29T16:32:21.85657794Z"}
...
speaker-gxwrl speaker {"caller":"main.go:343","event":"serviceAnnounced","ip":"10.123.202.1","msg":"service has IP, announcing","pool":"default","protocol":"layer2","service":"drivenow-infra/git-ssh-loadbalancer","ts":"2020-06-29T16:32:22.209162497Z"}
speaker-gxwrl speaker {"caller":"main.go:346","event":"endUpdate","msg":"end of service update","service":"drivenow-infra/git-ssh-loadbalancer","ts":"2020-06-29T16:32:22.209192617Z"}
...
speaker-gxwrl speaker {"caller":"arp.go:102","interface":"ens1f1","ip":"10.123.202.1","msg":"got ARP request for service IP, sending response","responseMAC":"0c:c4:7a:1f:84:f9","senderIP":"10.123.202.1","senderMAC":"0c:c4:7a:1f:84:f8","ts":"2020-06-29T16:32:22.211964224Z"}
speaker-gxwrl speaker {"caller":"arp.go:102","interface":"ens1f0","ip":"10.123.202.1","msg":"got ARP request for service IP, sending response","responseMAC":"0c:c4:7a:1f:84:f8","senderIP":"10.123.202.1","senderMAC":"0c:c4:7a:1f:84:f9","ts":"2020-06-29T16:32:22.211974354Z"}
speaker-gxwrl speaker {"caller":"arp.go:102","interface":"ens1f1","ip":"10.123.202.1","msg":"got ARP request for service IP, sending response","responseMAC":"0c:c4:7a:1f:84:f9","senderIP":"10.123.202.1","senderMAC":"0c:c4:7a:1f:84:f8","ts":"2020-06-29T16:32:23.314315729Z"}
speaker-gxwrl speaker {"caller":"arp.go:102","interface":"ens1f0","ip":"10.123.202.1","msg":"got ARP request for service IP, sending response","responseMAC":"0c:c4:7a:1f:84:f8","senderIP":"10.123.202.1","senderMAC":"0c:c4:7a:1f:84:f9","ts":"2020-06-29T16:32:23.314344722Z"}
speaker-gxwrl speaker {"caller":"arp.go:102","interface":"ens1f0","ip":"10.123.202.2","msg":"got ARP request for service IP, sending response","responseMAC":"0c:c4:7a:1f:84:f8","senderIP":"10.123.202.2","senderMAC":"0c:c4:7a:1f:84:f9","ts":"2020-06-29T16:32:24.406768357Z"}
speaker-gxwrl speaker {"caller":"arp.go:102","interface":"ens1f1","ip":"10.123.202.2","msg":"got ARP request for service IP, sending response","responseMAC":"0c:c4:7a:1f:84:f9","senderIP":"10.123.202.2","senderMAC":"0c:c4:7a:1f:84:f8","ts":"2020-06-29T16:32:24.406773282Z"}
speaker-gxwrl speaker {"caller":"main.go:343","event":"serviceAnnounced","ip":"10.123.202.2","msg":"service has IP, announcing","pool":"default","protocol":"layer2","service":"drivenow-production/webapp-internal-loadbalancer","ts":"2020-06-29T16:32:24.621289257Z"}
```

arping 10.123.202.1
```
Timeout
Timeout
Timeout
Timeout
Timeout
Timeout
Timeout
Timeout
Timeout
60 bytes from 36:89:37:70:2c:dd (10.123.202.1): index=5 time=286.841 msec
60 bytes from 36:89:37:70:2c:dd (10.123.202.1): index=6 time=387.158 msec
60 bytes from 36:89:37:70:2c:dd (10.123.202.1): index=7 time=489.332 msec
60 bytes from 36:89:37:70:2c:dd (10.123.202.1): index=8 time=591.513 msec
60 bytes from 36:89:37:70:2c:dd (10.123.202.1): index=9 time=693.187 msec
Timeout
Timeout
Timeout
Timeout
Timeout
^C
```

Each time I delete the speaker pod it responds with 5 responses

I can confirm that arp requests are continuously coming in via

sudo tcpdump -n -i ztwdjmdyyc arp 
```
tcpdump: verbose output suppressed, use -v or -vv for full protocol decode
listening on ztwdjmdyyc, link-type EN10MB (Ethernet), capture size 262144 bytes
02:38:11.725786 ARP, Request who-has 10.123.202.1 tell 10.123.1.1, length 44
02:38:12.726889 ARP, Request who-has 10.123.202.1 tell 10.123.1.1, length 44
02:38:13.726970 ARP, Request who-has 10.123.202.1 tell 10.123.1.1, length 44
02:38:14.727931 ARP, Request who-has 10.123.202.1 tell 10.123.1.1, length 44
02:38:15.728840 ARP, Request who-has 10.123.202.1 tell 10.123.1.1, length 44
02:38:16.729891 ARP, Request who-has 10.123.202.1 tell 10.123.1.1, length 44
02:38:17.730978 ARP, Request who-has 10.123.202.1 tell 10.123.1.1, length 44
02:38:18.731114 ARP, Request who-has 10.123.202.1 tell 10.123.1.1, length 44
02:38:19.731239 ARP, Request who-has 10.123.202.1 tell 10.123.1.1, length 44
02:38:20.732289 ARP, Request who-has 10.123.202.1 tell 10.123.1.1, length 44
02:38:21.732802 ARP, Request who-has 10.123.202.1 tell 10.123.1.1, length 44
02:38:22.733377 ARP, Request who-has 10.123.202.1 tell 10.123.1.1, length 44
02:38:23.734425 ARP, Request who-has 10.123.202.1 tell 10.123.1.1, length 44
02:38:24.735534 ARP, Request who-has 10.123.202.1 tell 10.123.1.1, length 44
02:38:25.736507 ARP, Request who-has 10.123.202.1 tell 10.123.1.1, length 44
02:38:26.736797 ARP, Request who-has 10.123.202.1 tell 10.123.1.1, length 44
02:38:27.737409 ARP, Request who-has 10.123.202.1 tell 10.123.1.1, length 44
02:38:28.737811 ARP, Request who-has 10.123.202.1 tell 10.123.1.1, length 44
02:38:29.737948 ARP, Request who-has 10.123.202.1 tell 10.123.1.1, length 44
02:38:30.740195 ARP, Request who-has 10.123.202.1 tell 10.123.1.1, length 44
^C
```

**Comment by cameronbraid** [comment]
full speak logs attached

[log.txt](https://github.com/metallb/metallb/files/4846855/log.txt)

**Comment by cameronbraid** [comment]
Some more network info

The vpn device is ztwdjmdyyc

```
eno1: flags=4163<UP,BROADCAST,RUNNING,MULTICAST>  mtu 1500
        inet ##.##.##.##  netmask 255.255.255.254  broadcast 0.0.0.0
        inet6 fe80::ae1f:6bff:fee2:93a0  prefixlen 64  scopeid 0x20<link>
        ether ac:1f:6b:e2:93:a0  txqueuelen 1000  (Ethernet)
        RX packets 33340855  bytes 21695124179 (21.6 GB)
        RX errors 0  dropped 0  overruns 0  frame 0
        TX packets 30159496  bytes 15141635982 (15.1 GB)
        TX errors 0  dropped 0 overruns 0  carrier 0  collisions 0
        device memory 0xc7200000-c727ffff  

ens1f0: flags=4163<UP,BROADCAST,RUNNING,MULTICAST>  mtu 1500
        inet 10.11.1.110  netmask 255.255.240.0  broadcast 10.11.15.255
        inet6 fe80::ec4:7aff:fe1f:84f8  prefixlen 64  scopeid 0x20<link>
        ether 0c:c4:7a:1f:84:f8  txqueuelen 1000  (Ethernet)
        RX packets 488945  bytes 32296636 (32.2 MB)
        RX errors 0  dropped 573  overruns 0  frame 0
        TX packets 316091  bytes 13288562 (13.2 MB)
        TX errors 0  dropped 0 overruns 0  carrier 0  collisions 0

ens1f1: flags=4163<UP,BROADCAST,RUNNING,MULTICAST>  mtu 1500
        inet 10.11.1.111  netmask 255.255.240.0  broadcast 10.11.15.255
        inet6 fe80::ec4:7aff:fe1f:84f9  prefixlen 64  scopeid 0x20<link>
        ether 0c:c4:7a:1f:84:f9  txqueuelen 1000  (Ethernet)
        RX packets 62191015  bytes 61660356260 (61.6 GB)
        RX errors 0  dropped 573  overruns 0  frame 0
        TX packets 82695803  bytes 101144935258 (101.1 GB)
        TX errors 0  dropped 0 overruns 0  carrier 0  collisions 0

ztwdjmdyyc: flags=4163<UP,BROADCAST,RUNNING,MULTICAST>  mtu 1500
        inet 10.123.254.34  netmask 255.255.0.0  broadcast 10.123.255.255
        inet6 fe80::3489:37ff:fe70:2cdd  prefixlen 64  scopeid 0x20<link>
        ether 36:89:37:70:2c:dd  txqueuelen 1000  (Ethernet)
        RX packets 139777  bytes 15196079 (15.1 MB)
        RX errors 0  dropped 0  overruns 0  frame 0
        TX packets 165871  bytes 52712947 (52.7 MB)
        TX errors 0  dropped 0 overruns 0  carrier 0  collisions 0

```

**Comment by johananl** [comment]
Hey @cameronbraid.

A couple of questions:

- Did you run a packet capture _on the node running the speaker_ and verify that ARP requests show on the wire and no ARP replies are generated?
- Assuming there is a stable layer 2 connectivity between the host sending the ARP requests and the active speaker and assuming the active speaker doesn't change, I don't see why the speaker would stop responding to ARP requests. Is there a way for me to replicate this problem?
- You've mentioned a "VPN device" above. Could you elaborate on what this device is assuming it's relevant to the problem?

Lastly, for troubleshooting issues I recommend asking in the community [Slack channel](https://metallb.universe.tf/community/#slack) as you may get faster responses there and have a larger audience.

**Comment by cameronbraid** [comment]
Hi, thanks for your reply.  I hung out in slack for a few hours but nobody offered to help.

The packet capture, arping and speaker are all running on the same node.  

By VPN device I mean the ztwdjmdyyc interface which is a zerotier vpn peer.  Not sure if that is relevant, but i'm not a networking expert.

**Comment by cameronbraid** [comment]
For reproducing - One option is for me to try and mirror my config in a VM to see if I can make a reproducer.  I'll see how I go doing that.

**Comment by cameronbraid** [comment]
A couple of thinks that I think are odd from the logs

a) when the speaker does respond the ping times are huge, would expect <10ms
b) the ping times increase each time
c) the interface the speaker is hearing and speaking on is ens1f0 and ens1f1 not ztwdjmdyyc which contains the loadbalancer ip range

**Comment by champtar** [comment]
@cameronbraid Can you try to remove the cpu limits ?

**Comment by cameronbraid** [comment]
tried that, edit deamonset, remove limits, delete pod

```
Timeout
Timeout
Timeout
Timeout
60 bytes from 36:89:37:70:2c:dd (10.123.202.6): index=10 time=819.548 msec
60 bytes from 36:89:37:70:2c:dd (10.123.202.6): index=11 time=922.508 msec
Timeout
60 bytes from 36:89:37:70:2c:dd (10.123.202.6): index=12 time=23.203 msec
60 bytes from 36:89:37:70:2c:dd (10.123.202.6): index=13 time=125.440 msec
60 bytes from 36:89:37:70:2c:dd (10.123.202.6): index=14 time=229.078 msec
Timeout
Timeout
Timeout
```

delete pod again
```

Timeout
Timeout
Timeout
60 bytes from 36:89:37:70:2c:dd (10.123.202.6): index=20 time=666.858 msec
60 bytes from 36:89:37:70:2c:dd (10.123.202.6): index=21 time=770.026 msec
60 bytes from 36:89:37:70:2c:dd (10.123.202.6): index=22 time=872.048 msec
60 bytes from 36:89:37:70:2c:dd (10.123.202.6): index=23 time=975.336 msec
Timeout
60 bytes from 36:89:37:70:2c:dd (10.123.202.6): index=24 time=76.926 msec
Timeout
Timeout
Timeout
Timeout
```

**Comment by johananl** [comment]
@cameronbraid I would check the CPU and memory utilization on the node. The high latency when you *do* get a response strongly suggests a resource issue on the node.

**Comment by cameronbraid** [comment]
48 core machine
Cpu usage ~ 10%
load average: 8.33, 11.23, 10.69

its not overloaded

**Comment by rata** [comment]
@cameronbraid hi! Some questions.

1. Do you see the same if you arpping other IPs the server has that are not handled by MetalLB?
1. What happens if you connect to the service using the hostIP and the nodePort type, do you see any delays?
1. I don't think this will help, but just in case, can you try switching to the old layer 2 mode as explained here: https://metallb.universe.tf/release-notes/#version-0-9-2

Thanks!

**Comment by cameronbraid** [comment]
1. sort of

example the primary ip for the peer

```
ztwdjmdyyc: flags=4163<UP,BROADCAST,RUNNING,MULTICAST>  mtu 1500
        inet 10.123.1.1  netmask 255.255.0.0  broadcast 10.123.255.255
```

from a remote peer

```
arping 10.123.1.1
ARPING 10.123.1.1 from 10.123.0.1 ztwdjmdyyc
Unicast reply from 10.123.1.1 [36:89:37:70:2C:DD]  40.914ms
```

from localhost
```
arping 10.123.1.1
ARPING 10.123.1.1
Timeout
Timeout
Timeout
```

2.  From localhost I can connect to the LoadBalancer service's cluster ip just fine without any lag

3. tried it, didn't fix it



I am string to think that this may be caused by zerotier

I did some research into zerotier and read this in their manual about arp

> Special Handling of IPv4 ARP Broadcasts
IPv4 ARP is built on simple Ethernet broadcast and scales poorly on large or distributed networks. To improve ARP’s scalability ZeroTier generates a unique multicast group for each IPv4 address detected on its system and then transparently intercepts ARP queries and sends them only to the correct group. This converts ARP into effectively a unicast or narrow multicast protocol (like IPv6 NDP) and allows IPv4 ARP to work reliably across wide area networks without excess bandwidth consumption. A similar strategy is implemented under the hood by a number of enterprise switches and WiFi routers designed for deployment on extremely large LANs. This ARP emulation mode is transparent to the OS and application layers, but it does mean that packet sniffers will not see all ARP queries on a virtual network the way they typically can on smaller wired LANs.

Not sure if that means anything, I only learned about ARP a few days ago when I installed metallb :)

Also, after reading https://github.com/scality/metalk8s/issues/535 I decided to try adding the metallb assigned IP address  to the zerotier interface - then arping started working from a remote peer

on localhost
```
ip a add 10.123.202.6/32 dev ztwdjmdyyc
```

on remote host
```
arping 10.123.202.6
ARPING 10.123.202.6 from 10.123.0.1 ztwdjmdyyc
Unicast reply from 10.123.202.6 [36:89:37:70:2C:DD]  40.861ms
Unicast reply from 10.123.202.6 [36:89:37:70:2C:DD]  40.902ms
Unicast reply from 10.123.202.6 [36:89:37:70:2C:DD]  40.875ms
Unicast reply from 10.123.202.6 [36:89:37:70:2C:DD]  40.899ms
Unicast reply from 10.123.202.6 [36:89:37:70:2C:DD]  48.229ms
Unicast reply from 10.123.202.6 [36:89:37:70:2C:DD]  48.256ms
``` 


And oddly enough I do arping on localhost, at the same time as doing it on the remote host, I get responses (with large latencies)

on localhost
```
arping 10.123.202.6
ARPING 10.123.202.6
42 bytes from 36:89:37:70:2c:dd (10.123.202.6): index=0 time=553.390 msec
60 bytes from 36:89:37:70:2c:dd (10.123.202.6): index=1 time=553.604 msec
42 bytes from 36:89:37:70:2c:dd (10.123.202.6): index=2 time=542.670 msec
60 bytes from 36:89:37:70:2c:dd (10.123.202.6): index=3 time=542.854 msec
42 bytes from 36:89:37:70:2c:dd (10.123.202.6): index=4 time=532.638 msec
60 bytes from 36:89:37:70:2c:dd (10.123.202.6): index=5 time=532.791 msec
42 bytes from 36:89:37:70:2c:dd (10.123.202.6): index=6 time=541.607 msec
60 bytes from 36:89:37:70:2c:dd (10.123.202.6): index=7 time=541.745 msec
42 bytes from 36:89:37:70:2c:dd (10.123.202.6): index=8 time=541.743 msec
60 bytes from 36:89:37:70:2c:dd (10.123.202.6): index=9 time=548.144 msec
42 bytes from 36:89:37:70:2c:dd (10.123.202.6): index=10 time=540.788 msec
60 bytes from 36:89:37:70:2c:dd (10.123.202.6): index=11 time=541.002 msec
42 bytes from 36:89:37:70:2c:dd (10.123.202.6): index=12 time=540.222 msec
60 bytes from 36:89:37:70:2c:dd (10.123.202.6): index=13 time=540.361 msec
# stopped arping on remote host
Timeout
Timeout
# started arping on remote host
42 bytes from 36:89:37:70:2c:dd (10.123.202.6): index=14 time=668.047 msec
60 bytes from 36:89:37:70:2c:dd (10.123.202.6): index=15 time=668.284 msec
42 bytes from 36:89:37:70:2c:dd (10.123.202.6): index=16 time=667.730 msec
60 bytes from 36:89:37:70:2c:dd (10.123.202.6): index=17 time=667.947 msec
42 bytes from 36:89:37:70:2c:dd (10.123.202.6): index=18 time=667.308 msec
60 bytes from 36:89:37:70:2c:dd (10.123.202.6): index=19 time=667.472 msec
# stopped arping on remote host
Timeout
Timeout
```

So, could it be that zerotier detects the presence of the IP address on the interface and uses that information to alter how it does ARP ?

**Comment by cameronbraid** [comment]
And secondly, is it possible to get metallb to add the IP address like that ?

**Comment by rata** [comment]
> So, could it be that zerotier detects the presence of the IP address on the interface and uses that information to alter how it does ARP ?

I'm really not familiar with `zerotier` at all, to be honest. But if you can't arping other IPs in your network reliably, MetalLB won't work on Layer 2 on that environment until that is fixed at the network level in your setup.

I'm closing the issue as it seems the network this is running has issues with ARP. If you need help on how that can be fixed (is quite hard, as every network is different) please don't hesitate to join on slack :-). Not sure if someone will know about zerotier, though, but we can try :)

Please feel free to re-open if I'm missing something and there is a bug on MetalLB side. Just want to keep github issues for actual bugs, slack is better suited for the rest :)

> And secondly, is it possible to get metallb to add the IP address like that ?

Not really, MetalLB does't work like that. It shouldn't matter either, though :-)
