### ISSUE TITLE
NDP implementation is incomplete (Neighbor Unreachability Detection)

### ISSUE THREAD

**Issue by totoCZ** [metallb/metallb#2920]
### Is your feature request related to a problem?

Standard hosts work such as:

01:26:41.989324 IP6 2a09:e206:c1:x> 2a09:e206:c1:ff00::2: ICMP6, neighbor solicitation, who has 2a09:e206:c1:ff00::2, length 32
01:26:41.989358 IP6 2a09:e206:c1:ff00::2 > 2a09:e206:c1:xICMP6, neighbor advertisement, tgt is 2a09:e206:c1:ff00::2, length 24

MetaLB does not respond to it.

"     Unlike ARP, Neighbor Discovery detects half-link failures (using
      Neighbor Unreachability Detection) and avoids sending traffic to
      neighbors with which two-way connectivity is absent."

Kernel NDP proxy also implements it wrongly (its deprecated), but ndppd is correct.

The workflow with (what seems to be) a Juniper switch
- try multicast
- add host to table
- try GUA detection after timer expires (30 min)
- no reply on GUA -> drop neighbor from table, kill traffic
- go back to 1)

So every 30 min traffic is dropped for a couple of seconds.

Working reply (link local):

01:27:08.000350 IP6 fe80::eef4:bbff:fed9:c2c4 > fe80::e230:f900:a682:9838: ICMP6, neighbor advertisement, tgt is 2a09:e206:c1:ff00:c::, length 32

Not working reply (GUA):

00:58:57.689847 IP6 2a09:e206:c1:x > 2a09:e206:c1:ff00:c::: ICMP6, neighbor solicitation, who has 2a09:e206:c1:ff00:c::, length 32
00:58:58.689997 IP6 2a09:e206:c1:x > 2a09:e206:c1:ff00:c::: ICMP6, neighbor solicitation, who has 2a09:e206:c1:ff00:c::, length 32
00:58:59.689903 IP6 2a09:e206:c1:x > 2a09:e206:c1:ff00:c::: ICMP6, neighbor solicitation, who has 2a09:e206:c1:ff00:c::, length 32

### Describe the solution you'd like

Reply to GUA NDP with GUA.

### I've read and agree with the following

- [x] I've checked all open and closed issues and my request is not there.
- [x] I've checked all open and closed pull requests and my request is not there.

**Comment by ginkel** [comment]
I have also hit this issue - the VIP becomes unreachable every 30 minutes after the upstream switch (a Hetzner vSwitch, so probably also Juniper) does not receive any response to its ICMP6 neighbor solicitation.

@totoCZ Have you figured out a workaround?

**Comment by andreaskaris** [comment]
Just for other people who are a bit dyslexic like me when it comes to this issue.

Deploy cluster (-a arm64 just because I'm on arm):

```
inv dev-env -i ipv6 -u -a arm64
```

Add a sleep to the e2e tests:

```
[root@centos metallb ((b0c450d1f...))]# git diff
diff --git a/e2etest/bgptests/bgp.go b/e2etest/bgptests/bgp.go
index 6c77265fd..b0c47ff69 100644
--- a/e2etest/bgptests/bgp.go
+++ b/e2etest/bgptests/bgp.go
@@ -2210,6 +2210,8 @@ var _ = ginkgo.Describe("BGP", func() {
                        validateService(svc, allNodes.Items, c)
                }

+               time.Sleep(300 * time.Second)
+
                ginkgo.By("Deleting the l2 advertisement")
                err = ConfigUpdater.Client().Delete(context.Background(), &l2Advertisement)
                Expect(err).NotTo(HaveOccurred())
```

Kick off the e2e:

```
# inv e2etest -b frr-k8s -f "A service of protocol load balancer should work with two protocols IPV6"
```

Now, we can test the working case global unicast address <-> solicited node multicast address:

```
[root@centos metallb ((b0c450d1f...))]# ip neigh del fc00:f853:ccd:e793::9 dev br-906f75212ac9 lladdr 82:32:9c:58:67:a6
[root@centos metallb ((b0c450d1f...))]# curl "http://[fc00:f853:ccd:e793::9]"
NOW: 2026-09-11 15:22:35.192543816 +0000 UTC m=+18.835326593
```

Result:

```
[17:14:51.393859 b2:64:df:5f:9f:b1 > 33:33:ff:00:00:09, ethertype IPv6 (0x86dd), length 86: fc00:f853:ccd:e793::1 > ff02::1:ff00:9: ICMP6, neighbor solicitation, who has fc00:f853:ccd:e793::9, length 32
17:14:51.394039 82:32:9c:58:67:a6 > b2:64:df:5f:9f:b1, ethertype IPv6 (0x86dd), length 86: fe80::8032:9cff:fe58:67a6 > fc00:f853:ccd:e793::1: ICMP6, neighbor advertisement, tgt is fc00:f853:ccd:e793::9, length 32
```

And with (script written by Claude) [0] we can test the broken global unicast <-> global unicast address case:

```
#  ./send-nd.py fc00:f853:ccd:e793::9
Interface:  br-906f75212ac9
Source:     b2:64:df:5f:9f:b1 / fc00:f853:ccd:e793::1
Target:     82:32:9c:58:67:a6 / fc00:f853:ccd:e793::9
NS target:  fc00:f853:ccd:e793::9
.
Sent 1 packets.
```

Result:

```
17:30:41.082679 b2:64:df:5f:9f:b1 > 82:32:9c:58:67:a6, ethertype IPv6 (0x86dd), length 86: fc00:f853:ccd:e793::1 > fc00:f853:ccd:e793::9: ICMP6, neighbor solicitation, who has fc00:f853:ccd:e793::9, length 32
17:30:41.082712 82:32:9c:58:67:a6 > b2:64:df:5f:9f:b1, ethertype IPv6 (0x86dd), length 174: fe80::8032:9cff:fe58:67a6 > fc00:f853:ccd:e793::1: ICMP6, redirect, fc00:f853:ccd:e793::9 to fc00:f853:ccd:e793::9, length 120
17:30:41.082719 82:32:9c:58:67:a6 > 33:33:ff:00:00:09, ethertype IPv6 (0x86dd), length 86: fe80::8032:9cff:fe58:67a6 > ff02::1:ff00:9: ICMP6, neighbor solicitation, who has fc00:f853:ccd:e793::9, length 32
17:30:42.131915 82:32:9c:58:67:a6 > 33:33:ff:00:00:09, ethertype IPv6 (0x86dd), length 86: fe80::8032:9cff:fe58:67a6 > ff02::1:ff00:9: ICMP6, neighbor solicitation, who has fc00:f853:ccd:e793::9, length 32
17:30:43.162154 82:32:9c:58:67:a6 > 33:33:ff:00:00:09, ethertype IPv6 (0x86dd), length 86: fe80::8032:9cff:fe58:67a6 > ff02::1:ff00:9: ICMP6, neighbor solicitation, who has fc00:f853:ccd:e793::9, length 32
17:30:44.203484 82:32:9c:58:67:a6 > b2:64:df:5f:9f:b1, ethertype IPv6 (0x86dd), length 134: fc00:f853:ccd:e793::2 > fc00:f853:ccd:e793::1: ICMP6, destination unreachable, unreachable address fc00:f853:ccd:e793::9, length 80
```

And, what also works is link-local <-> link-local:

```
#  ./send-nd.py -i br-906f75212ac9 -t fc00:f853:ccd:e793::9 fe80::8032:9cff:fe58:67a6
Interface:  br-906f75212ac9
Source:     b2:64:df:5f:9f:b1 / fe80::b064:dfff:fe5f:9fb1
Target:     82:32:9c:58:67:a6 / fe80::8032:9cff:fe58:67a6
NS target:  fc00:f853:ccd:e793::9
.
Sent 1 packets.
```

```
17:29:31.842346 b2:64:df:5f:9f:b1 > 82:32:9c:58:67:a6, ethertype IPv6 (0x86dd), length 86: fe80::b064:dfff:fe5f:9fb1 > fe80::8032:9cff:fe58:67a6: ICMP6, neighbor solicitation, who has fc00:f853:ccd:e793::9, length 32
17:29:31.842472 82:32:9c:58:67:a6 > b2:64:df:5f:9f:b1, ethertype IPv6 (0x86dd), length 86: fe80::8032:9cff:fe58:67a6 > fe80::b064:dfff:fe5f:9fb1: ICMP6, neighbor advertisement, tgt is fc00:f853:ccd:e793::9, length 32
```

----

[0]

```
#!/usr/bin/env python3

import argparse
import subprocess
import sys

from scapy.all import sendp, Ether, IPv6, ICMPv6ND_NS, ICMPv6NDOptSrcLLAddr


def get_neighbor_entry(target_ip):
    result = subprocess.run(
        ["ip", "-6", "neigh", "show", target_ip],
        capture_output=True, text=True,
    )
    if result.returncode != 0 or not result.stdout.strip():
        sys.exit(f"No neighbor entry found for {target_ip}. "
                 f"Run ndisc6 first to populate it.")

    line = result.stdout.strip().splitlines()[0]
    parts = line.split()
    iface = parts[parts.index("dev") + 1]
    mac = parts[parts.index("lladdr") + 1]
    return iface, mac


def get_link_mac(iface):
    result = subprocess.run(
        ["ip", "-br", "link", "show", "dev", iface],
        capture_output=True, text=True,
    )
    if result.returncode != 0 or not result.stdout.strip():
        sys.exit(f"Cannot find interface {iface}")

    return result.stdout.strip().split()[2]


def get_link_local(iface):
    result = subprocess.run(
        ["ip", "-6", "-br", "addr", "show", "dev", iface, "scope", "link"],
        capture_output=True, text=True,
    )
    if result.returncode != 0 or not result.stdout.strip():
        sys.exit(f"Cannot find link-local address on {iface}")

    return result.stdout.strip().split()[2].split("/")[0]


def get_route_src(target_ip):
    result = subprocess.run(
        ["ip", "-6", "route", "get", target_ip],
        capture_output=True, text=True,
    )
    if result.returncode != 0 or not result.stdout.strip():
        sys.exit(f"No route to {target_ip}")

    parts = result.stdout.strip().split()
    src_ip = parts[parts.index("src") + 1]
    iface = parts[parts.index("dev") + 1]
    return src_ip, iface


def main():
    parser = argparse.ArgumentParser(
        description="Send a unicast ICMPv6 Neighbor Solicitation")
    parser.add_argument("target", help="Target IPv6 address")
    parser.add_argument("-i", "--interface",
                        help="Source interface (required for link-local targets)")
    parser.add_argument("-t", "--ns-target",
                        help="Override the NS target address (default: same as target)")
    args = parser.parse_args()

    target_ip = args.target
    is_link_local = target_ip.lower().startswith("fe80")

    if is_link_local:
        if not args.interface:
            sys.exit("Link-local target requires -i/--interface")
        iface = args.interface
        src_ip = get_link_local(iface)
    else:
        src_ip, iface = get_route_src(target_ip)

    _, dst_mac = get_neighbor_entry(target_ip)
    src_mac = get_link_mac(iface)
    ns_target = args.ns_target or target_ip

    print(f"Interface:  {iface}")
    print(f"Source:     {src_mac} / {src_ip}")
    print(f"Target:     {dst_mac} / {target_ip}")
    print(f"NS target:  {ns_target}")

    pkt = (Ether(src=src_mac, dst=dst_mac) /
           IPv6(src=src_ip, dst=target_ip) /
           ICMPv6ND_NS(tgt=ns_target) /
           ICMPv6NDOptSrcLLAddr(lladdr=src_mac))
    sendp(pkt, iface=iface)


if __name__ == "__main__":
    main()
```

**Comment by andreaskaris** [comment]
The problem is with the NDP library that's currently in use.  Whereas the ARP library uses a raw socket:

```
// Dial creates a new Client using the specified network interface.
// Dial retrieves the IPv4 address of the interface and binds a raw socket
// to send and receive ARP packets.
func Dial(ifi *net.Interface) (*Client, error) {
	// Open raw socket to send and receive ARP packets using ethernet frames
	// we build ourselves.
	p, err := packet.Listen(ifi, packet.Raw, protocolARP, nil)
	if err != nil {
		return nil, err
	}
	return New(ifi, p)
}
```

The NDP library must bind to an existing interface address:

```
// Dial dials a NDP connection using the specified interface and address type.
//
// As a special case, literal IPv6 addresses may be specified to bind to a
// specific address for an interface.  If the IPv6 address does not exist on
// the interface, an error will be returned.
//
// Dial returns a Conn and the chosen IPv6 address of the interface.
func Dial(ifi *net.Interface, addr Addr) (*Conn, net.IP, error) {
	addrs, err := ifi.Addrs()
	if err != nil {
		return nil, nil, err
	}

	ipAddr, err := chooseAddr(addrs, ifi.Name, addr)
	if err != nil {
		return nil, nil, err
	}
(...)
```

The VIP obviously does not exist on the host, and therefore we have no way to bind to it.

There is actually a somewhat related discussion about this in https://www.reddit.com/r/golang/comments/8n9560/network_protocol_breakdown_ndp_and_go_matt_layher/ where they are talking about how metallb joins the multicast groups.
Meaning metallb uses the link local address, and it joins the multicast groups, but it cannot listen on the non-existing GUA address.

Here's an isolated reproducer (using ndp 1.1.0, so the newest version of the ndp lib): https://github.com/andreaskaris/test-nd
