### ISSUE TITLE
Some services NOT responding to External IP address

### ISSUE THREAD

**Issue by Ramshield** [metallb/metallb#2344]
### MetalLB Version

0.14.3

### Deployment method

Charts

### Main CNI

Cilium

### Kubernetes Version

1.29.3

### Cluster Distribution

Talos

### Describe the bug

I am using MetalLB in combination with Cilium 1.15.2.
However only some services are responding to cURL requests. And only some get an entry in the ARP table. 

### To Reproduce

Deploy Talos to replace Kube-proxy with this patch:
```
---
machine:
  install:
    image: factory.talos.dev/installer/ce4c980550dd2ab1b17bbf2b08801c7eb59418eafe8f279833297925d67c7515:v1.6.7
cluster:
  network:
    cni:
      name: none
  proxy:
    disabled: true
```

Deploy Cilium with these values:
```
ipam:
  mode: kubernetes
  operator:
    clusterPoolIPv4PodCIDR: "172.16.0.0/12"
kubeProxyReplacement: true
securityContext:
  capabilities:
    cleanCiliumState:
      - NET_ADMIN
      - SYS_ADMIN
      - SYS_RESOURCE
    ciliumAgent:
      - CHOWN
      - KILL
      - NET_ADMIN
      - NET_RAW
      - IPC_LOCK
      - SYS_ADMIN
      - SYS_RESOURCE
      - DAC_OVERRIDE
      - FOWNER
      - SETGID
      - SETUID
cgroup:
  autoMount:
    enabled: false
  hostRoot: "/sys/fs/cgroup"
k8sServiceHost: localhost
k8sServicePort: 7445
```

Deploy MetalLB with these values:
```
psp:
  create: true
controller:
  logLevel: debug
speaker:
  logLevel: debug
```

Apply IPaddresspool and L2Advertisement:
```
# k -n metallb-system get ipaddresspools.metallb.io -o yaml
apiVersion: v1
items:
- apiVersion: metallb.io/v1beta1
  kind: IPAddressPool
  metadata:
    creationTimestamp: "2024-03-26T12:06:47Z"
    generation: 7
    labels:
      argocd.argoproj.io/instance: misc
    name: pool-vlan40-private
    namespace: metallb-system
    resourceVersion: "89439"
    uid: efa2054b-394e-4666-b1e0-986d829418ec
  spec:
    addresses:
    - 10.255.254.200-10.255.254.230
    autoAssign: true
    avoidBuggyIPs: false
kind: List
metadata:
  resourceVersion: ""
# k -n metallb-system get l2advertisements.metallb.io -o yaml
apiVersion: v1
items:
- apiVersion: metallb.io/v1beta1
  kind: L2Advertisement
  metadata:
    creationTimestamp: "2024-03-26T12:06:47Z"
    generation: 1
    labels:
      argocd.argoproj.io/instance: misc
    name: example
    namespace: metallb-system
    resourceVersion: "16259"
    uid: 7e5f5121-2a24-45b7-9b9f-1b02d78b9063
kind: List
metadata:
  resourceVersion: ""
```

### Expected Behavior

I expect that all my services respond to my cURL request.  Only some seem to work.

### Additional Context

There is NO error of any sort in the MetalLB controller or speaker pods.
Nothing in the Cilium pods either. 

### I've read and agree with the following

- [X] I've checked all open and closed issues and my request is not there.
- [X] I've checked all open and closed pull requests and my request is not there.

### I've read and agree with the following

- [X] I've checked all open and closed issues and my issue is not there.
- [X] This bug is reproducible when deploying MetalLB from the main branch
- [X] I have read the [troubleshooting guide](https://metallb.universe.tf/troubleshooting/) and I am still not able to make it work
- [X] I checked the logs and MetalLB is not discarding the configuration as not valid
- [X] I enabled the debug logs, collected the information required from the cluster using the [collect script](https://raw.githubusercontent.com/metallb/metallb/main/troubleshooting/collect.sh) and will attach them to the issue
- [X] I will provide the definition of my service and the related endpoint slices and attach them to this issue

**Comment by fedepaol** [comment]
Please try to follow the troubleshooting guide https://metallb.org/configuration/troubleshooting/

**Comment by Ramshield** [comment]
Sorry you are correct. I have additional information:

This one doesn't work:

```
# kubectl -n monitoring get endpointslices kube-prometheus-stack-prometheus-d7d92 -o yaml
addressType: IPv4
apiVersion: discovery.k8s.io/v1
endpoints:
- addresses:
  - 10.244.4.206
  conditions:
    ready: true
    serving: true
    terminating: false
  nodeName: talos-cji-lqz
  targetRef:
    kind: Pod
    name: prometheus-kube-prometheus-stack-prometheus-0
    namespace: monitoring
    uid: 315a8c18-d7f8-41ca-abc7-a9168eb37b41
kind: EndpointSlice
metadata:
  annotations:
    endpoints.kubernetes.io/last-change-trigger-time: "2024-03-27T09:44:30Z"
  creationTimestamp: "2024-03-26T12:12:45Z"
  generateName: kube-prometheus-stack-prometheus-
  generation: 6
  labels:
    app: kube-prometheus-stack-prometheus
    app.kubernetes.io/instance: kube-prometheus-stack
    app.kubernetes.io/managed-by: Helm
    app.kubernetes.io/part-of: kube-prometheus-stack
    app.kubernetes.io/version: 57.0.3
    argocd.argoproj.io/instance: kube-prometheus-stack
    chart: kube-prometheus-stack-57.0.3
    endpointslice.kubernetes.io/managed-by: endpointslice-controller.k8s.io
    heritage: Helm
    kubernetes.io/service-name: kube-prometheus-stack-prometheus
    release: kube-prometheus-stack
    self-monitor: "true"
  name: kube-prometheus-stack-prometheus-d7d92
  namespace: monitoring
  ownerReferences:
  - apiVersion: v1
    blockOwnerDeletion: true
    controller: true
    kind: Service
    name: kube-prometheus-stack-prometheus
    uid: 19cb592f-b6d1-45b9-9b46-9c83e448ceae
  resourceVersion: "410123"
  uid: ec04aa8b-96d1-44dc-91f0-5c5595def2b8
ports:
- appProtocol: http
  name: reloader-web
  port: 8080
  protocol: TCP
- name: http-web
  port: 9090
  protocol: TCP
```

This one does work:
```
# kubectl -n monitoring get endpointslices kube-prometheus-stack-grafana-qvr5d -o yaml
addressType: IPv4
apiVersion: discovery.k8s.io/v1
endpoints:
- addresses:
  - 10.244.4.27
  conditions:
    ready: true
    serving: true
    terminating: false
  nodeName: talos-cji-lqz
  targetRef:
    kind: Pod
    name: kube-prometheus-stack-grafana-69d9d5656f-v4jmm
    namespace: monitoring
    uid: 958aeacf-9045-4a7a-b950-2062d2ea07d6
kind: EndpointSlice
metadata:
  annotations:
    endpoints.kubernetes.io/last-change-trigger-time: "2024-03-27T09:44:20Z"
  creationTimestamp: "2024-03-26T12:12:44Z"
  generateName: kube-prometheus-stack-grafana-
  generation: 6
  labels:
    app.kubernetes.io/instance: kube-prometheus-stack
    app.kubernetes.io/managed-by: Helm
    app.kubernetes.io/name: grafana
    app.kubernetes.io/version: 10.3.3
    argocd.argoproj.io/instance: kube-prometheus-stack
    endpointslice.kubernetes.io/managed-by: endpointslice-controller.k8s.io
    helm.sh/chart: grafana-7.3.7
    kubernetes.io/service-name: kube-prometheus-stack-grafana
  name: kube-prometheus-stack-grafana-qvr5d
  namespace: monitoring
  ownerReferences:
  - apiVersion: v1
    blockOwnerDeletion: true
    controller: true
    kind: Service
    name: kube-prometheus-stack-grafana
    uid: ffc29999-c79c-4247-825d-1860ec7150e1
  resourceVersion: "410028"
  uid: 39bff121-a25a-4175-a7dc-d22536d5c6e8
ports:
- name: http-web
  port: 3000
  protocol: TCP
``` 


The Grafana service is the one that is working:
```
apiVersion: v1
items:
- apiVersion: v1
  kind: Service
  metadata:
    annotations:
      host: grafana-k8s
      metallb.universe.tf/ip-allocated-from-pool: pool-vlan40-private
    creationTimestamp: "2024-03-26T12:12:43Z"
    labels:
      app.kubernetes.io/instance: kube-prometheus-stack
      app.kubernetes.io/managed-by: Helm
      app.kubernetes.io/name: grafana
      app.kubernetes.io/version: 10.3.3
      argocd.argoproj.io/instance: kube-prometheus-stack
      helm.sh/chart: grafana-7.3.7
    name: kube-prometheus-stack-grafana
    namespace: monitoring
    resourceVersion: "89448"
    uid: ffc29999-c79c-4247-825d-1860ec7150e1
  spec:
    allocateLoadBalancerNodePorts: true
    clusterIP: 10.98.6.96
    clusterIPs:
    - 10.98.6.96
    externalTrafficPolicy: Cluster
    internalTrafficPolicy: Cluster
    ipFamilies:
    - IPv4
    ipFamilyPolicy: SingleStack
    ports:
    - name: http-web
      nodePort: 31667
      port: 80
      protocol: TCP
      targetPort: 3000
    selector:
      app.kubernetes.io/instance: kube-prometheus-stack
      app.kubernetes.io/name: grafana
    sessionAffinity: None
    type: LoadBalancer
  status:
    loadBalancer:
      ingress:
      - ip: 10.255.254.203
- apiVersion: v1
  kind: Service
  metadata:
    annotations:
      host: prometheus
      http_request: auth unless { http_auth(logins) }
      metallb.universe.tf/ip-allocated-from-pool: pool-vlan40-private
    creationTimestamp: "2024-03-26T12:12:43Z"
    labels:
      app: kube-prometheus-stack-prometheus
      app.kubernetes.io/instance: kube-prometheus-stack
      app.kubernetes.io/managed-by: Helm
      app.kubernetes.io/part-of: kube-prometheus-stack
      app.kubernetes.io/version: 57.0.3
      argocd.argoproj.io/instance: kube-prometheus-stack
      chart: kube-prometheus-stack-57.0.3
      heritage: Helm
      release: kube-prometheus-stack
      self-monitor: "true"
    name: kube-prometheus-stack-prometheus
    namespace: monitoring
    resourceVersion: "89454"
    uid: 19cb592f-b6d1-45b9-9b46-9c83e448ceae
  spec:
    allocateLoadBalancerNodePorts: true
    clusterIP: 10.108.185.153
    clusterIPs:
    - 10.108.185.153
    externalTrafficPolicy: Cluster
    internalTrafficPolicy: Cluster
    ipFamilies:
    - IPv4
    ipFamilyPolicy: SingleStack
    ports:
    - name: http-web
      nodePort: 30273
      port: 9090
      protocol: TCP
      targetPort: 9090
    - appProtocol: http
      name: reloader-web
      nodePort: 32008
      port: 8080
      protocol: TCP
      targetPort: reloader-web
    selector:
      app.kubernetes.io/name: prometheus
      operator.prometheus.io/name: kube-prometheus-stack-prometheus
    sessionAffinity: None
    type: LoadBalancer
  status:
    loadBalancer:
      ingress:
      - ip: 10.255.254.205
kind: List
metadata:
  resourceVersion: ""
```

I see Request-Who ARP requests outgoing but nothing is responding. 
This is on the node where the service should live:

```
# talosctl -n 10.0.0.27 pcap -i enxca166464b476 -o - | tcpdump -vvv -r -
reading from file -, link-type EN10MB (Ethernet), snapshot length 4096
13:14:47.985709 ARP, Ethernet (len 6), IPv4 (len 4), Request who-has 10.255.254.205 tell 10.255.254.11, length 44
13:14:48.986766 ARP, Ethernet (len 6), IPv4 (len 4), Request who-has 10.255.254.205 tell 10.255.254.11, length 44
13:14:49.987947 ARP, Ethernet (len 6), IPv4 (len 4), Request who-has 10.255.254.205 tell 10.255.254.11, length 44
```
So I see ARP requests but no MetalLB speaker is responding.

Please let me know if I can provide any other information.

**Comment by cyclinder** [comment]
Could you describe the events of the service doesn't work? (If no events could, you can delete and recreate the service). Also, Could you provide more details by using the following commands?

- kubectl get nodes -o wide?
- ip a

**Comment by Ramshield** [comment]
Hi @cyclinder. Thanks for your reply. So I noticed several issues regarding labels, but this doesn't seem to be the problem, but:

```
# k get nodes -o wide --show-labels
NAME            STATUS   ROLES           AGE   VERSION   INTERNAL-IP   EXTERNAL-IP   OS-IMAGE         KERNEL-VERSION   CONTAINER-RUNTIME     LABELS
talos-5tn-1ws   Ready    control-plane   18h   v1.28.6   10.0.0.35     <none>        Talos (v1.6.7)   6.1.82-talos     containerd://1.7.13   beta.kubernetes.io/arch=amd64,beta.kubernetes.io/os=linux,kubernetes.io/arch=amd64,kubernetes.io/hostname=talos-5tn-1ws,kubernetes.io/os=linux,node-role.kubernetes.io/control-plane=
talos-8vr-3ik   Ready    <none>          18h   v1.28.6   10.0.0.40     <none>        Talos (v1.6.7)   6.1.82-talos     containerd://1.7.13   beta.kubernetes.io/arch=amd64,beta.kubernetes.io/os=linux,kubernetes.io/arch=amd64,kubernetes.io/hostname=talos-8vr-3ik,kubernetes.io/os=linux
talos-b1o-dbx   Ready    <none>          18h   v1.28.6   10.0.0.36     <none>        Talos (v1.6.7)   6.1.82-talos     containerd://1.7.13   beta.kubernetes.io/arch=amd64,beta.kubernetes.io/os=linux,kubernetes.io/arch=amd64,kubernetes.io/hostname=talos-b1o-dbx,kubernetes.io/os=linux
talos-d2l-5q8   Ready    control-plane   18h   v1.28.6   10.0.0.37     <none>        Talos (v1.6.7)   6.1.82-talos     containerd://1.7.13   beta.kubernetes.io/arch=amd64,beta.kubernetes.io/os=linux,kubernetes.io/arch=amd64,kubernetes.io/hostname=talos-d2l-5q8,kubernetes.io/os=linux,node-role.kubernetes.io/control-plane=
talos-lwg-std   Ready    <none>          18h   v1.28.6   10.0.0.34     <none>        Talos (v1.6.7)   6.1.82-talos     containerd://1.7.13   beta.kubernetes.io/arch=amd64,beta.kubernetes.io/os=linux,kubernetes.io/arch=amd64,kubernetes.io/hostname=talos-lwg-std,kubernetes.io/os=linux
talos-r85-4o3   Ready    control-plane   18h   v1.28.6   10.0.0.38     <none>        Talos (v1.6.7)   6.1.82-talos     containerd://1.7.13   beta.kubernetes.io/arch=amd64,beta.kubernetes.io/os=linux,kubernetes.io/arch=amd64,kubernetes.io/hostname=talos-r85-4o3,kubernetes.io/os=linux,node-role.kubernetes.io/control-plane=
```

The Talos doesn't have a shell, but here are all interfaces for my worker nodes:

```
# talosctl get address -n 10.0.0.40,10.0.0.34,10.0.0.36
NODE        NAMESPACE   TYPE            ID                                             VERSION   ADDRESS                        LINK
10.0.0.40   network     AddressStatus   cilium_host/10.244.3.82/32                     1         10.244.3.82/32                 cilium_host
10.0.0.40   network     AddressStatus   cilium_host/fe80::1ce3:91ff:fee1:4e56/64       1         fe80::1ce3:91ff:fee1:4e56/64   cilium_host
10.0.0.40   network     AddressStatus   cilium_net/fe80::e847:6cff:fe4f:72d1/64        2         fe80::e847:6cff:fe4f:72d1/64   cilium_net
10.0.0.40   network     AddressStatus   cilium_vxlan/fe80::1046:74ff:fe9b:55a9/64      2         fe80::1046:74ff:fe9b:55a9/64   cilium_vxlan
10.0.0.40   network     AddressStatus   enx362882fb8a2e/10.255.254.25/24               1         10.255.254.25/24               enx362882fb8a2e
10.0.0.40   network     AddressStatus   enx362882fb8a2e/fe80::3428:82ff:fefb:8a2e/64   2         fe80::3428:82ff:fefb:8a2e/64   enx362882fb8a2e
10.0.0.40   network     AddressStatus   enx56997788166f/10.0.0.40/24                   1         10.0.0.40/24                   enx56997788166f
10.0.0.40   network     AddressStatus   enx56997788166f/fe80::5499:77ff:fe88:166f/64   2         fe80::5499:77ff:fe88:166f/64   enx56997788166f
10.0.0.40   network     AddressStatus   lo/127.0.0.1/8                                 1         127.0.0.1/8                    lo
10.0.0.40   network     AddressStatus   lo/::1/128                                     1         ::1/128                        lo
10.0.0.40   network     AddressStatus   lxc_health/fe80::d87f:acff:feeb:ccc7/64        2         fe80::d87f:acff:feeb:ccc7/64   lxc_health
10.0.0.34   network     AddressStatus   cilium_host/10.244.5.37/32                     1         10.244.5.37/32                 cilium_host
10.0.0.34   network     AddressStatus   cilium_host/fe80::68ef:70ff:fe96:5844/64       2         fe80::68ef:70ff:fe96:5844/64   cilium_host
10.0.0.34   network     AddressStatus   cilium_net/fe80::3018:74ff:fea2:2554/64        2         fe80::3018:74ff:fea2:2554/64   cilium_net
10.0.0.34   network     AddressStatus   cilium_vxlan/fe80::14ee:64ff:fe9c:21a4/64      2         fe80::14ee:64ff:fe9c:21a4/64   cilium_vxlan
10.0.0.34   network     AddressStatus   enxbadd30a650a8/10.255.254.24/24               1         10.255.254.24/24               enxbadd30a650a8
10.0.0.34   network     AddressStatus   enxbadd30a650a8/fe80::b8dd:30ff:fea6:50a8/64   2         fe80::b8dd:30ff:fea6:50a8/64   enxbadd30a650a8
10.0.0.34   network     AddressStatus   enxce72d4661dc7/10.0.0.34/24                   1         10.0.0.34/24                   enxce72d4661dc7
10.0.0.34   network     AddressStatus   enxce72d4661dc7/fe80::cc72:d4ff:fe66:1dc7/64   2         fe80::cc72:d4ff:fe66:1dc7/64   enxce72d4661dc7
10.0.0.34   network     AddressStatus   lo/127.0.0.1/8                                 1         127.0.0.1/8                    lo
10.0.0.34   network     AddressStatus   lo/::1/128                                     1         ::1/128                        lo
10.0.0.34   network     AddressStatus   lxc_health/fe80::b406:f3ff:fe91:8cdf/64        2         fe80::b406:f3ff:fe91:8cdf/64   lxc_health
10.0.0.36   network     AddressStatus   cilium_host/10.244.4.67/32                     1         10.244.4.67/32                 cilium_host
10.0.0.36   network     AddressStatus   cilium_host/fe80::c847:fbff:fe72:c6b4/64       1         fe80::c847:fbff:fe72:c6b4/64   cilium_host
10.0.0.36   network     AddressStatus   cilium_net/fe80::2c11:aeff:feb4:bd08/64        2         fe80::2c11:aeff:feb4:bd08/64   cilium_net
10.0.0.36   network     AddressStatus   cilium_vxlan/fe80::8058:15ff:fe2a:304e/64      2         fe80::8058:15ff:fe2a:304e/64   cilium_vxlan
10.0.0.36   network     AddressStatus   enx1adc8919626d/10.255.254.23/24               1         10.255.254.23/24               enx1adc8919626d
10.0.0.36   network     AddressStatus   enx1adc8919626d/fe80::18dc:89ff:fe19:626d/64   2         fe80::18dc:89ff:fe19:626d/64   enx1adc8919626d
10.0.0.36   network     AddressStatus   enx3e800ccafb16/10.0.0.36/24                   1         10.0.0.36/24                   enx3e800ccafb16
10.0.0.36   network     AddressStatus   enx3e800ccafb16/fe80::3c80:cff:feca:fb16/64    2         fe80::3c80:cff:feca:fb16/64    enx3e800ccafb16
10.0.0.36   network     AddressStatus   lo/127.0.0.1/8                                 1         127.0.0.1/8                    lo
10.0.0.36   network     AddressStatus   lo/::1/128                                     1         ::1/128                        lo
10.0.0.36   network     AddressStatus   lxc0d0f6780735f/fe80::dca5:5bff:fe3e:5672/64   2         fe80::dca5:5bff:fe3e:5672/64   lxc0d0f6780735f
10.0.0.36   network     AddressStatus   lxc10bf2ddab488/fe80::b89c:8aff:fe0f:101b/64   2         fe80::b89c:8aff:fe0f:101b/64   lxc10bf2ddab488
10.0.0.36   network     AddressStatus   lxc4388096d77f4/fe80::8850:e5ff:fe7b:ae88/64   2         fe80::8850:e5ff:fe7b:ae88/64   lxc4388096d77f4
10.0.0.36   network     AddressStatus   lxc4c1e58c87b3d/fe80::103c:d9ff:fe90:ebb/64    2         fe80::103c:d9ff:fe90:ebb/64    lxc4c1e58c87b3d
10.0.0.36   network     AddressStatus   lxc518b07161ee3/fe80::40b2:eaff:fe42:f0ab/64   2         fe80::40b2:eaff:fe42:f0ab/64   lxc518b07161ee3
10.0.0.36   network     AddressStatus   lxc54c64a0cb1d2/fe80::455:52ff:fe69:b00e/64    2         fe80::455:52ff:fe69:b00e/64    lxc54c64a0cb1d2
10.0.0.36   network     AddressStatus   lxc77ab8ddbfaab/fe80::d8fa:2cff:fec5:d854/64   2         fe80::d8fa:2cff:fec5:d854/64   lxc77ab8ddbfaab
10.0.0.36   network     AddressStatus   lxc784733a45b21/fe80::d8c5:4bff:fe19:e68a/64   2         fe80::d8c5:4bff:fe19:e68a/64   lxc784733a45b21
10.0.0.36   network     AddressStatus   lxc8a1aff154637/fe80::f421:ccff:fe0b:a469/64   2         fe80::f421:ccff:fe0b:a469/64   lxc8a1aff154637
10.0.0.36   network     AddressStatus   lxc9722e215666a/fe80::cc24:50ff:fe43:bd44/64   2         fe80::cc24:50ff:fe43:bd44/64   lxc9722e215666a
10.0.0.36   network     AddressStatus   lxc_health/fe80::85f:23ff:fe38:ae1d/64         2         fe80::85f:23ff:fe38:ae1d/64    lxc_health
10.0.0.36   network     AddressStatus   lxcb57cf2e6c4d6/fe80::98a5:29ff:fed8:29df/64   2         fe80::98a5:29ff:fed8:29df/64   lxcb57cf2e6c4d6
10.0.0.36   network     AddressStatus   lxcfe0a0b35e635/fe80::ccb9:28ff:fe02:1581/64   2         fe80::ccb9:28ff:fe02:1581/64   lxcfe0a0b35e635
10.0.0.36   network     AddressStatus   lxcfe59aa50425d/fe80::14e9:2dff:fe78:dcb2/64   2         fe80::14e9:2dff:fe78:dcb2/64   lxcfe59aa50425d
10.0.0.36   network     AddressStatus   lxcfec1bb24f245/fe80::58d3:77ff:fe5e:d09c/64   2         fe80::58d3:77ff:fe5e:d09c/64   lxcfec1bb24f245
```

There are no events in the services, so after a recreation:

```
# k -n monitoring describe svc kube-prometheus-stack-prometheus
Name:                     kube-prometheus-stack-prometheus
Namespace:                monitoring
Labels:                   app=kube-prometheus-stack-prometheus
                          app.kubernetes.io/instance=kube-prometheus-stack
                          app.kubernetes.io/managed-by=Helm
                          app.kubernetes.io/part-of=kube-prometheus-stack
                          app.kubernetes.io/version=57.1.1
                          chart=kube-prometheus-stack-57.1.1
                          heritage=Helm
                          release=kube-prometheus-stack
                          self-monitor=true
Annotations:              meta.helm.sh/release-name: kube-prometheus-stack
                          meta.helm.sh/release-namespace: monitoring
                          metallb.universe.tf/ip-allocated-from-pool: pool-vlan40-private
Selector:                 app.kubernetes.io/name=prometheus,operator.prometheus.io/name=kube-prometheus-stack-prometheus
Type:                     LoadBalancer
IP Family Policy:         SingleStack
IP Families:              IPv4
IP:                       10.108.61.29
IPs:                      10.108.61.29
LoadBalancer Ingress:     10.255.254.213
Port:                     http-web  9090/TCP
TargetPort:               9090/TCP
NodePort:                 http-web  30991/TCP
Endpoints:                10.244.4.3:9090
Port:                     reloader-web  8080/TCP
TargetPort:               reloader-web/TCP
NodePort:                 reloader-web  32131/TCP
Endpoints:                10.244.4.3:8080
Session Affinity:         None
External Traffic Policy:  Cluster
Events:
  Type    Reason        Age   From                Message
  ----    ------        ----  ----                -------
  Normal  IPAllocated   25s   metallb-controller  Assigned IP ["10.255.254.213"]
  Normal  nodeAssigned  25s   metallb-speaker     announcing from node "talos-5tn-1ws" with protocol "layer2"
# curl 10.255.254.213:9093
curl: (7) Failed to connect to 10.255.254.213 port 9093 after 3072 ms: Couldn't connect to server
# curl 10.255.254.213:9093
curl: (7) Failed to connect to 10.255.254.213 port 9093 after 1663 ms: Couldn't connect to server
# arping -I ens20 10.255.254.213
ARPING 10.255.254.213
Timeout
```

**Comment by cyclinder** [comment]
It looks like Metallb works well. the svc `kube-prometheus-stack-prometheus` has announced from node `talos-5tn-1ws`. Could you show the logs of the speaker on node  `talos-5tn-1ws`? something like: 

```
kubectl logs -n metallb-system <speaker_on_talos-5tn-1ws> | grep kube-prometheus-stack-prometheus
```

> arping -I ens20 10.255.254.213

Where did you execute the command?  I didn't find the interface `ens20` from your provided information. you should use `enx362882fb8a2e ` to arping in one of your k8s nodes.

**Comment by Ramshield** [comment]
Sorry, the bastion/jumphost I have has ens20 in the same VLAN as the 10.255.254.0/24 network.

The logs from MetalLB speaker is a lot, since I have debug running. 
[debugmetallbspeaker.txt](https://github.com/metallb/metallb/files/14801696/debugmetallbspeaker.txt)

**Comment by cyclinder** [comment]
I see from the logs that the VIP seems to have moved to another node, has the node's state changed? I think metallb is working fine though, perhaps a tcpdump could provide some usable information.

**Comment by Ramshield** [comment]
It could be that the VIP moved, I used 3 workers before. I have 1 worker now so that won't happen anymore.
Anyway, a host in the same subnet, and the IP address(es) of the worker:

```
# talosctl get address -n 10.0.0.54
NODE        NAMESPACE   TYPE            ID                                             VERSION   ADDRESS                        LINK
10.0.0.54   network     AddressStatus   cni0/10.244.3.1/24                             1         10.244.3.1/24                  cni0
10.0.0.54   network     AddressStatus   cni0/fe80::b474:f4ff:fefd:2628/64              2         fe80::b474:f4ff:fefd:2628/64   cni0
10.0.0.54   network     AddressStatus   enx3a795d023a10/10.255.254.29/24               1         10.255.254.29/24               enx3a795d023a10
10.0.0.54   network     AddressStatus   enx3a795d023a10/fe80::3879:5dff:fe02:3a10/64   2         fe80::3879:5dff:fe02:3a10/64   enx3a795d023a10
10.0.0.54   network     AddressStatus   enxd6d20fd80f62/10.255.255.25/24               1         10.255.255.25/24               enxd6d20fd80f62
10.0.0.54   network     AddressStatus   enxd6d20fd80f62/fe80::d4d2:fff:fed8:f62/64     2         fe80::d4d2:fff:fed8:f62/64     enxd6d20fd80f62
10.0.0.54   network     AddressStatus   enxea7246f69332/10.0.0.54/24                   1         10.0.0.54/24                   enxea7246f69332
10.0.0.54   network     AddressStatus   enxea7246f69332/fe80::e872:46ff:fef6:9332/64   2         fe80::e872:46ff:fef6:9332/64   enxea7246f69332
10.0.0.54   network     AddressStatus   flannel.1/10.244.3.0/32                        1         10.244.3.0/32                  flannel.1
10.0.0.54   network     AddressStatus   flannel.1/fe80::2851:dbff:feb4:7c44/64         2         fe80::2851:dbff:feb4:7c44/64   flannel.1
10.0.0.54   network     AddressStatus   lo/127.0.0.1/8                                 1         127.0.0.1/8                    lo
10.0.0.54   network     AddressStatus   lo/::1/128                                     1         ::1/128                        lo
10.0.0.54   network     AddressStatus   veth0b50be80/fe80::7451:b2ff:fe1d:21b2/64      2         fe80::7451:b2ff:fe1d:21b2/64   veth0b50be80
10.0.0.54   network     AddressStatus   veth0bea2cc1/fe80::d07d:70ff:fec4:780a/64      2         fe80::d07d:70ff:fec4:780a/64   veth0bea2cc1
10.0.0.54   network     AddressStatus   veth1ee51e65/fe80::a0f0:6fff:fe0e:c256/64      2         fe80::a0f0:6fff:fe0e:c256/64   veth1ee51e65
10.0.0.54   network     AddressStatus   veth20c99032/fe80::c8d:7ff:fefe:a74e/64        2         fe80::c8d:7ff:fefe:a74e/64     veth20c99032
10.0.0.54   network     AddressStatus   veth31873ac2/fe80::5c:38ff:fe86:fc24/64        2         fe80::5c:38ff:fe86:fc24/64     veth31873ac2
10.0.0.54   network     AddressStatus   veth4a28be01/fe80::20a9:3bff:fe31:e54a/64      2         fe80::20a9:3bff:fe31:e54a/64   veth4a28be01
10.0.0.54   network     AddressStatus   veth4bc09acc/fe80::1ca6:41ff:feb6:a3fc/64      2         fe80::1ca6:41ff:feb6:a3fc/64   veth4bc09acc
10.0.0.54   network     AddressStatus   veth5441ee4c/fe80::4ce8:61ff:fe55:e62b/64      2         fe80::4ce8:61ff:fe55:e62b/64   veth5441ee4c
10.0.0.54   network     AddressStatus   veth5621a30b/fe80::d07e:4dff:fe64:240e/64      2         fe80::d07e:4dff:fe64:240e/64   veth5621a30b
10.0.0.54   network     AddressStatus   veth638d15e1/fe80::30c2:7ff:fe5e:49fc/64       2         fe80::30c2:7ff:fe5e:49fc/64    veth638d15e1
10.0.0.54   network     AddressStatus   veth9cd674d6/fe80::18bc:79ff:fe6e:603e/64      2         fe80::18bc:79ff:fe6e:603e/64   veth9cd674d6
10.0.0.54   network     AddressStatus   vetha4181023/fe80::5caf:eaff:fefa:3e87/64      2         fe80::5caf:eaff:fefa:3e87/64   vetha4181023
10.0.0.54   network     AddressStatus   vethc6a31a58/fe80::8c56:aff:fe4d:9ab1/64       2         fe80::8c56:aff:fe4d:9ab1/64    vethc6a31a58
10.0.0.54   network     AddressStatus   vethd483c89f/fe80::e8cc:fbff:fec2:4440/64      2         fe80::e8cc:fbff:fec2:4440/64   vethd483c89f
10.0.0.54   network     AddressStatus   vethdb32e3d5/fe80::180a:2aff:fe4a:34e3/64      2         fe80::180a:2aff:fe4a:34e3/64   vethdb32e3d5
10.0.0.54   network     AddressStatus   vethec405922/fe80::8c85:4bff:fe8f:8006/64      2         fe80::8c85:4bff:fe8f:8006/64   vethec405922
# ip -br a
lo               UNKNOWN        127.0.0.1/8 ::1/128
ens18            UP             10.0.0.152/24 fe80::be24:11ff:fe49:e8e0/64
ens19            UP             10.255.255.5/24 fe80::be24:11ff:feb1:2fd5/64
ens20            UP             10.255.254.11/24 fe80::be24:11ff:fed7:cc87/64
```

tcpdump:

```
# tcpdump -i ens20 host 10.255.254.210
tcpdump: verbose output suppressed, use -v[v]... for full protocol decode
listening on ens20, link-type EN10MB (Ethernet), snapshot length 262144 bytes
14:07:02.482288 ARP, Request who-has 10.255.254.210 tell 10.255.254.11, length 44
14:07:03.483409 ARP, Request who-has 10.255.254.210 tell 10.255.254.11, length 44
14:07:04.484604 ARP, Request who-has 10.255.254.210 tell 10.255.254.11, length 44
14:07:05.485720 ARP, Request who-has 10.255.254.210 tell 10.255.254.11, length 44
14:07:06.486849 ARP, Request who-has 10.255.254.210 tell 10.255.254.11, length 44
14:07:07.487961 ARP, Request who-has 10.255.254.210 tell 10.255.254.11, length 44
14:07:08.489076 ARP, Request who-has 10.255.254.210 tell 10.255.254.11, length 44
14:07:09.490250 ARP, Request who-has 10.255.254.210 tell 10.255.254.11, length 44
14:07:10.491358 ARP, Request who-has 10.255.254.210 tell 10.255.254.11, length 44
14:07:11.492475 ARP, Request who-has 10.255.254.210 tell 10.255.254.11, length 44
14:07:12.493610 ARP, Request who-has 10.255.254.210 tell 10.255.254.11, length 4
```

And on the worker:

```
# talosctl -n 10.0.0.54 pcap -i enx3a795d023a10 -o - | tcpdump -vvv -r -
reading from file -, link-type EN10MB (Ethernet), snapshot length 4096
14:07:27.510884 ARP, Ethernet (len 6), IPv4 (len 4), Request who-has 10.255.254.210 tell 10.255.254.11, length 44
14:07:28.512008 ARP, Ethernet (len 6), IPv4 (len 4), Request who-has 10.255.254.210 tell 10.255.254.11, length 44
14:07:29.513194 ARP, Ethernet (len 6), IPv4 (len 4), Request who-has 10.255.254.210 tell 10.255.254.11, length 44
14:07:30.514351 ARP, Ethernet (len 6), IPv4 (len 4), Request who-has 10.255.254.210 tell 10.255.254.11, length 44
14:07:31.515558 ARP, Ethernet (len 6), IPv4 (len 4), Request who-has 10.255.254.210 tell 10.255.254.11, length 44
14:07:32.516696 ARP, Ethernet (len 6), IPv4 (len 4), Request who-has 10.255.254.210 tell 10.255.254.11, length 44
14:07:33.517972 ARP, Ethernet (len 6), IPv4 (len 4), Request who-has 10.255.254.210 tell 10.255.254.11, length 44
```

Tested with this command:
```
# arping -I ens20 10.255.254.210                              ARPING 10.255.254.210
<SNIP>
--- 10.255.254.210 statistics ---
77 packets transmitted, 0 packets received, 100% unanswered (0 extra)
```

**Comment by Ramshield** [comment]
The same tcpdump from another VLAN, it's all connected on the same switch though...

```
# arping -I ens19 10.255.255.210
ARPING 10.255.255.210
60 bytes from d6:d2:0f:d8:0f:62 (10.255.255.210): index=0 time=728.075 usec
60 bytes from d6:d2:0f:d8:0f:62 (10.255.255.210): index=1 time=634.222 usec
60 bytes from d6:d2:0f:d8:0f:62 (10.255.255.210): index=2 time=738.466 usec
^C
--- 10.255.255.210 statistics ---
3 packets transmitted, 3 packets received,   0% unanswered (0 extra)
rtt min/avg/max/std-dev = 0.634/0.700/0.738/0.047 ms

```


```
# tcpdump -i ens19 host 10.255.255.210
tcpdump: verbose output suppressed, use -v[v]... for full protocol decode
listening on ens19, link-type EN10MB (Ethernet), snapshot length 262144 bytes
17:13:47.738004 ARP, Request who-has 10.255.255.210 tell 10.255.255.5, length 44
17:13:47.738747 ARP, Reply 10.255.255.210 is-at d6:d2:0f:d8:0f:62 (oui Unknown), length 46
17:13:48.739157 ARP, Request who-has 10.255.255.210 tell 10.255.255.5, length 44
17:13:48.739781 ARP, Reply 10.255.255.210 is-at d6:d2:0f:d8:0f:62 (oui Unknown), length 46
17:13:49.740270 ARP, Request who-has 10.255.255.210 tell 10.255.255.5, length 44
17:13:49.740981 ARP, Reply 10.255.255.210 is-at d6:d2:0f:d8:0f:62 (oui Unknown), length 46
^C
6 packets captured
6 packets received by filter
0 packets dropped by kernel

```

```
# talosctl -n 10.0.0.54 pcap -i enxd6d20fd80f62 -o - | tcpdump -vvv -r -
reading from file -, link-type EN10MB (Ethernet), snapshot length 4096
17:13:47.737907 ARP, Ethernet (len 6), IPv4 (len 4), Request who-has 10.255.255.210 tell 10.255.255.5, length 44
17:13:47.738189 ARP, Ethernet (len 6), IPv4 (len 4), Reply 10.255.255.210 is-at d6:d2:0f:d8:0f:62 (oui Unknown), length 46
17:13:48.738998 ARP, Ethernet (len 6), IPv4 (len 4), Request who-has 10.255.255.210 tell 10.255.255.5, length 44
17:13:48.739187 ARP, Ethernet (len 6), IPv4 (len 4), Reply 10.255.255.210 is-at d6:d2:0f:d8:0f:62 (oui Unknown), length 46
17:13:49.740186 ARP, Ethernet (len 6), IPv4 (len 4), Request who-has 10.255.255.210 tell 10.255.255.5, length 44
17:13:49.740391 ARP, Ethernet (len 6), IPv4 (len 4), Reply 10.255.255.210 is-at d6:d2:0f:d8:0f:62 (oui Unknown), length 46
```

It works when I add the mac address to the arptable, so it can't be anything on the switch. 
I have another kubernetes cluster in 10.255.254.0/24 which works fine, same setup except with k8s in stead of Talos.
(I also shutdown that Kubernetes cluster in case it was interfering or something, but that didn't help.
That also means the switch is setup correctly in terms of VLAN's as it are all VM's in the same Proxmox cluster.

**Comment by fedepaol** [comment]
Odd that I don't see "creating arp responder" in the logs. It might be that those interfaces have the NOARP flag, or just that the logs were rotated / cut. 

This where metallb checks for interfaces:
https://github.com/metallb/metallb/blob/c586d5e14cedb0d337998ca23b90e32c36a30443/internal/layer2/announcer.go#L95

Reasons to skip:
- interface down
- interface has master
- interface lacks the broadcast flag
- interface has the noarp flag


Can you make sure the service is on one node, and provide again the debug logs of the speaker running on that (maybe even after restarting the speakers)?

**Comment by Ramshield** [comment]
[metallblogs.txt](https://github.com/metallb/metallb/files/14895118/metallblogs.txt)

As per request, new cluster, same problem. 1 controlplane, 1 worker. I installed argocd helm chart (as example application), deleted the service, deleted the speaker pod on the worker and then applied the argocd service which containers the LoadBalancer IP (10.255.254.210 in this case).
Same problem, as soon as I add the MAC address to the ARP table of the jumphost from where I try the cURL (in the same subnet) it works. 

Please let me know what else I can try...

**Comment by msilcher** [comment]
Same here using Calico and metallb 0.14.4 un L2 mode, downgrading to 0.13.12 works fine. I notices in 0.13.12 logs i see the following: 
{"caller":"main.go:374","event":"serviceAnnounced","ips":["10.5.0.14","fc00:10:5::ff00"],"level":"info","msg":"service has IP, announcing","pool":"first-pool","protocol":"layer2","ts":"2024-04-10T14:21:18Z"} 
This is not the case for 0.14.4, it looks like it is not advertising MAC address via ARP for the service IPs.

**Comment by fedepaol** [comment]
@msilcher is this intermittent / depending on the node? 
Or always? If always, it's not the same issue. If 0.13 works, you might be hitting https://github.com/metallb/metallb/issues/2285

**Comment by fedepaol** [comment]
@Ramshield I don't see the arp responder created for the interfaces 
```
{"caller":"announcer.go:77","event":"announced interface to exclude","interface":"lo","level":"debug","ts":"2024-04-06T22:17:22Z"}
{"caller":"announcer.go:77","event":"announced interface to exclude","interface":"dummy0","level":"debug","ts":"2024-04-06T22:17:22Z"}
{"caller":"announcer.go:77","event":"announced interface to exclude","interface":"tunl0","level":"debug","ts":"2024-04-06T22:17:22Z"}
{"caller":"announcer.go:126","event":"createARPResponder","interface":"enxe6fdabc09322","level":"info","msg":"created ARP responder for interface","ts":"2024-04-06T22:17:22Z"}
{"caller":"announcer.go:135","event":"createNDPResponder","interface":"enxe6fdabc09322","level":"info","msg":"created NDP responder for interface","ts":"2024-04-06T22:17:22Z"}
{"caller":"announcer.go:126","event":"createARPResponder","interface":"enx4ac1b08341a3","level":"info","msg":"created ARP responder for interface","ts":"2024-04-06T22:17:22Z"}
{"caller":"announcer.go:135","event":"createNDPResponder","interface":"enx4ac1b08341a3","level":"info","msg":"created NDP responder for interface","ts":"2024-04-06T22:17:22Z"}
{"caller":"announcer.go:126","event":"createARPResponder","interface":"enx664c43caac6a","level":"info","msg":"created ARP responder for interface","ts":"2024-04-06T22:17:22Z"}
{"caller":"announcer.go:135","event":"createNDPResponder","interface":"enx664c43caac6a","level":"info","msg":"created NDP responder for interface","ts":"2024-04-06T22:17:22Z"}
{"caller":"announcer.go:126","event":"createARPResponder","interface":"cilium_vxlan","level":"info","msg":"created ARP responder for interface","ts":"2024-04-06T22:17:22Z"}
{"caller":"announcer.go:135","event":"createNDPResponder","interface":"cilium_vxlan","level":"info","msg":"created NDP responder for interface","ts":"2024-04-06T22:17:22Z"}
{"caller":"announcer.go:126","event":"createARPResponder","interface":"lxc_health","level":"info","msg":"created ARP responder for interface","ts":"2024-04-06T22:17:22Z"}
{"caller":"announcer.go:135","event":"createNDPResponder","interface":"lxc_health","level":"info","msg":"created NDP responder for interface","ts":"2024-04-06T22:17:22Z"}
{"caller":"announcer.go:126","event":"createARPResponder","interface":"lxc572496b449b5","level":"info","msg":"created ARP responder for interface","ts":"2024-04-06T22:17:22Z"}
{"caller":"announcer.go:135","event":"createNDPResponder","interface":"lxc572496b449b5","level":"info","msg":"created NDP responder for interface","ts":"2024-04-06T22:17:22Z"}
{"caller":"announcer.go:126","event":"createARPResponder","interface":"lxc5ee7bbfd0451","level":"info","msg":"created ARP responder for interface","ts":"2024-04-06T22:17:22Z"}
{"caller":"announcer.go:135","event":"createNDPResponder","interface":"lxc5ee7bbfd0451","level":"info","msg":"created NDP responder for interface","ts":"2024-04-06T22:17:22Z"}
{"caller":"announcer.go:126","event":"createARPResponder","interface":"lxca35a7e9f2719","level":"info","msg":"created ARP responder for interface","ts":"2024-04-06T22:17:22Z"}
{"caller":"announcer.go:135","event":"createNDPResponder","interface":"lxca35a7e9f2719","level":"info","msg":"created NDP responder for interface","ts":"2024-04-06T22:17:22Z"}
{"caller":"announcer.go:126","event":"createARPResponder","interface":"lxc069d2d15c209","level":"info","msg":"created ARP responder for interface","ts":"2024-04-06T22:17:22Z"}
{"caller":"announcer.go:135","event":"createNDPResponder","interface":"lxc069d2d15c209","level":"info","msg":"created NDP responder for interface","ts":"2024-04-06T22:17:22Z"}
{"caller":"announcer.go:126","event":"createARPResponder","interface":"lxc054a6ac110bd","level":"info","msg":"created ARP responder for interface","ts":"2024-04-06T22:17:22Z"}
{"caller":"announcer.go:135","event":"createNDPResponder","interface":"lxc054a6ac110bd","level":"info","msg":"created NDP responder for interface","ts":"2024-04-06T22:17:22Z"}
{"caller":"announcer.go:126","event":"createARPResponder","interface":"lxcfcaad3a2a20f","level":"info","msg":"created ARP responder for interface","ts":"2024-04-06T22:17:22Z"}
{"caller":"announcer.go:135","event":"createNDPResponder","interface":"lxcfcaad3a2a20f","level":"info","msg":"created NDP responder for interface","ts":"2024-04-06T22:17:22Z"}
{"caller":"announcer.go:126","event":"createARPResponder","interface":"lxc2f6b0b51031e","level":"info","msg":"created ARP responder for interface","ts":"2024-04-06T22:17:22Z"}
{"caller":"announcer.go:135","event":"createNDPResponder","interface":"lxc2f6b0b51031e","level":"info","msg":"created NDP responder for interface","ts":"2024-04-06T22:17:22Z"}
{"caller":"announcer.go:126","event":"createARPResponder","interface":"lxcbe6882429342","level":"info","msg":"created ARP responder for interface","ts":"2024-04-06T22:17:22Z"}
{"caller":"announcer.go:135","event":"createNDPResponder","interface":"lxcbe6882429342","level":"info","msg":"created NDP responder for interface","ts":"2024-04-06T22:17:22Z"}
{"caller":"announcer.go:126","event":"createARPResponder","interface":"lxc1d4657b16a8e","level":"info","msg":"created ARP responder for interface","ts":"2024-04-06T22:17:22Z"}
{"caller":"announcer.go:135","event":"createNDPResponder","interface":"lxc1d4657b16a8e","level":"info","msg":"created NDP responder for interface","ts":"2024-04-06T22:17:22Z"}
{"caller":"announcer.go:126","event":"createARPResponder","interface":"lxc7fdf62ea4c7e","level":"info","msg":"created ARP responder for interface","ts":"2024-04-06T22:17:22Z"}
{"caller":"announcer.go:135","event":"createNDPResponder","interface":"lxc7fdf62ea4c7e","level":"info","msg":"created NDP responder for interface","ts":"2024-04-06T22:17:22Z"}
{"caller":"announcer.go:126","event":"createARPResponder","interface":"lxc85576f10abfa","level":"info","msg":"created ARP responder for interface","ts":"2024-04-06T22:17:22Z"}
{"caller":"announcer.go:135","event":"createNDPResponder","interface":"lxc85576f10abfa","level":"info","msg":"created NDP responder for interface","ts":"2024-04-06T22:17:22Z"}
```

this means that one of the checks I wrote about in https://github.com/metallb/metallb/issues/2344#issuecomment-2039277253 is preventing the interface to be listened.

Can you check the value of : 
- "/sys/class/net/" + ifi.Name + "/master"
- "/sys/class/net/" + ifi.Name + "/flags"
- the output of ip a to check if broadcast is enabled?

**Comment by fedepaol** [comment]
this reminds me we should also add lxc to the excluded interfaces

**Comment by msilcher** [comment]
> @msilcher is this intermittent / depending on the node? Or always? If always, it's not the same issue. If 0.13 works, you might be hitting #2285

I was not aware of this bug. I'm on a single-node test environment. Just read the t-shoot guide about the label "node.kubernetes.io/exclude-from-external-load-balancers" which is in fact my case. Not sure why this label exists in my node, never had to deal with it before. I'll try to remove it and test or use the "--ignore-exclude-lb" approach.

Thank for pointing this out!

**Comment by fedepaol** [comment]
> > @msilcher is this intermittent / depending on the node? Or always? If always, it's not the same issue. If 0.13 works, you might be hitting #2285
> 
> I was not aware of this bug. I'm on a single-node test environment. Just read the t-shoot guide about the label "node.kubernetes.io/exclude-from-external-load-balancers" which is in fact my case. Not sure why this label exists in my node, never had to deal with it before. I'll try to remove it and test or use the "--ignore-exclude-lb" approach.
> 
> Thank for pointing this out!

Actually, it's not a bug!

**Comment by msilcher** [comment]
> > > @msilcher is this intermittent / depending on the node? Or always? If always, it's not the same issue. If 0.13 works, you might be hitting #2285
> > 
> > 
> > I was not aware of this bug. I'm on a single-node test environment. Just read the t-shoot guide about the label "node.kubernetes.io/exclude-from-external-load-balancers" which is in fact my case. Not sure why this label exists in my node, never had to deal with it before. I'll try to remove it and test or use the "--ignore-exclude-lb" approach.
> > Thank for pointing this out!
> 
> Actually, it's not a bug!

I imagine it is a new feature :)

I ended up removing the node label and everything seems to work fine so far (v0.14.4).

Thanks again!

**Comment by pschichtel** [comment]
I might be hitting this one as well with one specific service. It is the only service that has the `metallb.universe.tf/allow-shared-ip` where a second service shares that IP.

I have metallb 0.14.4 on RKE 1.27.12 with calico in BGP mode. I can reach the port on the pod via the cluster IP without trouble, but tcpdump in the container shows nothing when I attempt the connection via the load balancer IP. The route correctly arrived at our router. When I run tcpdump on the node for the load balancer IP and attempt a connection from another system I do see some TCP frame repeatedly, but no complete handshake or even data. When I attempt the connection on the same node as the pod, then the connection works fine even with the load balancer IP, but nothing shows up in tcpdump (I assume it gets NATed to the container before it shows up in tcpdump)

To me it feels like routing and kube-proxy work fine, but something gets messed up in the iptables on the node.

Can I safely downgrade to find out which version introduced the issue?

**Comment by pschichtel** [comment]
Ok I found the cause: The service had `allocateLoadBalancerNodePorts: false`, which apparently stopped working at some point.

**Comment by fedepaol** [comment]
closing this as solved, feel free to reopen in case there's something missing

**Comment by pschichtel** [comment]
@fedepaol is the `allocateLoadBalancerNodePorts: false` requirement documented somewhere?

**Comment by fedepaol** [comment]
> @fedepaol is the `allocateLoadBalancerNodePorts: false` requirement documented somewhere?

Only here https://kubernetes.io/docs/concepts/services-networking/service/#load-balancer-nodeport-allocation I guess.
But if it's what's preventing your LB to work, it must be checked on the CNI side, MetalLB doesn't handle the field in any special manner.

**Comment by pschichtel** [comment]
I've seen that documentation, specifically:

> This should only be used for load balancer implementations that route traffic directly to pods as opposed to using node ports.

My question is: How would I find out that MetalLB routes traffic to NodePorts instead of directly to pods?

**Comment by fedepaol** [comment]
> I've seen that documentation, specifically:
> 
> > This should only be used for load balancer implementations that route traffic directly to pods as opposed to using node ports.
> 
> My question is: How would I find out that MetalLB routes traffic to NodePorts instead of directly to pods?

MetalLB doesn't route any traffic, it "just" attracts the traffic directed to the LB IP on the nodes. Once the traffic with dst=lb ip is on the node, all the rest is handled by the CNI, including dnatting to the nodeport or directly to the pod ip or to the clusterip.
That's why I wrote it must be checked on the CNI side.

**Comment by pschichtel** [comment]
Ah ok, I had the impression that MetalLB sets up some NAT rules itself while diagnosing this.
